"","date","num_comments","title","subreddit","URL"
"1","15-08-19",52,"The top data science skills according to indeed.com by number of jobs requiring this skill","datascience","http://www.reddit.com/r/datascience/comments/cqneli/the_top_data_science_skills_according_to/"
"2","04-12-17",16,"Whats that one book you read that took your data science skills to the next level?","datascience","http://www.reddit.com/r/datascience/comments/7hf0gr/whats_that_one_book_you_read_that_took_your_data/"
"3","18-01-16",6,"New Job. Long Story. I need to learn some data science skills and fast.","datascience","http://www.reddit.com/r/datascience/comments/41ldh3/new_job_long_story_i_need_to_learn_some_data/"
"4","02-10-19",18,"[SUCCESS STORY] Courting a big N company from the outside: A retrospective","cscareerquestions","http://www.reddit.com/r/cscareerquestions/comments/dc46oy/success_story_courting_a_big_n_company_from_the/"
"5","12-03-20",4,"Jobs to build data science skills","jobs","http://www.reddit.com/r/jobs/comments/fhkwm4/jobs_to_build_data_science_skills/"
"6","04-03-20",8,"How many data science skills do you have?","datascience","http://www.reddit.com/r/datascience/comments/fdg6lm/how_many_data_science_skills_do_you_have/"
"7","14-03-20",1,"""Artificial Intelligence and Data Science Skills explained by Real-Life Data Scientists"" by Springboard India","aivideos","http://www.reddit.com/r/aivideos/comments/fib182/artificial_intelligence_and_data_science_skills/"
"8","03-03-20",0,"How To Practice Data Science Skills On A Budget","u_BeamKumar1989","http://www.reddit.com/r/u_BeamKumar1989/comments/fcxerv/how_to_practice_data_science_skills_on_a_budget/"
"9","04-03-20",1,"""Prerequisites to Learn Data Science | Data Science Skills | Intellipaat what is data science"" by Intellipaat","aivideos","http://www.reddit.com/r/aivideos/comments/fd4sjz/prerequisites_to_learn_data_science_data_science/"
"10","08-01-20",2,"Improve data science skills","cscareerquestions","http://www.reddit.com/r/cscareerquestions/comments/elupjf/improve_data_science_skills/"
"11","10-01-20",4,"Is there a shortage of software and data science skills in Biotech?","biotech","http://www.reddit.com/r/biotech/comments/emyl84/is_there_a_shortage_of_software_and_data_science/"
"12","21-01-20",0,"Data Science Skills Going Beyond Math and Tech","u_therandomvariable25","http://www.reddit.com/r/u_therandomvariable25/comments/ersfqf/data_science_skills_going_beyond_math_and_tech/"
"13","13-01-20",0,"Data Science Skills &amp; Going Beyond Math and Tech | The Random Variable","u_therandomvariable25","http://www.reddit.com/r/u_therandomvariable25/comments/eo46i1/data_science_skills_going_beyond_math_and_tech/"
"14","08-01-20",0,"Top 5 must-have Data Science skills for 2020","u_Dean-Hoffman","http://www.reddit.com/r/u_Dean-Hoffman/comments/elvjyb/top_5_musthave_data_science_skills_for_2020/"
"15","24-12-19",0,"Data Science Skills &amp; Going Beyond Math and Tech | The Random Variable","u_therandomvariable25","http://www.reddit.com/r/u_therandomvariable25/comments/ef18tx/data_science_skills_going_beyond_math_and_tech/"
"16","04-01-20",0,"Data Science Skills &amp; Going Beyond Math and Tech | The Random Variable","u_therandomvariable25","http://www.reddit.com/r/u_therandomvariable25/comments/ejulhd/data_science_skills_going_beyond_math_and_tech/"
"17","12-07-19",64,"What is an Underrated Data Science Skill?","datascience","http://www.reddit.com/r/datascience/comments/ccc39k/what_is_an_underrated_data_science_skill/"
"18","20-12-19",0,"The most in-demand data science skills you need","business","http://www.reddit.com/r/business/comments/edas19/the_most_indemand_data_science_skills_you_need/"
"19","11-11-19",5,"What else can I do with data science skills?","Entrepreneur","http://www.reddit.com/r/Entrepreneur/comments/dutftw/what_else_can_i_do_with_data_science_skills/"
"20","10-12-19",0,"Data Science Professional wants to learn Cyber security and apply data science skills to cyber security","cybersecurity","http://www.reddit.com/r/cybersecurity/comments/e8puuj/data_science_professional_wants_to_learn_cyber/"
"21","05-11-19",0,"Data Science Skills for Professionals in Chennai","trainingcourses","http://www.reddit.com/r/trainingcourses/comments/drwqg3/data_science_skills_for_professionals_in_chennai/"
"22","26-09-19",1,"The 5+ in-demand Data Science Skills Companies Need","learnmachinelearning","http://www.reddit.com/r/learnmachinelearning/comments/d9gh22/the_5_indemand_data_science_skills_companies_need/"
"23","11-10-19",0,"[Link] Which Data Science Skills are core and which are hot/emerging ones? via KDnuggets blog","u_Tonya_at_ZestApp","http://www.reddit.com/r/u_Tonya_at_ZestApp/comments/dg8vyc/link_which_data_science_skills_are_core_and_which/"
"24","12-07-19",7,"Completely putting aside career and academic-related achievements, how have your Data Science skills positively impacted or otherwise carried over into your regular life?","datascience","http://www.reddit.com/r/datascience/comments/ccfcre/completely_putting_aside_career_and/"
"25","19-08-19",5,"What kind of career combines Cyber/Information Security and Data Science skills?","cscareerquestions","http://www.reddit.com/r/cscareerquestions/comments/csbk87/what_kind_of_career_combines_cyberinformation/"
"26","15-08-19",52,"The top data science skills according to indeed.com by number of jobs requiring this skill","datascience","http://www.reddit.com/r/datascience/comments/cqneli/the_top_data_science_skills_according_to/"
"27","19-09-17",108,"How I went from no coding or machine learning experience to data scientist job offer in 20 months. [x-post r/learnprogramming]","datascience","http://www.reddit.com/r/datascience/comments/713hnw/how_i_went_from_no_coding_or_machine_learning/"
"28","21-06-19",26,"Feminism and the Duluth Model.","MensRights","http://www.reddit.com/r/MensRights/comments/c3513m/feminism_and_the_duluth_model/"
"29","17-05-19",3,"Resume for transition into Data Analyst role","resumes","http://www.reddit.com/r/resumes/comments/bplkpd/resume_for_transition_into_data_analyst_role/"
"30","04-12-17",16,"Whats that one book you read that took your data science skills to the next level?","datascience","http://www.reddit.com/r/datascience/comments/7hf0gr/whats_that_one_book_you_read_that_took_your_data/"
"31","18-01-16",6,"New Job. Long Story. I need to learn some data science skills and fast.","datascience","http://www.reddit.com/r/datascience/comments/41ldh3/new_job_long_story_i_need_to_learn_some_data/"
"32","01-10-19",11,"Data Science Manager Knowledge","datascience","http://www.reddit.com/r/datascience/comments/dbrtw0/data_science_manager_knowledge/"
"33","08-09-19",37,"People of this sub who have jobs as Data Scientists/ ML Engineers/ DL Engineers etc. What skills or technologies would you advice new grads to learn?","cscareerquestions","http://www.reddit.com/r/cscareerquestions/comments/d1fqwd/people_of_this_sub_who_have_jobs_as_data/"
"34","12-10-17",1,"Best skills for data engineer working in that capacity","cscareerquestions","http://www.reddit.com/r/cscareerquestions/comments/75twav/best_skills_for_data_engineer_working_in_that/"
"35","20-06-19",9,"The Skills That Data Analysts Need to Master","dataanalysis","http://www.reddit.com/r/dataanalysis/comments/c2r8uq/the_skills_that_data_analysts_need_to_master/"
"36","16-03-20",0,"B.Sc.(Fire &amp; Safety Management) Course | Viswas Institute of Fire Engineering and Safety Management Bachelor of Science (Fire Engineering and Industrial Safety MGMT) could be a program initiated by the VIFSM. the most objective of this program is to boost data, skills and awareness among the scholar","u_firecare","http://www.reddit.com/r/u_firecare/comments/fjh9lu/bscfire_safety_management_course_viswas_institute/"
"37","18-12-19",8,"Top IO data skills?","IOPsychology","http://www.reddit.com/r/IOPsychology/comments/ecgdab/top_io_data_skills/"
"38","31-01-20",0,"@pewresearch: RT @pewjournalism: Have strong data skills? Love journalism? Come work for us this summer as an intern! More info &amp; application found here: https://t.co/aZMtT68rgS https://t.co/XpKUKImhSm","newsbotbot","http://www.reddit.com/r/newsbotbot/comments/ewwdgu/pewresearch_rt_pewjournalism_have_strong_data/"
"39","28-01-20",0,"Data skills could soon be more important than people skills. Train up with these courses","Ranzware","http://www.reddit.com/r/Ranzware/comments/ev5z02/data_skills_could_soon_be_more_important_than/"
"40","24-01-20",0,"Data Skills Gap Costing USD Billions in Lost Productivity","u_indvstrvs","http://www.reddit.com/r/u_indvstrvs/comments/et5527/data_skills_gap_costing_usd_billions_in_lost/"
"41","10-01-20",0,"@pewresearch: RT @pewjournalism: Have strong data skills? Love journalism? Come work for us this summer as an intern! More info &amp; application found here: https://t.co/aZMtT68rgS https://t.co/iiQLjsLbAc","newsbotbot","http://www.reddit.com/r/newsbotbot/comments/emwdms/pewresearch_rt_pewjournalism_have_strong_data/"
"42","17-12-19",0,"Thailand to train 1,000 government officers on big data skills in 2020","ThailandNews","http://www.reddit.com/r/ThailandNews/comments/ebsjhb/thailand_to_train_1000_government_officers_on_big/"
"43","16-12-19",0,"[Business] - Depa aims to train 1,000 officials in big data skills | Bangkok Post","AutoNewspaper","http://www.reddit.com/r/AutoNewspaper/comments/eb7f0f/business_depa_aims_to_train_1000_officials_in_big/"
"44","01-12-19",0,"Week in review: The data skills gap, new Kali Linux release, Apache Solr RCEs with public PoCs https://t.co/lrEawCclEV","digitalmunition","http://www.reddit.com/r/digitalmunition/comments/e4klat/week_in_review_the_data_skills_gap_new_kali_linux/"
"45","16-12-19",0,"[Business] - Depa aims to train 1,000 officials in big data skills","BANGKOKPOSTauto","http://www.reddit.com/r/BANGKOKPOSTauto/comments/eb7e58/business_depa_aims_to_train_1000_officials_in_big/"
"46","13-06-19",12,"YSK The New York Times has a course to teach its reporters data skills, and now theyve open-sourced it","YouShouldKnow","http://www.reddit.com/r/YouShouldKnow/comments/bzzx3v/ysk_the_new_york_times_has_a_course_to_teach_its/"
"47","27-11-19",0,"Theres no way to fill the data skills gap, what now? https://t.co/KyNC8cB3MV","digitalmunition","http://www.reddit.com/r/digitalmunition/comments/e2ch5v/theres_no_way_to_fill_the_data_skills_gap_what/"
"48","12-06-19",18,"The New York Times has a course to teach its reporters data skills, and now theyve open-sourced it (Course materials in comments)","datascience","http://www.reddit.com/r/datascience/comments/bzygxl/the_new_york_times_has_a_course_to_teach_its/"
"49","12-11-19",0,"Venture into programming while leveraging Data skills, is this a good idea for the next 5- 10 years of my career?","cscareerquestions","http://www.reddit.com/r/cscareerquestions/comments/dv2fet/venture_into_programming_while_leveraging_data/"
"50","16-06-19",8,"The New York Times has a course to teach its reporters data skills, and now theyve open-sourced it","technology","http://www.reddit.com/r/technology/comments/c19rgl/the_new_york_times_has_a_course_to_teach_its/"
"51","15-08-19",52,"The top data science skills according to indeed.com by number of jobs requiring this skill","datascience","http://www.reddit.com/r/datascience/comments/cqneli/the_top_data_science_skills_according_to/"
"52","19-09-17",108,"How I went from no coding or machine learning experience to data scientist job offer in 20 months. [x-post r/learnprogramming]","datascience","http://www.reddit.com/r/datascience/comments/713hnw/how_i_went_from_no_coding_or_machine_learning/"
"53","21-06-19",26,"Feminism and the Duluth Model.","MensRights","http://www.reddit.com/r/MensRights/comments/c3513m/feminism_and_the_duluth_model/"
"54","17-05-19",3,"Resume for transition into Data Analyst role","resumes","http://www.reddit.com/r/resumes/comments/bplkpd/resume_for_transition_into_data_analyst_role/"
"55","04-12-17",16,"Whats that one book you read that took your data science skills to the next level?","datascience","http://www.reddit.com/r/datascience/comments/7hf0gr/whats_that_one_book_you_read_that_took_your_data/"
"56","18-01-16",6,"New Job. Long Story. I need to learn some data science skills and fast.","datascience","http://www.reddit.com/r/datascience/comments/41ldh3/new_job_long_story_i_need_to_learn_some_data/"
"57","01-10-19",11,"Data Science Manager Knowledge","datascience","http://www.reddit.com/r/datascience/comments/dbrtw0/data_science_manager_knowledge/"
"58","08-09-19",37,"People of this sub who have jobs as Data Scientists/ ML Engineers/ DL Engineers etc. What skills or technologies would you advice new grads to learn?","cscareerquestions","http://www.reddit.com/r/cscareerquestions/comments/d1fqwd/people_of_this_sub_who_have_jobs_as_data/"
"59","12-10-17",1,"Best skills for data engineer working in that capacity","cscareerquestions","http://www.reddit.com/r/cscareerquestions/comments/75twav/best_skills_for_data_engineer_working_in_that/"
"60","20-06-19",9,"The Skills That Data Analysts Need to Master","dataanalysis","http://www.reddit.com/r/dataanalysis/comments/c2r8uq/the_skills_that_data_analysts_need_to_master/"
"61","16-03-20",0,"B.Sc.(Fire &amp; Safety Management) Course | Viswas Institute of Fire Engineering and Safety Management Bachelor of Science (Fire Engineering and Industrial Safety MGMT) could be a program initiated by the VIFSM. the most objective of this program is to boost data, skills and awareness among the scholar","u_firecare","http://www.reddit.com/r/u_firecare/comments/fjh9lu/bscfire_safety_management_course_viswas_institute/"
"62","18-12-19",8,"Top IO data skills?","IOPsychology","http://www.reddit.com/r/IOPsychology/comments/ecgdab/top_io_data_skills/"
"63","31-01-20",0,"@pewresearch: RT @pewjournalism: Have strong data skills? Love journalism? Come work for us this summer as an intern! More info &amp; application found here: https://t.co/aZMtT68rgS https://t.co/XpKUKImhSm","newsbotbot","http://www.reddit.com/r/newsbotbot/comments/ewwdgu/pewresearch_rt_pewjournalism_have_strong_data/"
"64","28-01-20",0,"Data skills could soon be more important than people skills. Train up with these courses","Ranzware","http://www.reddit.com/r/Ranzware/comments/ev5z02/data_skills_could_soon_be_more_important_than/"
"65","24-01-20",0,"Data Skills Gap Costing USD Billions in Lost Productivity","u_indvstrvs","http://www.reddit.com/r/u_indvstrvs/comments/et5527/data_skills_gap_costing_usd_billions_in_lost/"
"66","10-01-20",0,"@pewresearch: RT @pewjournalism: Have strong data skills? Love journalism? Come work for us this summer as an intern! More info &amp; application found here: https://t.co/aZMtT68rgS https://t.co/iiQLjsLbAc","newsbotbot","http://www.reddit.com/r/newsbotbot/comments/emwdms/pewresearch_rt_pewjournalism_have_strong_data/"
"67","17-12-19",0,"Thailand to train 1,000 government officers on big data skills in 2020","ThailandNews","http://www.reddit.com/r/ThailandNews/comments/ebsjhb/thailand_to_train_1000_government_officers_on_big/"
"68","16-12-19",0,"[Business] - Depa aims to train 1,000 officials in big data skills | Bangkok Post","AutoNewspaper","http://www.reddit.com/r/AutoNewspaper/comments/eb7f0f/business_depa_aims_to_train_1000_officials_in_big/"
"69","13-06-19",12,"YSK The New York Times has a course to teach its reporters data skills, and now theyve open-sourced it","YouShouldKnow","http://www.reddit.com/r/YouShouldKnow/comments/bzzx3v/ysk_the_new_york_times_has_a_course_to_teach_its/"
"70","01-12-19",0,"Week in review: The data skills gap, new Kali Linux release, Apache Solr RCEs with public PoCs https://t.co/lrEawCclEV","digitalmunition","http://www.reddit.com/r/digitalmunition/comments/e4klat/week_in_review_the_data_skills_gap_new_kali_linux/"
"71","16-12-19",0,"[Business] - Depa aims to train 1,000 officials in big data skills","BANGKOKPOSTauto","http://www.reddit.com/r/BANGKOKPOSTauto/comments/eb7e58/business_depa_aims_to_train_1000_officials_in_big/"
"72","27-11-19",0,"Theres no way to fill the data skills gap, what now? https://t.co/KyNC8cB3MV","digitalmunition","http://www.reddit.com/r/digitalmunition/comments/e2ch5v/theres_no_way_to_fill_the_data_skills_gap_what/"
"73","12-06-19",18,"The New York Times has a course to teach its reporters data skills, and now theyve open-sourced it (Course materials in comments)","datascience","http://www.reddit.com/r/datascience/comments/bzygxl/the_new_york_times_has_a_course_to_teach_its/"
"74","12-11-19",0,"Venture into programming while leveraging Data skills, is this a good idea for the next 5- 10 years of my career?","cscareerquestions","http://www.reddit.com/r/cscareerquestions/comments/dv2fet/venture_into_programming_while_leveraging_data/"
"75","16-06-19",8,"The New York Times has a course to teach its reporters data skills, and now theyve open-sourced it","technology","http://www.reddit.com/r/technology/comments/c19rgl/the_new_york_times_has_a_course_to_teach_its/"
"76","09-12-18",0,"Top Data Science Tools","BigDataAnalyticsNews","http://www.reddit.com/r/BigDataAnalyticsNews/comments/a4it8i/top_data_science_tools/"
"77","09-10-19",0,"The use of Data Science tools in SME Industry.","u_prashantnet","http://www.reddit.com/r/u_prashantnet/comments/dfdrer/the_use_of_data_science_tools_in_sme_industry/"
"78","22-06-19",140,"My issue with ""data science""","datascience","http://www.reddit.com/r/datascience/comments/c3vycx/my_issue_with_data_science/"
"79","03-02-19",44,"Some Important Data Science Tools that arent Python, R, SQL or Math","datascience","http://www.reddit.com/r/datascience/comments/amsdk2/some_important_data_science_tools_that_arent/"
"80","15-07-19",4,"SFO Airport - Measurement Map (2014) [OC]","dataisbeautiful","http://www.reddit.com/r/dataisbeautiful/comments/cdcnrf/sfo_airport_measurement_map_2014_oc/"
"81","16-10-13",58,"Good Old Excel Is The Ultimate Data Visualization Tool","dataisbeautiful","http://www.reddit.com/r/dataisbeautiful/comments/1oknce/good_old_excel_is_the_ultimate_data_visualization/"
"82","11-12-15",1,"Data visualization of Star Wars' performance on social media + testing Microsoft's new presentation tool [OC]","dataisbeautiful","http://www.reddit.com/r/dataisbeautiful/comments/3wf3yd/data_visualization_of_star_wars_performance_on/"
"83","15-03-16",34,"What Data Visualization Tools Do /r/DataIsBeautiful OC Creators Use? [OC]","dataisbeautiful","http://www.reddit.com/r/dataisbeautiful/comments/4aihd4/what_data_visualization_tools_do_rdataisbeautiful/"
"84","28-02-20",7,"Huge shout-out to the USGS Water Data Tool!","Kayaking","http://www.reddit.com/r/Kayaking/comments/fayyss/huge_shoutout_to_the_usgs_water_data_tool/"
"85","06-03-20",7,"Data Tools Available","magicTCG","http://www.reddit.com/r/magicTCG/comments/feibhz/data_tools_available/"
"86","15-03-20",0,"Github - red-data-tools/GR.rb - GR framework - the graphics library for visualization - for Ruby","ruby","http://www.reddit.com/r/ruby/comments/fj1i93/github_reddatatoolsgrrb_gr_framework_the_graphics/"
"87","03-02-20",8,"Is there a reason almost all big data tools are written in Java?","dataengineering","http://www.reddit.com/r/dataengineering/comments/exzhwi/is_there_a_reason_almost_all_big_data_tools_are/"
"88","16-03-20",0,"15 Big Data Tools I can recommend","Hacking_Tutorials","http://www.reddit.com/r/Hacking_Tutorials/comments/fjf69u/15_big_data_tools_i_can_recommend/"
"89","10-01-20",15,"Rail ridership is up, bus ridership may be leveling off, and we can learn all this from a new Metro data tool","washingtondc","http://www.reddit.com/r/washingtondc/comments/emwb98/rail_ridership_is_up_bus_ridership_may_be/"
"90","02-03-20",0,"Facebook's Download-Your-Data Tool Is Incomplete","facebook","http://www.reddit.com/r/facebook/comments/fcdewh/facebooks_downloadyourdata_tool_is_incomplete/"
"91","10-03-20",0,"DIA releases RFP for Intelligence Mission Data Tool","IntelligenceNews","http://www.reddit.com/r/IntelligenceNews/comments/fgblqw/dia_releases_rfp_for_intelligence_mission_data/"
"92","21-01-20",16,"Tech Stack help: ABM intent data tools","sales","http://www.reddit.com/r/sales/comments/erzqk0/tech_stack_help_abm_intent_data_tools/"
"93","08-03-20",0,"Universal Data Tool  open-source collaborative data labeling","bprogramming","http://www.reddit.com/r/bprogramming/comments/ff8gwq/universal_data_tool_opensource_collaborative_data/"
"94","02-03-20",1,"Facebook's Download-Your-Data Tool Is Incomplete","hackernews","http://www.reddit.com/r/hackernews/comments/fchxh9/facebooks_downloadyourdata_tool_is_incomplete/"
"95","11-03-20",0,"@pewresearch: RT @lrainie: This @pewresearch initiative gives away FRESH polling data for others to study. Please play with our data tools https://t.co/8E82JLCTOv and the full dataset, which can be downloaded at https://t.co/Hr5vUjSOFG https://t.co/VRJLlgkPCM","newsbotbot","http://www.reddit.com/r/newsbotbot/comments/fh4xci/pewresearch_rt_lrainie_this_pewresearch/"
"96","15-01-20",21,"Would like to know which big data tools on AWS, Azure and GCP are good.","bigdata","http://www.reddit.com/r/bigdata/comments/ep20wb/would_like_to_know_which_big_data_tools_on_aws/"
"97","14-02-20",2,"Common big data tools that I get asked about on interviews. Which should I learn and possible to self teach?","bigdata","http://www.reddit.com/r/bigdata/comments/f3ycet/common_big_data_tools_that_i_get_asked_about_on/"
"98","03-03-20",0,"@pewresearch: RT @pewmethods: Love working with data? Want to understand how news media habits affect election attitudes? Use the @pewjournalism Election News Pathways online data tool to examine election-related survey questions by media trait or demographic group: https://t.co/UNcjRC74qS","newsbotbot","http://www.reddit.com/r/newsbotbot/comments/fcx7ol/pewresearch_rt_pewmethods_love_working_with_data/"
"99","08-02-20",2,"A Data Tool to Compare Historical Data of nCov/SARS/Swine/Ebola","China_Flu","http://www.reddit.com/r/China_Flu/comments/f0n7c5/a_data_tool_to_compare_historical_data_of/"
"100","02-03-20",0,"Facebook's Download-Your-Data Tool Is Incomplete","AntiFANG","http://www.reddit.com/r/AntiFANG/comments/fcg2fo/facebooks_downloadyourdata_tool_is_incomplete/"
"101","22-06-19",140,"My issue with ""data science""","datascience","http://www.reddit.com/r/datascience/comments/c3vycx/my_issue_with_data_science/"
"102","03-02-19",44,"Some Important Data Science Tools that arent Python, R, SQL or Math","datascience","http://www.reddit.com/r/datascience/comments/amsdk2/some_important_data_science_tools_that_arent/"
"103","15-07-19",4,"SFO Airport - Measurement Map (2014) [OC]","dataisbeautiful","http://www.reddit.com/r/dataisbeautiful/comments/cdcnrf/sfo_airport_measurement_map_2014_oc/"
"104","16-10-13",58,"Good Old Excel Is The Ultimate Data Visualization Tool","dataisbeautiful","http://www.reddit.com/r/dataisbeautiful/comments/1oknce/good_old_excel_is_the_ultimate_data_visualization/"
"105","11-12-15",1,"Data visualization of Star Wars' performance on social media + testing Microsoft's new presentation tool [OC]","dataisbeautiful","http://www.reddit.com/r/dataisbeautiful/comments/3wf3yd/data_visualization_of_star_wars_performance_on/"
"106","15-03-16",34,"What Data Visualization Tools Do /r/DataIsBeautiful OC Creators Use? [OC]","dataisbeautiful","http://www.reddit.com/r/dataisbeautiful/comments/4aihd4/what_data_visualization_tools_do_rdataisbeautiful/"
"107","28-02-20",7,"Huge shout-out to the USGS Water Data Tool!","Kayaking","http://www.reddit.com/r/Kayaking/comments/fayyss/huge_shoutout_to_the_usgs_water_data_tool/"
"108","06-03-20",7,"Data Tools Available","magicTCG","http://www.reddit.com/r/magicTCG/comments/feibhz/data_tools_available/"
"109","03-02-20",8,"Is there a reason almost all big data tools are written in Java?","dataengineering","http://www.reddit.com/r/dataengineering/comments/exzhwi/is_there_a_reason_almost_all_big_data_tools_are/"
"110","10-01-20",15,"Rail ridership is up, bus ridership may be leveling off, and we can learn all this from a new Metro data tool","washingtondc","http://www.reddit.com/r/washingtondc/comments/emwb98/rail_ridership_is_up_bus_ridership_may_be/"
"111","21-01-20",16,"Tech Stack help: ABM intent data tools","sales","http://www.reddit.com/r/sales/comments/erzqk0/tech_stack_help_abm_intent_data_tools/"
"112","02-03-20",1,"Facebook's Download-Your-Data Tool Is Incomplete","hackernews","http://www.reddit.com/r/hackernews/comments/fchxh9/facebooks_downloadyourdata_tool_is_incomplete/"
"113","15-01-20",21,"Would like to know which big data tools on AWS, Azure and GCP are good.","bigdata","http://www.reddit.com/r/bigdata/comments/ep20wb/would_like_to_know_which_big_data_tools_on_aws/"
"114","14-02-20",2,"Common big data tools that I get asked about on interviews. Which should I learn and possible to self teach?","bigdata","http://www.reddit.com/r/bigdata/comments/f3ycet/common_big_data_tools_that_i_get_asked_about_on/"
"115","08-02-20",2,"A Data Tool to Compare Historical Data of nCov/SARS/Swine/Ebola","China_Flu","http://www.reddit.com/r/China_Flu/comments/f0n7c5/a_data_tool_to_compare_historical_data_of/"
"116","15-08-19",52,"The top data science skills according to indeed.com by number of jobs requiring this skill","datascience","http://www.reddit.com/r/datascience/comments/cqneli/the_top_data_science_skills_according_to/"
"117","19-09-17",108,"How I went from no coding or machine learning experience to data scientist job offer in 20 months. [x-post r/learnprogramming]","datascience","http://www.reddit.com/r/datascience/comments/713hnw/how_i_went_from_no_coding_or_machine_learning/"
"118","17-05-19",3,"Resume for transition into Data Analyst role","resumes","http://www.reddit.com/r/resumes/comments/bplkpd/resume_for_transition_into_data_analyst_role/"
