"","date","num_comments","title","subreddit","URL"
"119","04-12-17",16,"Whats that one book you read that took your data science skills to the next level?","datascience","http://www.reddit.com/r/datascience/comments/7hf0gr/whats_that_one_book_you_read_that_took_your_data/"
"120","18-01-16",6,"New Job. Long Story. I need to learn some data science skills and fast.","datascience","http://www.reddit.com/r/datascience/comments/41ldh3/new_job_long_story_i_need_to_learn_some_data/"
"121","01-10-19",11,"Data Science Manager Knowledge","datascience","http://www.reddit.com/r/datascience/comments/dbrtw0/data_science_manager_knowledge/"
"122","21-06-19",26,"Feminism and the Duluth Model.","MensRights","http://www.reddit.com/r/MensRights/comments/c3513m/feminism_and_the_duluth_model/"
"123","08-09-19",37,"People of this sub who have jobs as Data Scientists/ ML Engineers/ DL Engineers etc. What skills or technologies would you advice new grads to learn?","cscareerquestions","http://www.reddit.com/r/cscareerquestions/comments/d1fqwd/people_of_this_sub_who_have_jobs_as_data/"
"124","12-10-17",1,"Best skills for data engineer working in that capacity","cscareerquestions","http://www.reddit.com/r/cscareerquestions/comments/75twav/best_skills_for_data_engineer_working_in_that/"
"125","20-06-19",9,"The Skills That Data Analysts Need to Master","dataanalysis","http://www.reddit.com/r/dataanalysis/comments/c2r8uq/the_skills_that_data_analysts_need_to_master/"
"126","18-12-19",8,"Top IO data skills?","IOPsychology","http://www.reddit.com/r/IOPsychology/comments/ecgdab/top_io_data_skills/"
"127","13-06-19",12,"YSK The New York Times has a course to teach its reporters data skills, and now theyve open-sourced it","YouShouldKnow","http://www.reddit.com/r/YouShouldKnow/comments/bzzx3v/ysk_the_new_york_times_has_a_course_to_teach_its/"
"128","12-06-19",18,"The New York Times has a course to teach its reporters data skills, and now theyve open-sourced it (Course materials in comments)","datascience","http://www.reddit.com/r/datascience/comments/bzygxl/the_new_york_times_has_a_course_to_teach_its/"
"129","16-06-19",8,"The New York Times has a course to teach its reporters data skills, and now theyve open-sourced it","technology","http://www.reddit.com/r/technology/comments/c19rgl/the_new_york_times_has_a_course_to_teach_its/"
"130","15-08-19",52,"The top data science skills according to indeed.com by number of jobs requiring this skill","datascience","http://www.reddit.com/r/datascience/comments/cqneli/the_top_data_science_skills_according_to/"
"212","04-12-17",16,"Whats that one book you read that took your data science skills to the next level?","datascience","http://www.reddit.com/r/datascience/comments/7hf0gr/whats_that_one_book_you_read_that_took_your_data/"
"312","18-01-16",6,"New Job. Long Story. I need to learn some data science skills and fast.","datascience","http://www.reddit.com/r/datascience/comments/41ldh3/new_job_long_story_i_need_to_learn_some_data/"
"412","02-10-19",18,"[SUCCESS STORY] Courting a big N company from the outside: A retrospective","cscareerquestions","http://www.reddit.com/r/cscareerquestions/comments/dc46oy/success_story_courting_a_big_n_company_from_the/"
"512","12-03-20",4,"Jobs to build data science skills","jobs","http://www.reddit.com/r/jobs/comments/fhkwm4/jobs_to_build_data_science_skills/"
"612","04-03-20",8,"How many data science skills do you have?","datascience","http://www.reddit.com/r/datascience/comments/fdg6lm/how_many_data_science_skills_do_you_have/"
"710","14-03-20",1,"""Artificial Intelligence and Data Science Skills explained by Real-Life Data Scientists"" by Springboard India","aivideos","http://www.reddit.com/r/aivideos/comments/fib182/artificial_intelligence_and_data_science_skills/"
"810","03-03-20",0,"How To Practice Data Science Skills On A Budget","u_BeamKumar1989","http://www.reddit.com/r/u_BeamKumar1989/comments/fcxerv/how_to_practice_data_science_skills_on_a_budget/"
"910","04-03-20",1,"""Prerequisites to Learn Data Science | Data Science Skills | Intellipaat what is data science"" by Intellipaat","aivideos","http://www.reddit.com/r/aivideos/comments/fd4sjz/prerequisites_to_learn_data_science_data_science/"
"1010","08-01-20",2,"Improve data science skills","cscareerquestions","http://www.reddit.com/r/cscareerquestions/comments/elupjf/improve_data_science_skills/"
"1110","10-01-20",4,"Is there a shortage of software and data science skills in Biotech?","biotech","http://www.reddit.com/r/biotech/comments/emyl84/is_there_a_shortage_of_software_and_data_science/"
"1210","21-01-20",0,"Data Science Skills Going Beyond Math and Tech","u_therandomvariable25","http://www.reddit.com/r/u_therandomvariable25/comments/ersfqf/data_science_skills_going_beyond_math_and_tech/"
"132","13-01-20",0,"Data Science Skills &amp; Going Beyond Math and Tech | The Random Variable","u_therandomvariable25","http://www.reddit.com/r/u_therandomvariable25/comments/eo46i1/data_science_skills_going_beyond_math_and_tech/"
"142","08-01-20",0,"Top 5 must-have Data Science skills for 2020","u_Dean-Hoffman","http://www.reddit.com/r/u_Dean-Hoffman/comments/elvjyb/top_5_musthave_data_science_skills_for_2020/"
"152","24-12-19",0,"Data Science Skills &amp; Going Beyond Math and Tech | The Random Variable","u_therandomvariable25","http://www.reddit.com/r/u_therandomvariable25/comments/ef18tx/data_science_skills_going_beyond_math_and_tech/"
"162","04-01-20",0,"Data Science Skills &amp; Going Beyond Math and Tech | The Random Variable","u_therandomvariable25","http://www.reddit.com/r/u_therandomvariable25/comments/ejulhd/data_science_skills_going_beyond_math_and_tech/"
"172","12-07-19",64,"What is an Underrated Data Science Skill?","datascience","http://www.reddit.com/r/datascience/comments/ccc39k/what_is_an_underrated_data_science_skill/"
"182","20-12-19",0,"The most in-demand data science skills you need","business","http://www.reddit.com/r/business/comments/edas19/the_most_indemand_data_science_skills_you_need/"
"192","11-11-19",5,"What else can I do with data science skills?","Entrepreneur","http://www.reddit.com/r/Entrepreneur/comments/dutftw/what_else_can_i_do_with_data_science_skills/"
"202","10-12-19",0,"Data Science Professional wants to learn Cyber security and apply data science skills to cyber security","cybersecurity","http://www.reddit.com/r/cybersecurity/comments/e8puuj/data_science_professional_wants_to_learn_cyber/"
"213","05-11-19",0,"Data Science Skills for Professionals in Chennai","trainingcourses","http://www.reddit.com/r/trainingcourses/comments/drwqg3/data_science_skills_for_professionals_in_chennai/"
"222","26-09-19",1,"The 5+ in-demand Data Science Skills Companies Need","learnmachinelearning","http://www.reddit.com/r/learnmachinelearning/comments/d9gh22/the_5_indemand_data_science_skills_companies_need/"
"232","11-10-19",0,"[Link] Which Data Science Skills are core and which are hot/emerging ones? via KDnuggets blog","u_Tonya_at_ZestApp","http://www.reddit.com/r/u_Tonya_at_ZestApp/comments/dg8vyc/link_which_data_science_skills_are_core_and_which/"
"242","12-07-19",7,"Completely putting aside career and academic-related achievements, how have your Data Science skills positively impacted or otherwise carried over into your regular life?","datascience","http://www.reddit.com/r/datascience/comments/ccfcre/completely_putting_aside_career_and/"
"252","19-08-19",5,"What kind of career combines Cyber/Information Security and Data Science skills?","cscareerquestions","http://www.reddit.com/r/cscareerquestions/comments/csbk87/what_kind_of_career_combines_cyberinformation/"
"261","15-08-19",52,"The top data science skills according to indeed.com by number of jobs requiring this skill","datascience","http://www.reddit.com/r/datascience/comments/cqneli/the_top_data_science_skills_according_to/"
"271","19-09-17",108,"How I went from no coding or machine learning experience to data scientist job offer in 20 months. [x-post r/learnprogramming]","datascience","http://www.reddit.com/r/datascience/comments/713hnw/how_i_went_from_no_coding_or_machine_learning/"
"282","21-06-19",26,"Feminism and the Duluth Model.","MensRights","http://www.reddit.com/r/MensRights/comments/c3513m/feminism_and_the_duluth_model/"
"292","17-05-19",3,"Resume for transition into Data Analyst role","resumes","http://www.reddit.com/r/resumes/comments/bplkpd/resume_for_transition_into_data_analyst_role/"
"302","04-12-17",16,"Whats that one book you read that took your data science skills to the next level?","datascience","http://www.reddit.com/r/datascience/comments/7hf0gr/whats_that_one_book_you_read_that_took_your_data/"
"313","18-01-16",6,"New Job. Long Story. I need to learn some data science skills and fast.","datascience","http://www.reddit.com/r/datascience/comments/41ldh3/new_job_long_story_i_need_to_learn_some_data/"
"322","01-10-19",11,"Data Science Manager Knowledge","datascience","http://www.reddit.com/r/datascience/comments/dbrtw0/data_science_manager_knowledge/"
"332","08-09-19",37,"People of this sub who have jobs as Data Scientists/ ML Engineers/ DL Engineers etc. What skills or technologies would you advice new grads to learn?","cscareerquestions","http://www.reddit.com/r/cscareerquestions/comments/d1fqwd/people_of_this_sub_who_have_jobs_as_data/"
"342","12-10-17",1,"Best skills for data engineer working in that capacity","cscareerquestions","http://www.reddit.com/r/cscareerquestions/comments/75twav/best_skills_for_data_engineer_working_in_that/"
"352","20-06-19",9,"The Skills That Data Analysts Need to Master","dataanalysis","http://www.reddit.com/r/dataanalysis/comments/c2r8uq/the_skills_that_data_analysts_need_to_master/"
"362","16-03-20",0,"B.Sc.(Fire &amp; Safety Management) Course | Viswas Institute of Fire Engineering and Safety Management Bachelor of Science (Fire Engineering and Industrial Safety MGMT) could be a program initiated by the VIFSM. the most objective of this program is to boost data, skills and awareness among the scholar","u_firecare","http://www.reddit.com/r/u_firecare/comments/fjh9lu/bscfire_safety_management_course_viswas_institute/"
"372","18-12-19",8,"Top IO data skills?","IOPsychology","http://www.reddit.com/r/IOPsychology/comments/ecgdab/top_io_data_skills/"
"382","31-01-20",0,"@pewresearch: RT @pewjournalism: Have strong data skills? Love journalism? Come work for us this summer as an intern! More info &amp; application found here: https://t.co/aZMtT68rgS https://t.co/XpKUKImhSm","newsbotbot","http://www.reddit.com/r/newsbotbot/comments/ewwdgu/pewresearch_rt_pewjournalism_have_strong_data/"
"392","28-01-20",0,"Data skills could soon be more important than people skills. Train up with these courses","Ranzware","http://www.reddit.com/r/Ranzware/comments/ev5z02/data_skills_could_soon_be_more_important_than/"
"402","24-01-20",0,"Data Skills Gap Costing USD Billions in Lost Productivity","u_indvstrvs","http://www.reddit.com/r/u_indvstrvs/comments/et5527/data_skills_gap_costing_usd_billions_in_lost/"
"413","10-01-20",0,"@pewresearch: RT @pewjournalism: Have strong data skills? Love journalism? Come work for us this summer as an intern! More info &amp; application found here: https://t.co/aZMtT68rgS https://t.co/iiQLjsLbAc","newsbotbot","http://www.reddit.com/r/newsbotbot/comments/emwdms/pewresearch_rt_pewjournalism_have_strong_data/"
"422","17-12-19",0,"Thailand to train 1,000 government officers on big data skills in 2020","ThailandNews","http://www.reddit.com/r/ThailandNews/comments/ebsjhb/thailand_to_train_1000_government_officers_on_big/"
"432","16-12-19",0,"[Business] - Depa aims to train 1,000 officials in big data skills | Bangkok Post","AutoNewspaper","http://www.reddit.com/r/AutoNewspaper/comments/eb7f0f/business_depa_aims_to_train_1000_officials_in_big/"
"442","01-12-19",0,"Week in review: The data skills gap, new Kali Linux release, Apache Solr RCEs with public PoCs https://t.co/lrEawCclEV","digitalmunition","http://www.reddit.com/r/digitalmunition/comments/e4klat/week_in_review_the_data_skills_gap_new_kali_linux/"
"452","16-12-19",0,"[Business] - Depa aims to train 1,000 officials in big data skills","BANGKOKPOSTauto","http://www.reddit.com/r/BANGKOKPOSTauto/comments/eb7e58/business_depa_aims_to_train_1000_officials_in_big/"
"462","13-06-19",12,"YSK The New York Times has a course to teach its reporters data skills, and now theyve open-sourced it","YouShouldKnow","http://www.reddit.com/r/YouShouldKnow/comments/bzzx3v/ysk_the_new_york_times_has_a_course_to_teach_its/"
"472","27-11-19",0,"Theres no way to fill the data skills gap, what now? https://t.co/KyNC8cB3MV","digitalmunition","http://www.reddit.com/r/digitalmunition/comments/e2ch5v/theres_no_way_to_fill_the_data_skills_gap_what/"
"482","12-06-19",18,"The New York Times has a course to teach its reporters data skills, and now theyve open-sourced it (Course materials in comments)","datascience","http://www.reddit.com/r/datascience/comments/bzygxl/the_new_york_times_has_a_course_to_teach_its/"
"492","12-11-19",0,"Venture into programming while leveraging Data skills, is this a good idea for the next 5- 10 years of my career?","cscareerquestions","http://www.reddit.com/r/cscareerquestions/comments/dv2fet/venture_into_programming_while_leveraging_data/"
"502","16-06-19",8,"The New York Times has a course to teach its reporters data skills, and now theyve open-sourced it","technology","http://www.reddit.com/r/technology/comments/c19rgl/the_new_york_times_has_a_course_to_teach_its/"
"513","05-03-20",82,"What are some of the overlooked skills/habits that aren't ""sexy,"" but are actually really important? I'm referring to the type of thing you wouldn't brag about on your resume but will actually make a huge difference in your day-to-day workflow and the quality of your work.","datascience","http://www.reddit.com/r/datascience/comments/fdxbnu/what_are_some_of_the_overlooked_skillshabits_that/"
"522","13-03-20",16,"An example of why communication skills matter more than technical skills","datascience","http://www.reddit.com/r/datascience/comments/fhx2ml/an_example_of_why_communication_skills_matter/"
"532","26-01-20",32,"Managers, would you hire someone who has a different programming language skill than what your job description stated?","datascience","http://www.reddit.com/r/datascience/comments/euaost/managers_would_you_hire_someone_who_has_a/"
"542","04-03-20",8,"How many data science skills do you have?","datascience","http://www.reddit.com/r/datascience/comments/fdg6lm/how_many_data_science_skills_do_you_have/"
"552","10-03-20",4,"After apocalyps: What are your data analytics skills needed for?","datascience","http://www.reddit.com/r/datascience/comments/fggbc3/after_apocalyps_what_are_your_data_analytics/"
"562","03-03-20",6,"How do I Showcase My Skills?","datascience","http://www.reddit.com/r/datascience/comments/fcot06/how_do_i_showcase_my_skills/"
"572","24-02-20",6,"Which techniques/skills to focus on?","datascience","http://www.reddit.com/r/datascience/comments/f8k82w/which_techniquesskills_to_focus_on/"
"582","17-02-20",5,"Need resources to improve my analytical skills","datascience","http://www.reddit.com/r/datascience/comments/f52gg0/need_resources_to_improve_my_analytical_skills/"
"592","15-11-19",49,"Am I deluding myself thinking my skill set warrants a career switch to DS?","datascience","http://www.reddit.com/r/datascience/comments/dwwfji/am_i_deluding_myself_thinking_my_skill_set/"
"602","14-02-20",3,"Got laid off. Going to use the time to learn new skills. Advice on best skills to learn?","datascience","http://www.reddit.com/r/datascience/comments/f3xisf/got_laid_off_going_to_use_the_time_to_learn_new/"
"613","13-01-20",8,"What sort of skills should I know as a ""Data Engineer"" vs ""Data Analyst""?","datascience","http://www.reddit.com/r/datascience/comments/eo0bsx/what_sort_of_skills_should_i_know_as_a_data/"
"622","29-02-20",137,"Perception vs. reality -- how to break into data science","datascience","http://www.reddit.com/r/datascience/comments/fb7f7o/perception_vs_reality_how_to_break_into_data/"
"632","30-11-19",14,"Mechanical engineer with little coding skills, which book to buy?","datascience","http://www.reddit.com/r/datascience/comments/e3utm7/mechanical_engineer_with_little_coding_skills/"
"642","01-03-20",67,"What is more logical as fresh graduate , to aim for a data science job or start in other careers, then climb your way to a data scientist job? If the latter, what other careers.","datascience","http://www.reddit.com/r/datascience/comments/fbzjjp/what_is_more_logical_as_fresh_graduate_to_aim_for/"
"652","12-11-19",10,"Getting further in your career - why relationships matter more than hard skills","datascience","http://www.reddit.com/r/datascience/comments/dvfff4/getting_further_in_your_career_why_relationships/"
"662","18-02-20",133,"Is 31 too late to get into data science?","datascience","http://www.reddit.com/r/datascience/comments/f60xjw/is_31_too_late_to_get_into_data_science/"
"672","03-03-20",43,"Pivoting FROM Data Science to CS?","datascience","http://www.reddit.com/r/datascience/comments/fcux6f/pivoting_from_data_science_to_cs/"
"682","14-02-20",61,"I created a few data scientist resume templates you can edit and use depending on where you're at in your DS career (entry-level, senior, or looking for a manager role)","datascience","http://www.reddit.com/r/datascience/comments/f3v7l5/i_created_a_few_data_scientist_resume_templates/"
"692","12-02-20",102,"Average vs Good Data scientist","datascience","http://www.reddit.com/r/datascience/comments/f2mw70/average_vs_good_data_scientist/"
"702","07-03-20",66,"I woefully underestimated the amount of SQL I need to write. Looking for intermediate-advanced tutorials.","datascience","http://www.reddit.com/r/datascience/comments/feopi4/i_woefully_underestimated_the_amount_of_sql_i/"
"712","21-11-19",4,"Broadly speaking, what skill sets/toolkits does ""Data Engineering"" encompass. Or put another way, if a Data Analyst/Scientist was lacking in this area, what would be the most essential things that would have to be picked up quickly?","datascience","http://www.reddit.com/r/datascience/comments/dzbjjf/broadly_speaking_what_skill_setstoolkits_does/"
"722","12-02-20",89,"Math major with specialization in Data Science?","datascience","http://www.reddit.com/r/datascience/comments/f2yh3x/math_major_with_specialization_in_data_science/"
"732","26-02-20",149,"PhD hunger at medium/low-tier companies","datascience","http://www.reddit.com/r/datascience/comments/f9y4fd/phd_hunger_at_mediumlowtier_companies/"
"742","15-08-19",52,"The top data science skills according to indeed.com by number of jobs requiring this skill","datascience","http://www.reddit.com/r/datascience/comments/cqneli/the_top_data_science_skills_according_to/"
"752","08-11-19",15,"Does skill matter or degree for data scientist job?","datascience","http://www.reddit.com/r/datascience/comments/dtd3a8/does_skill_matter_or_degree_for_data_scientist_job/"
"1101","07-03-20",254,"What has been an essential skill at your (first / second / etc. / current) job that you haven't learned during your degree?","cscareerquestions","http://www.reddit.com/r/cscareerquestions/comments/fezm7h/what_has_been_an_essential_skill_at_your_first/"
"210","05-03-20",82,"What are some of the overlooked skills/habits that aren't ""sexy,"" but are actually really important? I'm referring to the type of thing you wouldn't brag about on your resume but will actually make a huge difference in your day-to-day workflow and the quality of your work.","datascience","http://www.reddit.com/r/datascience/comments/fdxbnu/what_are_some_of_the_overlooked_skillshabits_that/"
"310","14-02-20",158,"What skills do employers expect from an entry-level software engineer?","cscareerquestions","http://www.reddit.com/r/cscareerquestions/comments/f3u42v/what_skills_do_employers_expect_from_an/"
"410","13-02-20",108,"the importance of soft skills","cscareerquestions","http://www.reddit.com/r/cscareerquestions/comments/f3ft4o/the_importance_of_soft_skills/"
"510","17-03-20",30,"What are some employable skills/frameworks to learn?","cscareerquestions","http://www.reddit.com/r/cscareerquestions/comments/fk6d6m/what_are_some_employable_skillsframeworks_to_learn/"
"610","13-03-20",16,"An example of why communication skills matter more than technical skills","datascience","http://www.reddit.com/r/datascience/comments/fhx2ml/an_example_of_why_communication_skills_matter/"
"761","13-03-20",24,"Should I even work on technical skills right now?","cscareerquestions","http://www.reddit.com/r/cscareerquestions/comments/fi8npt/should_i_even_work_on_technical_skills_right_now/"
"811","13-03-20",20,"My father has some connections in sillicon valley and he has an intern position open for mebut im no where near ready to be an actual developer and my skills are extremely small, should i still go?","cscareerquestions","http://www.reddit.com/r/cscareerquestions/comments/fi36co/my_father_has_some_connections_in_sillicon_valley/"
"911","19-02-20",45,"[Q] How did you learn the programming skills (like SAS, SQL, R) to be successful in your field?","statistics","http://www.reddit.com/r/statistics/comments/f6i1kr/q_how_did_you_learn_the_programming_skills_like/"
"1011","09-03-20",25,"[D] Did your PhD acutally improve your software engineering skills?","MachineLearning","http://www.reddit.com/r/MachineLearning/comments/fg33io/d_did_your_phd_acutally_improve_your_software/"
"1111","03-03-20",11,"What skills should I focus on bolstering before managing a tech team?","cscareerquestions","http://www.reddit.com/r/cscareerquestions/comments/fcvhlp/what_skills_should_i_focus_on_bolstering_before/"
"1211","30-11-19",201,"Junior devs, what has been the skill gap between your CS degree education and actual software programming in the workplace?","cscareerquestions","http://www.reddit.com/r/cscareerquestions/comments/e3sgnc/junior_devs_what_has_been_the_skill_gap_between/"
"131","15-03-20",5,"[OC] How do we measure loudness? With schools transitioning to Online Learning, I figured I might improve my resource-making skills. Decibel scale (with examples) for a Middle Grades unit","dataisbeautiful","http://www.reddit.com/r/dataisbeautiful/comments/fj83um/oc_how_do_we_measure_loudness_with_schools/"
"141","15-03-20",7,"What skills to focus on to get higher salary than current remote Computer Vision job?","cscareerquestions","http://www.reddit.com/r/cscareerquestions/comments/fiy6dp/what_skills_to_focus_on_to_get_higher_salary_than/"
"151","25-02-20",11,"How well does Game Development experience skills transfer to other CS fields?","cscareerquestions","http://www.reddit.com/r/cscareerquestions/comments/f979mz/how_well_does_game_development_experience_skills/"
"161","27-01-20",28,"What career paths are there for CS majors that want to use their skills to solve environmental / sustainability issues?","cscareerquestions","http://www.reddit.com/r/cscareerquestions/comments/euiit2/what_career_paths_are_there_for_cs_majors_that/"
"171","08-03-20",9,"Including Future Skills","cscareerquestions","http://www.reddit.com/r/cscareerquestions/comments/ffilly/including_future_skills/"
"181","29-02-20",8,"How to improve Soft skills as a Software Architecture?","cscareerquestions","http://www.reddit.com/r/cscareerquestions/comments/fb60ei/how_to_improve_soft_skills_as_a_software/"
"191","09-03-20",4,"Reflection about Interpersonal Skills in Tech","cscareerquestions","http://www.reddit.com/r/cscareerquestions/comments/ffqtw5/reflection_about_interpersonal_skills_in_tech/"
"201","26-01-20",32,"Managers, would you hire someone who has a different programming language skill than what your job description stated?","datascience","http://www.reddit.com/r/datascience/comments/euaost/managers_would_you_hire_someone_who_has_a/"
"211","04-02-20",31,"Improving social and soft-skills","cscareerquestions","http://www.reddit.com/r/cscareerquestions/comments/eypfen/improving_social_and_softskills/"
"221","04-03-20",8,"How many data science skills do you have?","datascience","http://www.reddit.com/r/datascience/comments/fdg6lm/how_many_data_science_skills_do_you_have/"
"231","25-02-20",4,"Data engineering: what skills/knowledge are expected from entry-level, fresh out of undergraduate??","cscareerquestions","http://www.reddit.com/r/cscareerquestions/comments/f9at4q/data_engineering_what_skillsknowledge_are/"
"241","28-02-20",10,"How do you develop soft skills?","cscareerquestions","http://www.reddit.com/r/cscareerquestions/comments/fb1lax/how_do_you_develop_soft_skills/"
"251","24-02-20",4,"How should I represent my skills with respect to each other on a CV/portfolio?","cscareerquestions","http://www.reddit.com/r/cscareerquestions/comments/f8kfy5/how_should_i_represent_my_skills_with_respect_to/"
"281","04-03-20",7,"Not sure how to sell myself based on my experience and skills.","cscareerquestions","http://www.reddit.com/r/cscareerquestions/comments/fdief2/not_sure_how_to_sell_myself_based_on_my/"
"291","10-03-20",4,"After apocalyps: What are your data analytics skills needed for?","datascience","http://www.reddit.com/r/datascience/comments/fggbc3/after_apocalyps_what_are_your_data_analytics/"
"301","10-03-20",4,"Is DS, algo, system design and soft skill all you need to be a good programmer ?","cscareerquestions","http://www.reddit.com/r/cscareerquestions/comments/fgdpnf/is_ds_algo_system_design_and_soft_skill_all_you/"
"311","03-03-20",6,"How do I Showcase My Skills?","datascience","http://www.reddit.com/r/datascience/comments/fcot06/how_do_i_showcase_my_skills/"
"321","09-01-20",49,"Older developer with dated skill sets needs help getting back in the game","cscareerquestions","http://www.reddit.com/r/cscareerquestions/comments/em24hw/older_developer_with_dated_skill_sets_needs_help/"
