"","date","num_comments","title","subreddit","URL"
"331","12-01-20",21,"Those of you who use your programming skills to earn money outside your day job how do you do it?","cscareerquestions","http://www.reddit.com/r/cscareerquestions/comments/enqjwi/those_of_you_who_use_your_programming_skills_to/"
"341","14-03-20",2,"ELI5 What are the responsibilities of a Configuration Change Manager and what skills/knowlege would I need to become one?","cscareerquestions","http://www.reddit.com/r/cscareerquestions/comments/finets/eli5_what_are_the_responsibilities_of_a/"
"351","24-02-20",6,"Which techniques/skills to focus on?","datascience","http://www.reddit.com/r/datascience/comments/f8k82w/which_techniquesskills_to_focus_on/"
"361","13-02-20",20,"I'm a skilled programmer and I need an online job I can do without my parents finding out","cscareerquestions","http://www.reddit.com/r/cscareerquestions/comments/f3ikbh/im_a_skilled_programmer_and_i_need_an_online_job/"
"371","26-02-20",6,"Should I remove a skill I embellished my ability in after landing an interview for my updated resume?","cscareerquestions","http://www.reddit.com/r/cscareerquestions/comments/f9m36f/should_i_remove_a_skill_i_embellished_my_ability/"
"381","25-02-20",5,"Skills &amp; jobs titles for AI software building","cscareerquestions","http://www.reddit.com/r/cscareerquestions/comments/f92clr/skills_jobs_titles_for_ai_software_building/"
"391","19-02-20",8,"Is the capability to keep a complex model in your head a trainable skill?","cscareerquestions","http://www.reddit.com/r/cscareerquestions/comments/f624yg/is_the_capability_to_keep_a_complex_model_in_your/"
"401","14-02-20",7,"Currently on break, what are good ways to improve my skills as a college freshmen?","cscareerquestions","http://www.reddit.com/r/cscareerquestions/comments/f40isb/currently_on_break_what_are_good_ways_to_improve/"
"411","21-02-20",6,"What are some tools or skills to have to get into Blockchain Development?","cscareerquestions","http://www.reddit.com/r/cscareerquestions/comments/f7b7fj/what_are_some_tools_or_skills_to_have_to_get_into/"
"421","09-01-20",17,"How can I improve my technical communication skills as a software engineer?","cscareerquestions","http://www.reddit.com/r/cscareerquestions/comments/em65kt/how_can_i_improve_my_technical_communication/"
"431","24-02-20",3,"How to work on and improve soft skills?","cscareerquestions","http://www.reddit.com/r/cscareerquestions/comments/f90ufm/how_to_work_on_and_improve_soft_skills/"
"441","17-02-20",5,"Need resources to improve my analytical skills","datascience","http://www.reddit.com/r/datascience/comments/f52gg0/need_resources_to_improve_my_analytical_skills/"
"451","16-03-20",0,"Fun missions to challenge your decoding, cryptography and ethical hacking skills!","cscareerquestions","http://www.reddit.com/r/cscareerquestions/comments/fjl04i/fun_missions_to_challenge_your_decoding/"
"461","25-02-20",3,"Are these skills good to learn in 2020?","cscareerquestions","http://www.reddit.com/r/cscareerquestions/comments/f9fgrh/are_these_skills_good_to_learn_in_2020/"
"471","14-03-20",1,"How to become a data visualizer? Is that a career by itself or just a skill?","cscareerquestions","http://www.reddit.com/r/cscareerquestions/comments/finw07/how_to_become_a_data_visualizer_is_that_a_career/"
"481","07-03-20",2,"[Career] Should I focus on finding another internship, or build up on my technical skills?","statistics","http://www.reddit.com/r/statistics/comments/fepnmr/career_should_i_focus_on_finding_another/"
"491","12-02-20",10,"How can you improve your technical speaking skills?","cscareerquestions","http://www.reddit.com/r/cscareerquestions/comments/f2zzeo/how_can_you_improve_your_technical_speaking_skills/"
"501","26-01-20",6,"Should I learn a complementary skill? Or popular skill next?","cscareerquestions","http://www.reddit.com/r/cscareerquestions/comments/euam0h/should_i_learn_a_complementary_skill_or_popular/"
"511","07-02-20",7,"What additional skills should I learn to become a Data Engineer with a Masters in Data Science?","cscareerquestions","http://www.reddit.com/r/cscareerquestions/comments/f05uwa/what_additional_skills_should_i_learn_to_become_a/"
"521","17-10-19",166,"Senior CS student lacking data structures fundamentals and problem solving skills","cscareerquestions","http://www.reddit.com/r/cscareerquestions/comments/dj1myv/senior_cs_student_lacking_data_structures/"
"531","18-02-20",5,"[D] NLP vs Vision - which skill is more valuable in career?","MachineLearning","http://www.reddit.com/r/MachineLearning/comments/f5z9ot/d_nlp_vs_vision_which_skill_is_more_valuable_in/"
"541","05-02-20",6,"What skills to develop in order to pursuit in data science jobs?","cscareerquestions","http://www.reddit.com/r/cscareerquestions/comments/ez6wdz/what_skills_to_develop_in_order_to_pursuit_in/"
"551","20-01-20",9,"Is making games in Unity a marketable skill?","cscareerquestions","http://www.reddit.com/r/cscareerquestions/comments/eriuyx/is_making_games_in_unity_a_marketable_skill/"
"561","25-01-20",11,"Is Your Software Career Doomed without Web Skills?","cscareerquestions","http://www.reddit.com/r/cscareerquestions/comments/etjpdg/is_your_software_career_doomed_without_web_skills/"
"571","25-02-20",3,"What are the top 5 technical and top 5 non-technical skills you look for in a front-end software engineer?","cscareerquestions","http://www.reddit.com/r/cscareerquestions/comments/f93bn5/what_are_the_top_5_technical_and_top_5/"
"581","19-02-20",3,"A skills map of a new security engineer","cscareerquestions","http://www.reddit.com/r/cscareerquestions/comments/f6a1au/a_skills_map_of_a_new_security_engineer/"
"591","09-01-20",16,"What CS skills would you tell your younger self to learn when you started programming?","cscareerquestions","http://www.reddit.com/r/cscareerquestions/comments/em6x7j/what_cs_skills_would_you_tell_your_younger_self/"
"601","14-02-20",6,"How does one advertise their research skills when they have no official publications?","cscareerquestions","http://www.reddit.com/r/cscareerquestions/comments/f3m7io/how_does_one_advertise_their_research_skills_when/"
"611","10-02-20",4,"What skills give you an edge as a new grad to be in the top 1% of the applicant pool?","cscareerquestions","http://www.reddit.com/r/cscareerquestions/comments/f1xa00/what_skills_give_you_an_edge_as_a_new_grad_to_be/"
"621","20-02-20",3,"Asking questions is the most important skill I'll never learn.","cscareerquestions","http://www.reddit.com/r/cscareerquestions/comments/f6wuzw/asking_questions_is_the_most_important_skill_ill/"
"631","29-01-20",13,"Where/How do i develop the skills to become respected software developer ?","cscareerquestions","http://www.reddit.com/r/cscareerquestions/comments/evesop/wherehow_do_i_develop_the_skills_to_become/"
"641","18-01-20",9,"Im in 4th semester of CS engineering and I would like to work in the financial sector, what skills/languages would I need to achieve this?","cscareerquestions","http://www.reddit.com/r/cscareerquestions/comments/eqdorm/im_in_4th_semester_of_cs_engineering_and_i_would/"
"651","18-02-20",3,"Skills","cscareerquestions","http://www.reddit.com/r/cscareerquestions/comments/f5zpj9/skills/"
"661","19-02-20",3,"Skills for SDE 2 level positions in the industry.","cscareerquestions","http://www.reddit.com/r/cscareerquestions/comments/f6fahj/skills_for_sde_2_level_positions_in_the_industry/"
"671","17-11-19",28,"Want to change job but haven't acquired any skill at my current job","cscareerquestions","http://www.reddit.com/r/cscareerquestions/comments/dxn4tn/want_to_change_job_but_havent_acquired_any_skill/"
"681","10-03-20",184,"After 7+ years of working as a ""Software Developer"". Should I now finally start practicing Data Structures and Algorithms?","cscareerquestions","http://www.reddit.com/r/cscareerquestions/comments/fggxtv/after_7_years_of_working_as_a_software_developer/"
"691","15-11-19",56,"How to teach a new hire some critical thinking skills?","cscareerquestions","http://www.reddit.com/r/cscareerquestions/comments/dwto2t/how_to_teach_a_new_hire_some_critical_thinking/"
"701","15-11-19",49,"Am I deluding myself thinking my skill set warrants a career switch to DS?","datascience","http://www.reddit.com/r/datascience/comments/dwwfji/am_i_deluding_myself_thinking_my_skill_set/"
"711","14-02-20",3,"Got laid off. Going to use the time to learn new skills. Advice on best skills to learn?","datascience","http://www.reddit.com/r/datascience/comments/f3xisf/got_laid_off_going_to_use_the_time_to_learn_new/"
"721","29-01-20",8,"Coding Skills Tests, Are they Really worth it ?","cscareerquestions","http://www.reddit.com/r/cscareerquestions/comments/evkgqw/coding_skills_tests_are_they_really_worth_it/"
"731","13-01-20",8,"What sort of skills should I know as a ""Data Engineer"" vs ""Data Analyst""?","datascience","http://www.reddit.com/r/datascience/comments/eo0bsx/what_sort_of_skills_should_i_know_as_a_data/"
"741","27-02-20",1,"UX (with minor front-end skills)","cscareerquestions","http://www.reddit.com/r/cscareerquestions/comments/facf9l/ux_with_minor_frontend_skills/"
"751","16-02-20",429,"This sub is scaring me","cscareerquestions","http://www.reddit.com/r/cscareerquestions/comments/f4qda7/this_sub_is_scaring_me/"
