"","matrix.0..nrow...numComments..ncol...1."
"279","Anyone else on their phone who also thought the graph was a hair on their screen when scrolling down?"
"280","It seems to me like you lack an understanding of tech"
"281","You need a portfolio then and start presenting to get your skills in front of hiring managers locally. 

Basically, youre missing the problem solving and storytelling aspect so pick some problems and show what you can do. Its partly easier to teach those skills than technical skills anyways. Your manager can tell you what to do to start off anyways. 

I hired some like this recently, who did not like getting a beginner offer but its company policy. And it made sense. In a year theyll be up to speed and will warrant a salary increase but the workload right now will be on me as well as them."
"282","Thanks. I figured that would be the way the salary would work. But what should I put in my portfolio? Which problems to pick?"
"283","Pick something of interest to you. If you're feeling adventurous find something related to the company you're interviewing/applying with. 

&amp;#x200B;

For example, applying for health care, show something related to population health data - where in the county is worse or better? Or a basic visualization?

For Finance? Show something related to the analysis of stock or market data depending on the role. 

&amp;#x200B;

Ideally you do not want to use a data set that's everywhere, such as Iris, cars or titanic."
"284","Thanks. Yeah, I did Titanic just to learn. But I can start to pick stuff that is a bit more interesting and eye-catching."
"285","Keep working on your programming skills. If you know some python already then focus on pandas. I use pandas for every single data science project that I'm working on. Then from there, start learning the machine learning techniques. Then do a couple personal projects or kaggle competitions to apply the things you've learned.  
  
Learning resources:  
https://www.kaggle.com/learn/overview  
https://scikit-learn.org/stable/tutorial/index.html  
  
Machine learning datasets:  
https://www.kaggle.com/c/titanic  
https://www.kaggle.com/c/house-prices-advanced-regression-techniques  
http://archive.ics.uci.edu/ml/index.php"
"286","Thanks! I did the Titanic kaggle, both using linear regression as well as a neural network. I'll continue with the pandas, they seem very useful."
"287","If you're having trouble and you don't have a grad degree, two good paths are to first get an internship or first get a job as a data analyst."
"288","I'm already interning for company now as data scientist in Tunisia, but I got this job because of referrals not because of my experience and I aim to find a DS job in Europe. Do you think its feasible to find an internship or to land a data analyst  in my case?"
"289","Great, you're on a good track then. I think it is, but I'm in the US so I don't know  about the European job market."
"290","Im in Europe and its feasable, at least the internship. It depends on the market. Here in Northern Europe the DS market is a little saturated, lots of companies went all in and got Data Scientists and have now realized they dont have the infrastructure in place to support them so are buying up Data Engineers like mad."
"291","hey it's a good start ! Now you should focus on getting as much experience and knowledge from this internship

if you're not too low on money and hardworker I also recommend to take a few month gap for personal projects !"
"292","An employment gap on a resume is always questionable"
"293","is it really if you have never worked as an employee but as an intern ? I don't know I'm a student too !"
"294","If you are in school during that gap, no. But any time there is time on a resume where you aren't employed that isn't explained on the resume, it could be a concern for some."
"295","That's a shame since personal projects are usually the most instructive and the most interesting for employers : it really shows how someone's able to work with self-government and ones ability to imagine and think on his own. Although I feel like personal projects don't belong in the CV (but rather in an interview)

Thanks for your advices"
"296","What if you are having trouble *AND also* have a grad degree. I have both biostat and BME degrees and will be graduating spring witb an MS

I am still having lot of trouble and I have never had an internship or job before. Most internships in this field wont take me bc I am graduating


I wonder if its because my software eng skills are weak"
"297","That's normal too. Getting the first job is supposed to be the hardest. I can only speak for US, but I graduated with my MS in Physics and didn't get a job straight out of it. I ended up doing a (low paying) internship in the summer, which I got partially from the help of a reference. I started looking again in July, applied to 100 jobs, interviewed, and landed my job in October. Again, my ability to get an interview was largely dictated by whether I had a reference (5/100 apps got me interviews, in 4 had a reference).

As for having a software engineering background, I'm sure experience there is really helpful. If you lack there it may help to work on some projects and put them on GitHub? Your background is solid, I'm sure you can make it if you keep pushing."
"298","Do projects, build a portfolio, have a body of work that can demonstrate your skills in lieu of experience"
"299","There are three key areas of knowledge of an effective data scientist (defined as someone who analyses data and codes models): programming, math (stats for most businesses), and business itself. Considering many in data science come from CS / STEM backgrounds, often one only hears about the former two - and it is great if the company has data science at the core of its business model. Unfortunately, most businesses do not. In order to identify problems and create applied solutions, business understanding is essential. Hence my answer would be that unless you go to work for a company that already has an established and internally valued data science team (where you can learn about the business on the job), do not start as a data scientist.  For other careers, pick a business that you like, pick good management, and possibly even a place where technology is underappreciated. Why? You will e.g. write an easy predictive model for product sales, and you'll become a star."
"300","Seems like an interesting tip, thanks man !"
"301","Good luck!"
"302","Depends on your background. If you have a PhD in physics, id go directly for data scientist. If you have a bachelor's in international affairs, I'd try to get a job as a database developer or data analyst first"
"303","In my case, I'm a CS major, I've done couple of internships (a ds internship that I'm still enrolling in as a part of my degree and a web dev internship)."
"304","If you can get a ML Eng job, that is a really good path."
"305","I agree with this. Demonstrating that you can write big boy code, can build sensible data pipelines, and understand how to integrate common ML algorithms should honestly be starting work for every data scientist. So many I've worked with just copy/paste SVM or whatever, put up a nice confusion matrix, and call it a day. Digging into the parameters or scaling the work to a large data set causes blank stares. In short, ""data scientist"" is a watered down job title, imo, so differentiate yourself with engineering work. My other advice is to be a lifelong learner. Best of luck to you."
"306","&gt;  In short, ""data scientist"" is a watered down job title, imo

Data Scientist can mean 2 things:

""Advanced Business Analyst"" or ML Engineer

There's a totally different domain out there under the Data Engineer job title that overlaps with ML Engineer. Just my opinion of course."
"307","++ for life long learner"
"308","Agreed. I'm a fairly high profile data scientist for one of the biggest companies in the world and there is plenty space on the stage. It'd be much easier to climb the engineering ladder to the top compared to the software side. Primary comparison is that the best systems engineers AREN'T systems engineers. They come with some background. A BS/MS in systems... Even systems engineers with PhDs are laughed right into middle management and will go no where from that point on. That's where data science is going. It's not there yet but the better data scientist understand the data first."
"309","I don't know much about the DS job market outside of the US, but I would go ahead and try for a DS job. If it doesn't work out try for a analyst role"
"310","Okay thanks for the tips!"
"311","What if you are a bachelor in physical affairs?

*10,000 tomatoes unleashed*"
"312","What do you mean by the If you have a PhD in physics go directly to data scientist sentence ?"
"313","Data science jobs are very competitive. Ideally you would have data science work experience. If not, you still need something to differentiate yourself at the resume stage. An advanced degree in a quantitative field might do that."
"314","Tips for getting a data analyst job? I have a BS in applied stats and know R, Python, SQL and even base SAS. However I've been applying to many data analyst and similar jobs without any luck."
"315","What's your location?"
"316","California"
"317","It's a numbers game for the first job. Just apply to as many as you can. Go to networking events."
"318","Create some projects and place them on a github repository, then include it in your CV/cover letter. That'll put you ahead of most candidates with no experience."
"319","You lack experience in industry where data science is used . Being an analyst is a more reasonable job position for a new bachelor level grad without experience 

You are missing business knowledge - that is the most valuable thing that sets data scientists apart when it comes to landing a position .

A 1 year analyst in oil and gas industry is a better candidate for a data science position in an oil and gas company than someone off the street.

Apply to any data analytical and DS parallel positions to gain business knowledge and move into a formal DS role 

- this is just my opinion -"
"320","Do you know for certain your preference is on the analytics side?  You can also try for an MLE job instead of DS, depending on what you would enjoy.

The job path, if not jumping into the desired role initially, is: analyst -&gt; data scientist or software engineer -&gt; machine learning engineer.

Though, there are always exceptions.  I went from SE to DS many years ago.  This requires luck more than anything imho because companies do not hire DSs who have previously worked as an SE.  You need an internal project at a company that lets you transfer teams usually."
"321","And what is the highest paying job among these all ?"
"322","What kind of pay?  In happiness and not hating your life?

In cash, MLE, as they're usually needed at large companies.  They say DS pays more than SE but out here in the sf/bay area I often find SEs being paid equal and sometimes above DSs.  MLE, DS, and SE all are paid a similar rate.  Analyst is the exception and can be paid 1/2 to 1/3rd of the other titles."
"323","Hahaaha, but which career you'd hate yourself the most in since you mentioned that"
"324","I did a gig as a software engineer and hated it.  I learned and grew a lot!  I stopped being self conscious about my programming skills.  Today I'd easily qualify as a senior or principal software engineer if I wanted, which is pretty rare on the DS side of things.

I find the opposite is true for many people and they like being an SE better.  Some people just like building things and some people like discovering unseen patterns in datasets.  Some like both.

I can tell you on the MLE side, PyTorch is well received but if you want to work at Google you'll need to know Tensorflow.

You'll find what you like by doing hobby projects.  That and classes.  Eg, MIT has a data science 101 class you can take and see if you like.  Though, I find projects to be a better indicator."
"325","Why not just farm out your resume to all data related jobs and make a decision on who bites? Data analyst, data engineer, data scientist, reporting analyst..etc"
"326","Can you elaborate, I don't understand?"
"327","Submit your resume to 100 companies see who bites"
"328","Or in some cases *9000!!!*"
"329","the motto I've lived by is "" you get what you go for"", Its worked out well so far."
"330","Vicky Boykin, a respected Data Scientist in our field, has written an exact blog post for your question. I encourage you to read it:

http://veekaybee.github.io/2019/02/13/data-science-is-different/"
"331","Thoroughly enjoyed reading it :) Good advice for junior data scientists."
"332","Is it possible for a psychology graduate to start a job as a data scientist, or perhaps relevant occupation ?"
"333","Depends. Where are you based?

If your psychology education was anything like in Europe (at a university) you would have extensive experience with:

- Setting up research (questions)
- Conducting experiments (experimental design) and which features could measure which outcomes.
- Thinking about data gathering and analysis
- Interpreting numbers and graphs related to statistical analysis
- Decent stats knowledge. (I.e. you've had the basics relating to ANOVA/LinReg/LogReg/PCA. Best case scenario: CFA/EFA/SEM. Between/within group ANOVA's (can be compared to clustering). Model selection/model evaluation/feature selection. (Even though most of psychological statistics is very classical, knowledge of the above makes transitioning to ""Machine Learning"" very easy, especially since ML/AI is just a fucking buzzword.
- Problem solving skills related to the above.
- Scientific philosophy and critical thinking.

Then apart from the above you would probably need to be comfortable with some form of programming language (Python/R/SQL), and basics of machine learning experimental design (train-test split, etc).

Since Data Science is a very ill-defined term (broadly speaking) you could have more luck at less technologically advanced companies. You might consider them less prestigious, but honestly who cares if it gets your foot in the door.

Do notice that most of the people commenting on reddit concerning requirements for data science are from a very STEM heavy background or CS background. This makes their advice most of the time ill-suited for most businesses that want analysts/scientists (in a lot of companies analysts do the same work as data scientists, just under a different title.) Those comments would most likely focus on things like ""you need linear algebra, calculus, optimization, discrete math and w/e"". Let's face it, at most companies you won't use that straight away. There are so many companies which are not at a decent ""data maturity level"".

Advice: get a junior position somewhere with an established team so you can get domain knowledge. At the end of the day if you know a lot of maths but cant deliver business value, your boss is not going to like you. And delivering business value is a lot harder considering you have to speak to stakeholders who don't know their nose from their ass when it comes to what they want to know."
"334","Thanks for your reply, in Malaysia we do have research method and analysis subject for every semester as my campus follow the UK syllabus, I did learn about the basics (anova, linear regression etc) and learned to analyse data using SPSS, but I believe my understanding is still at a shallow level.. 

As for R, Python Ive been learning on coursera to develop some basics skills and get a professional certificates, however idk if its recognised by organisations. 

Basically you are right, getting my foot in the door is the first step and local organisations often prioritise CS, AS and CE students, so right now Im focussing on online courses hope it will help with my application."
"335","I dont understand what you mean by more logical. If you want to be a data scientist, pursuing data science positions is the most direct path to that."
"336","Most of the data science jobs I found require data analytics, big data, sql .. job experience. I got the impression that it is hard to get a DS job without an experience ( I am a CS major).  So I thought maybe its smarter to gain work experience with fields that compliments data science first, then apply for DS position with more qualifications."
"337","Youll see listings that want experience, graduate degrees, etc. its not unheard of (or uncommon) to take an entry-level position as a data analyst before pivoting to full DS. Just get as close as you can to what you want and fine tune from there."
"338","Okay, thank you!"
"339","If you see skills on every job posting youre looking at then get that experience. You might not have a job to cite but you can always work on a project and put it on github and a medium post. 

And if you dont know SQL then go learn it. Its fairly easy and I wouldnt bring in anyone, even a beginner data analyst, without some proof they could use it. Also, go learn Excel. Spreadsheets are a much more powerful tool than they get credit for."
"340","I already have a good base in CS, databases, big data, python .. Currently I'm learning ML and DL and the math, I'm working on projects in that field that I'm going to put on github as well.

When companies say they need work experience in a technology they do not mean that someone hired you to use it, they mean that you've done project using it? Is that what you mean? Thanks!"
"341","Just following up because I didnt see you specifically address it, are you experienced in SQL? Ill echo the parent comment that its absolutely a necessity in my experience (having hired several intern positions and entry level positions in data science and analytics for my company)."
"342","Yeah yeah, in the CS degree we studied databases quite deeply (mysql and oracle), and I've applied what I learnt in several projects of mine"
"343","Job descriptions are boilerplate. Asking for job experience is standard. Having said that, theres a difference between understanding from a class and understanding from experience, especially when it comes to doing real deep analysis. A lot of data science is now very engineering heavy where you dont need as much analytical skill to understand the problem as you do technical skill to optimize a model but much more is still focused on having the skill set to take an abstract, incomplete, and bug-ridden data set and returning actionable insights. That last skill is hard to get in school and an independent non-academic project is one way of signaling that you have that skill."
"344","Yeah I kinda get that, I am working on improving myself on that part. But there's not much resources addressing that ( cleaning messy data ). I'm already interning in a local company in a DS role, they gave me a database with 3 millions rows and they are asking me to build a model that predicts sales of each product for the next year, and I can say that the data is messy and there is a lot of errors, missing data and stuff like that, but I didn't find many resources on how to correct that."
"345","That's amazing training. You'll learn the truth about data science: 80%+ of the effort isn't in model selection or fancy analysis, its in understanding and cleaning your data. Its frustrating and can make you hate yourself or your chosen profession at time but its incredibly important.

When I interview people, one of the question I often ask is how they'd approach a bug-laden data set. By the end of your internship you'd be qualified to provide an answer, which is something a lot of your peers who won't get a similar experience won't have. Good luck, its gonna suck sometimes."
"346","Well yeah probably hahaha, but do you have any good resources on learning to do that effectively ? And btw, thanks for the tips :D !"
"347","With data cleaning, the best way to learn is to do. I don't actually know some resources but googling missing, corrupted, incomplete, buggy, etc. data should get some good starting points. Then, as you encounter issues in your internship check the internet for similar things."
"348","Dude, your internship experience will be quite valuable, you just have to present it well in your resume, making sure to highlight whatever you've learnt. I'm in a similar situation like you (CS undergrad, graduating in 2020) and I've been applying to a lot of companies asking for ML engineers, and I think that's the best way to start a career in DS. Gaining experience in the field in whatever way is possible. 

And talking about missing data, see if any of the basic pandas  techniques work for you (assuming you use python)."
"349","And how is that working for you, did any of the companies respond ?"
"350","Not really, but I'm hopeful. I already have a job in one of my country's biggest IT companies, where I currently intern, but I can't be sure if I'll get an AI/ML related role when I join full-time later this year. I also applied to one of Omdena's challenges, for experience. They help you learn a lot in Data Science, and you get experience working on a real world project."
"351","Best of luck man, hopefully you'll get the job you are looking for!"
"352","I may offer another insight: when deciding between offers you should simply choose the company with the better fit for you. Even if you don't work as DS, you will still gain experience and also money and also networking and also change your living situation etc. It's a great start anyway."
"353","Hi, Yes I think this would be possible. I would recommend starting of as a backend engineer and then moving into specializations like ML engineer or Full stack engineer depending on your interests. 

For the back end engineer the basic requirements would be:

1. Algorithms and data structures (I recommend getting enough practice from leetcode, etc they have learning paths which can be very helpful) This is usually where most engineers fail in the interview

2. General understanding of web systems, like what is a front end? what is a back end? how do they communicate with each other?, since you have experience with Python I would recommend looking at flask its easier to get started on

3. Understanding databases, like SQL CRUD queries, joins, views, OLTP data modelling

4. Docker, most companies currently use docker for their apps 

5. Optional: kafka, OLAP database (AWS redshift, etc) not all companies use this but would be good to know what these are

hope this helps. Please let me know if you need more specifics. Good luck :)"
"354","Thanks! I guess I hadnt considered a switch to back end developer, as its rather a large career jump. I feel like most companies wouldnt want to hire an ex DS PhD, or I would have to take a giant pay cut. I might be totally pulling that out of thin air though! Otherwise I feel like it makes sense as a clean break from DS and gets me right into the thick of software development."
"355","u/doctor_of_space  are right about the paycut you will have to take :( . I am not so sure about companies not willing to hire ex DS PhD's as a backend engineer, I have seen a few of these. Another option would be (depending on your ""big data/ spark/ NLP, ML"" expertise) is to look of a ML engineer or Data Engineer I think this might give you the interesting challenges involved in working with large amounts of data, the ability to flex your DS skills and not take a huge pay cut as these positions are usually closer in salary range to DS."
"356","Option 2 is great advice, imo. Your DS qualifications becomes one of your benefits in a role like that."
"357","IMHO, with a PhD you would not want to be a back-end engineer and I think you might be bored. What you really want is to find a place where your capacity and background (math, whatever) are utilized in a way that you can work on algorithm design, proofs of concepts and maybe get into the nitty-gritty of a particular implementation of something interesting. There are jobs in Fintech that match this description, maybe some select DoD work, robotics, blockchain.... Back when I worked in the financial industry, we had a department staffed with PhDs and most of them came from either physics or math. They worked on some super secret trading stuff (stochastic calculus based). The entry into the group wasn't conditioned on knowledge of things like Kafka or Spark or C or Python (those are just tools any monkey can learn) - it was assumed that with an advanced technical degree those would be easy to pick up. However, not any monkey can pick up advanced calculus, complicated geometry etc. etc."
"358","Hmm do you think it would be possible to get considered for these positions with just a bachelor's in electrical engineering?"
"359","I don't think so."
"360","With *only* the degree, probably not.

However, a LOT of computer engineers have electrical engineering degrees. In addition, a lot of electrical engineer jobs involve significant amounts of software development.

As a specific example, Im a computer engineer with both CompE and EE degrees, and I develop CPU simulators, analyze data from them and real systems using data science techniques and tools, as well as build our infrastructure with DevOps tools.

I also know a TON of EEs that decided to switch from hardware to software. They usually made moves after they had 2-5 years experience that included SWE work in their EE job."
"361","lol not a chance."
"362","Damn >#"
