"","matrix.0..nrow...numComments..ncol...1."
"1","/r/DataScience"
"2","Your IB skills with Excel will translate well for most analytics roles. You've already been working in analytics and simply have to upgrade your toolkit. My recommendation is to focus on the pandas library of Python to replicate work you would do in Excel. (Vlookup to pd.merge, selecting columns and rows, pivot table to groupby and pivot_table).

A large amount of not majority of data scientist roles are analytics type roles."
"3","If you want to destroy feminism on this issue [just point out that rape is reported in no less than 30 percent of lesbian relationships](https://mainweb-v.musc.edu/vawprevention/lesbianrx/factsheet.shtml) and Duluth Model views on domestic violence [enables violent women partners to sneak into battered women's shelters to chase their victims undetected](https://everydayfeminism.com/2014/11/myths-ipv-lesbian-relationships/)."
"4","I actually worked for a season next to the DAIP office in Duluth. They were extremely sexist. I was informed that walking down the hall to the shared bathroom was too intimidating because I was male and many of their program attendees had issues with males. Sometimes ~~if~~ I'd go and wash my hands and forget to lock the door. They called and complained to my boss and said that of a woman opened the door and i was in the bathroom, she's be intimidated because I was male."
"5","That closely mirrors a bad experience I had with those groups as well. My cousin worked in a women's shelter, and asked me one weekend to help them out with some moving they were doing. I went by the address she gave me, and looked for someone, and waited in my car for about 15 minutes. Finally, someone approached me cautiously and asked who I was. I gave them my cousin's name and told them I'd been asked to come by and help out. They knew extra people had been asked to help, but thought I looked dangerous, and I was told they thought I was some husband who had found the location of the shelters and was...well, you get the idea.

Yeah, right. I was pretty shocked by that. I mean, I was still a teenager or just a year out of high school, and somehow I look like a dangerous abuser? Even as young as I was though, I knew enough to immediately GTFO. I just said ""oh well, you're probably mostly done, so I'll just go"" and didn't look back. My cousin tried to apologize later, but I just told her: ""Don't worry about it, I learned a lot"", and let her think whatever she wanted about what I'd learned, because it certainly wasn't anything good about those places.

You know, I was just talking with some male friends about how many times in our lives we've been instinctively seen and treated as a threat without any justification, and I realized after some thinking that I can't even count them all. It's probably somewhere in the 50-100 range or thereabouts, but that's still only the ones that I can say for sure. There are certainly more that I was probably not even aware of."
"6","The more important issue is that this is disabling and disempowering.

Shelters have a great *need* for men who are safe.  Trauma survivors require the presence of triggers in order to become desensitized to those triggers and practice their coping strategies.  

Creating a 'male-free' environment is more likely to create greater degrees of generalization as the client is taught to avoid any and all stimuli that might produce discomfort.

Seriously, those staff are making people sicker."
"7","Like, you mean that feminists method create more damage, instead of helping? Who would have thought.

I mean, it's been long known that abusers have very often been abused themselves in their youth, so it would seem evident that by hiding half the abusers, they actually help perpetuate the issue, and that most of the abused women of today could blame feminists for refusing to acknowledge the women responsible for the abuse of their abuser, and perpetuating the circle.

But at the same time, if they did acknowledge women abuser, then the number of abused people would drastically drop, so the number of future abuser would also drop, which in turn would diminish a lot the cash-cow the feminist movement has been milking for decades. And they can't have that."
"8","Extremists of any kind will generally be less than productive."
"9","She's too retarded to knock and then was surprised someone was in the bathroom? Interesting."
"10","Not only that, but apparently when you open a door and someone is standing there with their back turned washing their hands, it's extremely intimidating."
"11","One of the links I cite in my post has a much longer bit about how people deny and distort the evidence relating to gender symmetry in DV. I think it needs to be added separately due to how long it is but it is very informative so I'll quote it down here.

[https://www.researchgate.net/publication/228350210\_Gender\_symmetry\_in\_partner\_violence\_The\_evidence\_the\_denial\_and\_the\_implications\_for\_primary\_prevention\_and\_treatment](https://www.researchgate.net/publication/228350210_Gender_symmetry_in_partner_violence_The_evidence_the_denial_and_the_implications_for_primary_prevention_and_treatment)

**Method 1. Suppress Evidence**

Researchers with a commitment to the idea that men are almost always the sole perpetrator, or whose commitment to increase services to women victims of PV is so strong that it overrides their commitment to science, as shown previously, often leads to concealing evidence that contradicts this belief. In addition, many researchers not committed to that ideology have withheld results showing gender symmetry to avoid becoming victims of vitriolic denunciations and ostracism (see Method 7 below). A typical pattern is to publish only the data on male perpetrators or female victims, deliberately omitting data on female perpetrators and male victims. This practice started with one of the first general population surveys on family violence. The survey done for the Kentucky Commission On The Status Of Women obtained data on both men and women, but only the data on male perpetration was published (Schulman, 1979). Among the many other examples of respected researchers publishing data on assaults by men and the data on assaults by women are Kennedy and Dutton (1989), Lackey and Williams (1995), Johnson and Leone (2005), and Kaufman Kantor and Straus (1987). 

**Method 2. Avoid Obtaining Or Analyzing Data On Female Perpetration**

Due to prevailing ideology that women are almost never perpetrators of PV and men are almost never victims, researchers designing surveys have typically asked female participants only about attacks by their male partners, and male respondents only about perpetration. To achieve this, the Canadian national Violence Against Women survey (Johnson &amp; Sacco, 1995), modified the Conflict Tactics Scales by omitting the questions on perpetration by the female participants in the study. The American National Violence Against Women Survey (Tjaden &amp; Thoennes, 2000) sponsored by the Department of Justice originally planned the same strategy. Fortunately, the US Centers For Disease Control added a sample of men to the project. But when Johnson and Leone (Johnson &amp; Leone, 2005) investigated the prevalence of intimate terrorists among the participants in that study, they guaranteed there would be no female intimate terrorists by using only the data on male perpetration. Many other studies of PV have also omitted questions about female perpetration and male victimization. Many, agencies do not permit collection of data on PV unless questions on female perpetration are omitted. This may have been the reason that a comprehensive four site study of batterer treatment programs asked the women only about violence by the partner (Gondolf, 2002). This was a tremendous lost opportunity because it may be the only comprehensive study of male offenders which had access to their female partners.

**Method 3. Cite Only Studies That Show Male Perpetration**

Another method used to conceal evidence of gender symmetry is to selectively cite studies of male perpetration and avoid citing studies of female perpetration. US government, World Health Organization, and United Nations documents show that this method of concealment and distortion is institutionalized in official publications. For example, US Dept of Justice publications almost always cite only the National Crime Victimization study, which shows male predominance (Durose et al., 2005). They fail to mention the Department Of Justice published critiques which led to a revision of the survey. but which that only partly corrected that bias (Straus, 1999). Not only do Department of Justice publications on PV rely on data that they previously acknowledged is inaccurate for measuring PV, but they also ignore a major and more accurate study that they themselves sponsored  the National Violence Against Women .Survey. This study found that women perpetrate about 40% of PV incidents, which is close to gender symmetry in perpetration

The widely acclaimed and influential World Health Organization report on domestic violence (Krug et al., 2002) reports that Where violence by women occurs it is more likely to be in the form of self-defense (32, 37, 38). This is selective citation because almost all studies that have compared men and women find about equal rates of self-defense. Perhaps even worse, none of the three studies cited provide evidence supporting the quoted sentence. For example, Study #32 (Saunders &amp; Hanusa, 1986) shows that about two thirds of female perpetrated PV was not in self-defense. Study #37 (DeKeseredy, Saunders, Schwartz, &amp; Shahid, 1997) found that only 7% of women said their violence was in self-defense. Study #38 (Johnson &amp; Ferraro, 2000) is a review paper that has no original data. It cites #32 and #37, neither of which supports the claim.

A closely related method is to present the results on female perpetration/male victimization and say nothing about those results. The 2006 US Department of Justice report on PV gives a chart showing trends for both men and women from 1993 to 2004 (Catalano, 2006b). The only thing said about trends in male victimization, i.e. female perpetration, is that The rate of nonfatal intimate partner victimization for males increased between 2003 and 2004, returning to levels last seen in 1996 (and)1...for white males... (victimization)...increased between 2003 and 2004, from 0.5 to 1.1... It is almost certain that that there would be a commentary and an extensive analysis if Nonfatal PV victimization of white females had increased between 2003 and 2004, from .5 to 1.1 victimizations per 1,000 i.e., if the female victimization rate had doubled. But the doubling in the male victimization rate was ignored."
"12","**Method 4. Conclude That Results Refute Symmetry When They Do Not**

The studies cited above, in addition to be illustrating selective citation, are also examples of the ability of ideological commitment to lead researchers to misinterpret the results of their own research. A study by Kernsmith (2005), for example states that Males and females were found to differ in their motivations for using violence in relationships. (p. 173), and that ""female violence may be more related to maintaining personal liberty in a relationship than gaining power"" (p. 180). Although Kernsmiths Table 2 shows that women had higher scores on the striking back factor, only one question in this factor is about self-defense and this item is endorsed infrequently. Other more frequently endorsed items are about being angry (e.g., ""to show anger"") and getting back at a partner (e.g. ""to get back at your partner for hurting you emotionally""). In contrast to the idea that women use violence to maintain liberty, these finding suggest that women are more likely than men to use violence in retaliatory anger. In addition, Kernsmiths conclusion ignores the fact that the scores for men and women were approximately equal in respect to two of the three factors (exerting power and disciplining partner).Thus, Kernsmiths study generally found the opposite of what was stated as the finding.

**Method 5. Create Evidence By Citation**

The Kernsmiths study, the World Health Organization report, and the pattern of selective citation show how ideology can be converted into evidence by citation or what Gelles (1980) calls the woozle effect. A woozle effect occurs when the frequent citation of assertion in previous publications that lack evidence mislead us into thinking there is evidence. For example, subsequent to the World Health Organization study and the Kernsmith study, papers discussing gender differences in motivation will cite them to show that female violence is predominantly in self-defense, which is the opposite of what the research actually shows. But because these are citations of an article in a scientific journal and a respected international organization, readers of the subsequent article will accept it as a fact. Thus, fiction is converted into scientific evidence that will be cited over and over and further strengthen the woozle effect.

Another well documented example is the claim that the Conflict Tactics Scales (Straus, Hamby, Boney-McCoy, &amp; Sugarman, 1996) does not provide an adequate measure of PV because it measures only conflict related violence. Although the theoretical basis of the CTS is conflict theory, the introductory explanation to participants specifically asks participants to report expressive and malicious violence. It asks respondents about the times when they and their partner ...disagree, get annoyed with the other person, want different things from each other, or just have spats or fights because they are in a bad mood, are tired or for some other reason. Despite repeating this criticism for 25 years in perhaps a hundred publications, we have not located any empirical study which has provided evidence showing that only conflict-related violence is reported. In fact, where there is both CTS data and qualitative data, as in Giles-Sims (1983), it shows that the CTS elicits malicious violence as well as conflict-related violence. Nevertheless, because there are at least a hundred articles with this statement in peer reviewed journals, it is treated as an established scientific fact.

**Method 6. Obstruct Funding of Research That Might Contradict the Idea that Male Dominance Is The Cause of PV**

An example of denying funding to research that might contradict the idea that PV is a male-only crime is the call for proposals to investigate PV issued in December 2005 by the National Institute of Justice. The announcement stated that proposals to investigate male victimization would not be eligible. Another example is the objection by a reviewer to a proposal one of us submitted because of ...naming violence in a relationships as a human problem of aggression not a gender-based problem. When priority scores by the reviewers are averaged, it takes only one extremely low score to place the proposal below the fundable level. Others have encountered similar blocks; for example Holtzworth-Munroe (2005). Eugen Lupri, a pioneer Canadian family violence researcher, has also documented examples of the resistance to funding and publishing research on female perpetrated violence (Lupri, 2004).

**Method 7. Harass, Threaten, And Penalize Researchers Who Produce Evidence That Contradicts Feminist Beliefs**

Suzanne Steinmetz made the mistake of publishing a book and articles (Steinmetz, 1977; Steinmetz, 1977-1978) which clearly showed about equal rates of perpetration by males and females. Anger over this resulted in a bomb threat at her daughters wedding and she was the object of a letter writing campaign to deny her promotion and tenure at the University of Delaware. Twenty years later the same processes resulted in a lecturer at the University of Manitoba whose dissertation found gender symmetry in PV being denied promotion and tenure.

A PhD student working with Straus was warned at a conference that she will never get a job if she does her PhD research with him. At the University of Massachusetts, Straus was prevented from speaking by shouts and stomping. At two hearings held by the Canadian Commission On Violence Against Women the chairperson stated that nothing Murray Straus publishes can be believed because he is a wife-beater and sexually exploits students (Toronto Magazine article, ??). When Straus was elected President of the Society For the Study Of Social Problems, a group of members occupied the first few rows of the auditorium and, at the start of the presidential address, stood up and walked out.

As a result of these types of harassment, there is widespread self-censorship by authors who fear that publishing politically incorrect data will undermine their reputation, or in the case of graduate students, their ability to obtain a job."
"13","Here is a study that a feminist organization funded but did not like the answer so they buried it. http://newscastmedia.com/domestic-violence.htm"
"14","Sorry this one's a bit sloppy. I had to write this twice because Safari crashed before I saved the post and I completely lost the first draft of the post.

I made sure to credit every source I used due to the fact that I got raked across the coals in my previous post for not sourcing where I got my arguments from."
"15","I was looking for academic evidence that the Duluth model is sexist, and here it is before me. Amazingly put together."
"16","Thanks. I have since added more information to my post relating to VAWA and predominant aggressor policies."
"17",""" they were mostly or very satisfied with the services that they received. Their reasons for satisfaction included that the group leaders were supportive, they were able to hear about other womens experiences with abuse and were supported by them, they received referrals for additional support/services and they were able to learn about DV. ""  


Replace woman for man... and that's what I and a lot of guys explicitly ""get"" from this and other communities (as the OP laid out prior to my quote of course).    


What strikes me, is how amazingly powerful and helpful that was and still is for me on my path.  Beyond just being so simply what we would assume 'would help' a person facing the malevolence of IPV, let alone the double trauma of being the victim and ridiculed and arrested...  The ""satisfaction"" criteria are what I get from some sub reddits and a couple late therapist / Drs... and that's it, not from the legal system, justice system, or even any personal support system.  The thing is-- those aspects are specifically what really helps PTSD too.  To reframe the situation, educate, support, and empower them to not be victims again.   


Reminds me of all the [Jordan Peterson](https://www.youtube.com/watch?v=Snke9v4S2rU) talks I've been scouring when having a PTSD thing of recent.    


Guess we just need to keep helping ourselves"
"18","As a former Sgt.  I was very carful to tell my subordinates not to call the police when getting abused by a wife. Walk away.  They will arrest  you and put you in jail regardless of whos wrong, and that little overnighter gives her enough time to empty the accounts, max out the credit cards and take anything of value, probably to the house of the guy shes cheating on youre with.  Walk away, drain the accounts yourself, cancel or freeze the credit cards and hang with your buddies to have an alibi in case she reports you of anything.  Ive had to pick up men from the lockup,   If she works.   Get you buddies to help clean out your place and put it in storage until you get a new place.  If your renting cancel your rent agreement."
"19","Honestly- THANK YOU!  I've been there and even as a grown ass man, well- my dad served for 20 years too and he was the kind of leader you are in that way... having a more experienced man do exactly that for me--  Saved my ass, I was pretty apathetic and broken, especially regarding being helpless to protect my son... hell that night I 'walked off' three times and secluded myself in the other side of my house (BUT I SHOULD HAVE DONE EVERYTHING YOU SAID- and I should have walked a lot farther).  We always have reasons, stupid as they can seem when out of the fog, for staying until we finally leave those relationships... for me it was my son, but he was also my strength and the reason I left as soon as the violence got its worst and the third time that night I walked away she called and lied to police.

&amp;#x200B;

My dad saved my ass.  He came and bailed me out after the 2-4 days I ended up having to mandatory stay (because of county verse state laws and my first near 24 hours in city, had to do more in county after transfer).  I was pretty fucking close to whatever I can imagine feeling shell shocked must be.  He let me pay him back after getting my finances straight (and helped me think through how to provide for her / my kid while protecting myself and initiating a divorce).  I stayed there for 6 months until I could get her to accept appropriate mediation (would have taken over a year to get any kind of 'emergency custody' or divorce / custody hearing).  I still was too lenient, let her 'waste' over 8 grand before that 6 month period, but I was also playing a longer game to go for full custody in court if she didn't mediate in a way okay for my son and I prior.

&amp;#x200B;

It took me awhile, stumbling through mistakes, but I eventually DID do all the advice you gave your boys-- and I have to say thank you, truly from the bottom of my heart for being there for those men and young guys in that way... when they really likely needed to have that fucking good, healthy, course straightening paternal advice and brotherhood.  It fucking means the world, even if/when we don't see it at the time and always in ways we won't ever fully be able to articulate or completely identify-- but damn sure appreciate like a necessity.

&amp;#x200B;

I'm glad you replied and glad you're out there, I'm not throwing around worthless compliments or assuming you're some saint or exaggerating.... I just know how damn destructive tangibly in all the ways you are helping guys walk through the minefield-- and how internally broken and out-of-fight and full of apathy we can be at that point.... and that makes a shitty self feeding circle until we snap out of it and start 'coping' with that internal shit by making the smart actions to handle the tangible concerns that you champion.  And I'll be damned if sometimes when 'there' you really do need that 'support' just to hear a brother at least solidify something our momentarily low self esteem has us doubting we should do or not do.

&amp;#x200B;

Thank you-"
"20","Fine job of exposing yet another feminist agenda item bathed in verbiage but sexist at it's very core. 

&amp;#x200B;

it exists only because counter argument has been censored."
"21","I'm amazed at how many people believe domestic violence and sexual abuse are about control. It boggles my mind.

Sure, there are psychopaths where that is happening. But the bulk of it is just people behaving badly.

People feel hurt and anger and they act out and hurt.

Rape especially is perpetrated on younger and prettier men and women. Not because they are powerless, but because they are desired.

Sex abuse with children seems very much to be about a twisted sexual fulfillment as well. From the limited reading I've done it is very much about opportunity and fantasy fulfillment. 
.
Is that a power fantasy? Probably not. I suspect it is more about neotony. All those sexual characteristics of youth that are desired in young adults as targets might also be there in children to some degree.

That last bit about kids is much more speculative than my earlier this about adults."
