"","matrix.0..nrow...numComments..ncol...1."
"640","Sorry buddy, but that's just not my experience. And I've done a lot more interesting work than just CRUD apps. 

I'm sure there have been times I could have implement more interesting solutions if I had a stronger traditional CS background. Though from my experience, ""interesting"" solutions are usually the ones you want to avoid ;-)"
"641","Right. Most businesses are powered by a crud app, just saying"
"642","More or less how many interviews have you done if you don't mind me asking?"
"643","Oh man, I've been doing this around 8 years, I'm on my third job, had a small handful of interviews at each change.
Maybe it's different coming right out of a CS degree. I kind of lucked my way into my first position, and then had some concrete work to stand in after that."
"644","That sounds more like a damn great way to fall asleep. OP can't program in the first place, I would rather suggest programming to the point of knowing the difference between an interface and an abstract class before wasting time on implementing more obscure data structures you might need to know about in interviews."
"645","Ha, maybe. But to each their own, eh?"
"646","This is a good list. I had to implement almost all of these in C++ in my data structures class and it really makes you understand how they work under the hood. I can answer pretty much any question about how hash tables or AVL trees work because the code for it is burned into my brain."
"647","Probably overkill. Arrays and HashMaps and Sets will get you 95% of the way there."
"648","Ive implemented those multiple times in the past but theres no way I can write those data structures off the top of my head. I think its unreasonable to expect someone to do so."
"649","Anyone can implement a linked list.  If they say they can't, they're probably just getting tripped up by some language-specific syntax.  A scavenger hunt (the one where each clue tells you where to find the next) is effectively a linked list."
"650","I had one of the better profs for the course and most of my peers in that class seemed to have retained the knowledge, so I think it's just a lack of repetition and practice for me (I took it about a year ago). Thanks for writing out a list of structures to implement!

edit: grammar"
"651","&gt; - an ArrayList, more or less; something backed by an array that resizes itself if you put too much in there

found the java programmer"
"652","That is WAY overkill for just trying to get your foot in the door. You can probably stop at binary tree if you're not applying to the big four. Even then, I would only expect to see directed graphs or avl balanced binary trees very rarely."
"653","Yeah, non-big four here, binary tree was about as far as my last interview went. Binary trees, explaining the difference between DFS and BFS, as well a question on if I could implement another data structure with their generic Node object (you could, it was a Doubly Linked List). It was pretty straight forward, mainly to suss out if I was full of shit or not about what I learned in college."
"654","And this is exactly why the impostor syndrome is so prevalent. Because communities like this upvote posts like his where people are putting more effort into bragging than they are actually explaining the industry. People come here looking for actual industry advice, and they get regurgitated big four factoids instead. It's no wonder people will think they're not up to snuff when someone is telling them that they need to be able to implement directed graphs and avl balanced binary trees on the fly right out of college just to get in the industry."
"655","I guess the community is just hungry for Big Four stuff. I mean, you can have a satisfying life as a programmer anywhere, at any company, and not have to fight the hordes to get noticed by Google-senpai. Not that there's anything wrong with fighting the hordes either, but yeah, it seems to be a theme here."
"656","I don't think it's hunger at all - I think it's circular logic. People upvote those posts because they're most like the posts they've agreed with in the past. They downvote anything outside of that because people use it to justify a very elitist attitude: non-big four jobs aren't ""real"" programming. Of course, very few people here actually have a big four job, but since imposter syndrome is so prevalent... it's a cycle."
"657","I think it absolutely is hunger. A big 4 salary is like a golden ticket to most people into total compensations of almost 200k out of college, why would there not be a huge demand to get in and find out info about them?"
"658","Most people at the big four are not making 200k right out of college. Many people with 5+ years of experience are not making 200k at the big four. The other problem with this reddit is that it tricks people into believing that the highest tiers of compensation are the average."
"659","If you can't get promoted from L3 to L4 in 5 years then the problem is probably on you.

https://www.levels.fyi/"
"660","On the positive side, you're probably smarter than half the people here because you realize it's not some kind of syndrome.  You could start implementing all kinds of different data structures and algos."
"661","This is so frustrating to me. Any time I've ever voiced concerns people are always like ""oh it's just imposter syndrome bro we all deal with it!""

like no dude I'm knowledgeable enough to realize that I LACK knowledge and skill and it makes me worried for my career"
"662","the question around impostor is probably more a ""should I be expected to just solve every problem, know all things and create new ones with my hands in my pocket"" vs ""am I allowed to struggle with some"""
"663","[deleted]"
"664","Right but then when I continually have difficulty applying it and people reassure and say it takes time etc., that's when worry sets in and people regurgitate ""imposter syndrome"" to make you feel better"
"665","Impostor syndrome is real, though, and this reddit is a perfect example. A lot of people get duped into believing that the interview standards used by the big four are industry standards, or that they represent the type of work that actually gets done in the industry. Neither of those are actually true, but if you believe it, you're going to get awfully anxious thinking about trying to climb a ladder in the industry."
"666","A lot of legitimate imposters use imposter syndrome to make them feel better about their own lack of ability. 

We dont have the standards of being an architect or doctor. The industry as a whole really has a massive amount of people who dont know what theyre doing. 

Theres a big difference between a competent frontend software engineer having to whiteboard some leetcode hard graphing algorithms in 30 minutes and the same engineer not knowing complexity analysis, data structures, and practical problem solving skills thats a fundamental part of their profession.

Ive literally interviewed people before who cannot solve fizzbuzz-difficulty problems."
"667","Ive felt this way before. My recommendation is actually to start off with Hackerranks videos on data structures and algorithms (very short, very well explained). Then go from there"
"668","Also they cover really popular interview questions. Their videos are pretty awesome"
"669","Thank you!! This is a great resource."
"670","I *totally* know what the difference between an purely abstract class and interface is, but for someone reading this who doesn't, what is it?"
"671","An abstract class can have method code alongside the method signatures, while an interface is only method signatures.

So you could have a PaymentProcessor abstract class that has a filled-out purchase() method that also calls a filled-out validateUser() method, then calls  signature-only like validatePaymentMethod(), makePurchase(), then calls filled-out methods like handleError(), recordPurchase(), deliverItem().  Such a class would be extended for CreditCard, Paypal, InternalRefund, or Bitcoin subtypes, where you deal with different real-life payment processors (or realistically different vendors).   

Look up Facade or Command patterns in your preferred language for more examples."
"672","So I understand that, but what if all the methods are also abstract and not filled out? Is there really any difference between an abstract class and an interface?"
"673","Semantics. If you're defining an abstract class without any defined methods or stored state, you should probably use an interface instead, to better convey what your actual intention is.

There may be some libraries/frameworks that require interfaces specifically. For example, I believe OSGi requires your class to implement an interface before you can export that as an OSGi service.

Note that as of Java 8, the distinction between abstract classes and interfaces blurs even more, because interfaces can now define default methods."
"674","Oh, I thought you said ""purely"" as kind of a typo, so I ignored that.

If the language permits subtyping identically, there's no difference in the types to me.  I haven't programmed in Java for so long, I couldn't say."
"675","The difference is an abstract class can store state. Methods and fields (static final in java) in an interface are public while abstract classes can use more restrictive levels."
"676","In addition to what others have said, you can have a class implement multiple interfaces, but only inherit up to one abstract class, so there's a benefit to making something an interface if it is appropriate."
"677","No, an abstract class represents _implementation_ which might include state."
"678","Im not sure I understand your reply. Are you saying abstract classes cant or shouldnt contain state?

Abstract classes are definitions. If I define one with class/instance fields then what am I doing wrong?"
"679","You say the difference is that they can store state. That's not what an abstract class is. 

What makes an abstract class different is it contains _implementation_. This can include state. But it's more general than that, and includes method implementation as well."
"680","Ohhh... In my defense, I use Java and default methods allow for implementation in interfaces.

In the case of a purely abstract class and traditional interface what would be their main differences? Im only coming up with scope and flexibility for their implementations."
"681","Somewhat depends on the exact language and rules for Objects for the most part, especially if they allow multiple inheritance. Multiple inheritance can get messy, so a lot of languages only let you inherit from a single class, but your class can implement any number of interfaces. Generally, inheriting from a Class C means A is an C (e.g. a Dog is an Animal), but  implementing an interface I means A can do I (a Dog can Move and Implements Mover, but Cars can also Move, but would be Vehicles). You separate out abilities from your object model which allows for more reasonable expectation of how you design your class structure"
"682","I finally just got this drilled into my head yesterday as a senior because I needed it for a design patterns midterm lol. An abstract class is a class with at least 1 abstract method. An interface is a class with only abstract methods. Every sub class is required to provide an implementation for each abstract method"
"683","So an interface is just a subset of an abstract class basically and there is no true difference if an abstract class has all abstract methods?"
"684","Well, a class can implement multiple interfaces, so there's some benefit to making it an interface."
"685","In addition to the above, in languages such as Java, we can only subclass one class but we are able to implement multiple interfaces."
"686","Abstract classes can store state."
"687","Look, I'm no expert but I think you should just sit down and code. Practice writing a Stack or Queue from scratch, don't just read the defs, actually use them to build something."
"688","I just had an interview yesterday where I couldn't explain difference between interface vs abstract class properly. I felt dumb because it is something I learned in my freshman year. I understand the concepts it's just I am not good at explaining with words."
"689","A good example that helped me would be to have a Vehicle abstract class. Then have Concrete classes such as Car, SUV, Truck, etc. They all inherit functions like drive(), stop() blah blah. Then an interface would be like a set of functionality that a vehicle subclass needs to be guaranteed to have. Like V8Engine and V6Engine interfaces. Which each come with different capabilities.

I also recommend reading Head First Design Patterns. Youll see somewhat less contrived examples."
"690","Let me take a shot here :)

I like to think of it as, purpose-wise they're different, because functionality wise they're becoming more similar.

The biggest difference is, one (abstract) class can implement multiple interfaces, while can only extend a single abstract class. The leads to, interfaces are good at describing behaviors, like a duck can both walk, and quack. But with abstract class, it's more suitable for describing ""what it is"", like a duck is an animal.

There are languages that allow multiple inheritance, like C++ or Python, and in those languages, the term abstract class or the difference there is vague. But if the terms are defined clearly, it shouldn't very hard to tell the difference."
"691","&gt;I legitimately do not understand any data structures 

I seriously doubt this.  Most data structures are VERY simple conceptually.  I believe the problem is how most of them are taught.  I understand things visually, and topics such as data structures can be explained very easily with images whereas written/spoken language makes them insanely complicated.  Once you get into structures outside of 3 dimensions (4-D arrays), they can be hard to grasp functionally though, even if the concept is similar.  

Take a look at these, just looking at the pictures:  [Array](https://www.geeksforgeeks.org/introduction-to-arrays/), [Linked List](https://www.geeksforgeeks.org/data-structures/linked-list/), [Stack](https://www.geeksforgeeks.org/stack-data-structure/).  Just look at the pictures and read the very brief descriptions.

&gt;unable to explain ""fundamental"" CS concepts to anyone (like abstract classes vs. interfaces - i keep forgetting the differences).

This isn't ""failing to understand"" anything, it's simply a vocabulary problem.  I've got a bachelor's and a master's degree in CS.  When I was taking my final exams for my master's degree, I totally flipped out because the test was only about 12 questions (covering everything in the program), but the questions were things like ""Explain how [*Name of Core Concept*] can be used to solve the problem of [*what you'd use it for*].""  I've never had as much of a feeling of dread as when I was taking that test because there were several of the [*Core Concepts*] that I was completely drawing a blank on, and had no clue what the questions were even talking about.  When I told my professor that I had no clue what the [*Core Concepts*] were, she acted like it was no big deal.  She just told me [*Core Concept*] is [*10 second explanation of what it is*].  She knew I knew the material, and once she reminded me of what it was, I was able to write pages of info about those concepts.  It was simply a vocabulary problem.

And as for the difference between abstract classes and interfaces, I wouldn't consider those ""fundamental"" concepts, and as long as you have the general idea of what they are, you can look up the specifics when you need them.  The real world doesn't consist of ""closed book tests"".  I've got almost 20 years in the field, but I'll still Google stupid simple things like ""how to sort an array in Javascript"".  My head is too full of things like understanding the full conceptual model of a complex 20 table application and the data relationships to worry about the fact that I can't just instantly spit out the best way to sort a Javascript array."
"692","thank you so much - I also learn visually so those links were extremely helpful."
"693","&gt; When I was taking my final exams for my master's degree

Huh... I just did the coursework and graduated (non-thesis track). Some of the courses had finals, but many didn't (with most of the grade being based on a paper or project instead).

Algorithms though... F*** that class. Only one I got a C in (during my MS, my BS had a few more :P). Most of it I kind of got, but it was just time consuming... Like ""Perform the following operations on a red-black tree...."" Even using the book as a reference (open book test) that set of problems alone took a good 20-30 minutes just because of all the re-balancing you'd have to do."
"694","&gt; When I was taking my final exams for my master's degree

I was actually referring to the single, final, comprehensive exam encompassing all of the courses I took. I don't remember which actual courses had final exams, but it certainly wasn't all of them.  But it was the final, ""everything rides on this one test"" exam where this happened."
"695","Ah, yeah, for me Algorithms was one of those classes where a significant part of the grade was the final exam... and it was a required class and anything below a C was failing and a C got you put a warning since you needed a 3.0 cumulative GPA to graduate. It was a very stressful semester :("
"696","Hello,

If you want to learn Problem Solving skills (generic)

1) ""How to Solve it"" - Polya is a good book. 

2) Taking someone's help can be really helpful. Observing them solve problems and taking their help to correct your approach. Apprenticeship can be very helpful."
"697","Practice is your best friend here.There are tons of websites that allow you  to improve (ex:leetcode) also don't get discouraged , if you practise enough you will be able to land any job.Good Luck"
"698","If you're just forgetting stuff, consider an SRS like r/Anki."
"699","Thanks so much, this is an amazing tool!"
"700","You should try to code everyday. Set some time and then sit down and code for that amount of time everyday. Most of these can be learnt theoretically but they will not stick around if you don't practice/use them. Focus on easy problems but play as much as you can with the data structures. In my data structure and algorithms class we had to build linked list, doubly linked list, red black tree, etc. ourselves from scratch, which was an awful lot of work but really helped reinforce the theory. I can always explain the data structures that I have implemented from scratch, at least the idea behind it."
"701","There are plenty of jobs for you where you can be productive in higher level languages without understanding the theoretical CS data structures. If you can get code to do what you want you'll be alright if that's what you're worried about. Yeah it's good to know this stuff but you won't be homeless if you don't"
"702","You never had to implement a linked list in one of your courses?"
"703","`class Node:`

`def __init__(self, value, next=None):`

`self.value = value`

[`self.next`](https://self.next) `= next`

boom done"
"704","Now...

* Insert a value at the end of the list
* Insert a value at the beginning of the list
* Print all the values in the list"
"705","Do nofap"
"706","Id bet that youre a lot better off than you think you are. Imposter syndrome is real. The vast majority of developers have felt it, and it sucks. Sure, you probably need to brush up on some things, but dude, youre not even finished with school. The most important think for you to focus on now is getting your resume looking sharp, sending copies of it to every corner of the earth, and building confidence in yourself.

Youve gotten this far because youre smart. Just keep chugging. If youre overwhelmed, take a break for a day or two, and do something you enjoy."
"707","It's pretty common. Both in the sense in that feeling this way when it's not true is pretty common, and colleges producing CS students lacking in core CS skills is pretty common.


But good news! I've been employed for quite some time now, and I dropped out, and I can't explain either of those things (I mean, I've *used* them as recently as yesterday, but I'd have to google it for maybe the 5th or 6th time to explain it properly, which is harder than just using them day to day).

Lacking in problem solving skills and

&gt; I've been flunking all technical interviews that ask me questions I haven't seen before.

this are bigger problems, but they're solvable.


So it sounds like you have three problems. Lack of practical experience solving problems, lack of some specific memorization for interviews, and lack of confidence.

-----

So first off, I recommend working on some projects on your own that you don't know how to solve, and solving them without an answer being handed to you. While I generally despise the whole 'leetcode grind' programming solutions to algorithmic problems while forcing yourself not to look up solutions to help you would be good practice.

You need to be able to think through a plausible attempt at answers to questions you don't know how to answer, because you will continue to get pelted with questions you don't know how to answer without a couple hours looking through wikipedia, stackoverflow, or documentation, during interviews.

This is the #1 skill colleges are supposed to teach you (i like to think of the entire college experience as bullshitting 101, although this has more substance than just bluffing) but it doesn't always pan out that way. So, practice practice practice.

Even if you do start racking up leetcode answers, build something on your own from scratch that requires you to work outside your comfort zone and not directly follow any tutorial. If you want to rip your hair out you've picked a good problem. By this I do mean a complete standalone application relevant to the sub-field of CS you want to get into.

Also, hopefully you do know how to code by now, but if your coding skills are lacking, once again full projects are the best method of improvement (unless you're a beginner, then it's tutorials, tutorials on full projects, then full projects).

-----

Ok that handles problem 1.

Problem 2 is you need to memorize some explanations to pointless bullshit for pointless bullshit weeder questions. Do you need to understand interfaces? NO! (well you should but still no). What you need to do is feed the interviewer some bs rote explanation for what they are like you're a living embodiment of the textbook.

Is a good way to answer all questions? Of course not, but it's how you answer these nitpicky knowledge questions that are basically trying to test if you slept through class for 4-5 years.

If you keep getting stumped, try looking for online resources of popular questions and learning the answers (last interview I had I pre-memorized almost half the questions so this works distressingly well), and write down any questions you didn't know the answers to after failing.

Read up on those and try try again.

You don't need to answer every question, but ideally you don't want to flub all of these. It's not that the knowledge for these sorts of questions matters (arguable they should never be asked) but that you get the interviewer to feel good about you, by answering these questions confidently.


-----

So no one can really help you with problem 3, but try and find someone to help you practice interviews, and remember that faking is literally the same thing as making it.

Additionally, knowing the bullshit questions can make you feel better about the whole process. Practice taking a moment to get a deep breath and really think about every question. Not only does that help you, but most people like to see a steady measured approach to each question, combined with neither over nor under explaining it. So give a full explanation, then shut the fuck up no branching into your life story based on someone asking you what your experience is with X (yes people do this, so damn much dear god why).


Try dressing up real nice, overkill for whatever you think is expected by a little bit, make sure you shower and shave super well. Really ultra clean cut even compared to yourself dressing up usually.

Total anecdote but it helps me put on my bullshit confident sales-like persona.



Anyway, this is all my hot take based on personal experience and my general cynicism so grain of salt and all that. It isn't a very controversial set of statements though at least among the people I know."
"708","Practice, Practice, Practice. I had the same issue and the way I got around it was creating a blog. I would try to explain in the blog the concepts I didn't know. Remember, if you can't explain in simple terms then you don't know it well enough.

Start a simple pet project and explain to the most stupid people why you took each step this could help you understand your own logics, if you think you could have done it a better way, make the changes."
"709","Read Cracking the Coding Interview.    
[http://www.crackingthecodinginterview.com/](http://www.crackingthecodinginterview.com/)  


This should help clarify your understanding."
"710","Try some c++ oop.

You'll see why differentiating interfaces and abstract classes is useful.
And if you see that you'll know the difference forever.

My point is to try to apply your knowledge. Plenty of resources out there for that.

Think about the concepts and try to find examples for their use.

Try to make a point of differentiating similar concepts (types of polymorphism, for example).

That's how I try to study anyways. 

My gpa is mediocre but I do ok in interviews."
