"","matrix.0..nrow...numComments..ncol...1."
"1007","I think if developers are not involved in the hiring process I would start there. Because it really sounds like this guy should've been caught in the process.

I set up an interview process for a client of mine where we basically did a pair-programming session. Happy to explain the process if you're interested."
"1008","i do; you watch

i do; you do

you do; i watch"
"1009","make bob sit at the computer and type and use the breakpoints. Don't tell him everything. Ask him what he thinks. Tell him he is expected to start figuring this out. You are here to help. Tell him to take notes. Since everything is new he should write stuff down. 

That is fair. If he still does not progress after some time, he won't make it. However, you need to give him time."
"1010","It's a challenge. Critical thinking is reflective of IQ and virtually impossible to change."
"1011","It is not at all clear at this point if he's not troubleshooting his own issues because of behavioral conditioning/bad habits etc, or if he actually doesn't possess the ability for critical thinking. 

Attempt to address the behavior with guidence with coaching and then later assess if it if he has the intellectual horsepower or not"
"1012","[deleted]"
"1013","I don't get why this is being downvoted."
"1014","Because there's a lot of anxious kids here who don't like what you're saying.

Because this is exactly what is going to happen at most companies. If you can't understand what you're doing well enough to be able to debug the stuff you *wrote yourself* you are going to be *fired*. Companies don't pay you to write exactly what others tell you to write, and then let them fix the issues you created."
"1015","Stop reading this sub, work when you work, play when you play. Please try your best to have a life outside of work.  
If things look bad at work, use your holidays, prepare for 2 months, get another job offer and quit.   
Repeat this till dead. Chill out bro, half of the stuff here isn't applicable/necessary to everyone."
"1016","Boom. Well said"
"1017","I agree, stop reading this sub. You know that one or two kids in your comp Sci class that seemed to live and breath this stuff, and are clearly not doing much else in their life?

You know how you have those few total over achievers, who are clearly studying for hours a day? But the material doesn't ""click"" for them, so they keep forcing it?

This sub is dominated by these folks. People who grind leet code. People who make it their life mission to get into Google or Facebook because they feel working elsewhere has no point."
"1018","I can understand why some people chase this, as an F myself.

There is a standard of living afforded by most tech jobs.  And then theres F and G.

Its not unheard of (and very very likely) that by the time youre a principal (L6 at F and G) you can easily be making well over 400k and in some cases way over half a mil TC.  Not to mention literally everything else is covered for you (food, transport, many expenses others have to pay for).

Sure, not everyone is cut out for these jobs and not everyone needs to get a job here to be successful.  But, going from a well known tech company at my last job that already paid damn well to F resulted in an absolutely unbelievably absurd change in my standard of living.  Just my two cents."
"1019","Sure, but quality of life is about a lot more than total compensation from your job. I work at a Big Name and make a lot of money, but as soon as I have free time to get my resume and everything together im leaving asap, and willing to take a pay cut to do it because I kinda hate it. The point of the question and the above response are not whether it can be worth it to grind to get one of these jobs, it's whether it's normal not to do that, which it totally is. As somebody who has done it I'd say it's probably not gonna be the right thing for a lot of people, even if they're totally capable of it, and plenty of people I know who work less and make less money are much more happy with their lives."
"1020","What specifically is disagreeable about a big-name? Culture? The projects? I wish I were in your position right now, being more comfortable in life and knowing how to program. I am in humanities and I am seeking a career change at 31 years old. Its going to require a lot of diligence."
"1021","Mileage will vary quite a lot I'm sure but I personally don't like most tech industry culture to begin with, and the big name I work at (and I'm certain it's not unusual in this regard) has a weird mythology going on. There's a huge difference between liking your job and loving the company you work for as a brand, and that's rampant. As far as projects go, in my case and that of plenty of people I know you work on a team with very specific responsibilities, siloed from other departments and paranoia about sharing too much about what you're working on when you do interact. In my case in particular my superiors are extremely aloof and in a different state, so things are a huge mess and basically I got dropped into leading a team unexpectedly. 

Like i said, mileage will vary on this stuff greatly, probably even within my own company, but I know plenty of developers who might be making a little less money than me but they're still making much more than I'm sure you're coming from--I was a philosophy major who switched over at 28, so I understand--but have more interesting work, with better leadership and cultures, so the main thrust is that it's not necessarily worth grinding specifically to work at one of these companies. It's just a fetish, and the prominence of that fetish is probably a big factor in making it such a weird mess in the first place."
"1022","&gt; principal (L6 at F and G)

Principal at Google is 8. There are probably 1/100 as many L8s as L6s."
"1023","And to add, L5 is a terminal level so you actually have to get yourself promoted above that, it doesn't just happen by virtue of staying long enough."
"1024","You don't get L5 just by staying long enough either. It's just that if you are sitting at L4 for years and years and years people might start looking at why you aren't growing. At L5 there are no longer growth expectations before people get a little concerned."
"1025","L6 can happen with an amortized moderate amount of effort by the time someone turns 45 Id say.

In any case, in the 20s and 30s pre-having a family perse, I can certainly see how some people would slog it out to put themselves at a position of very comfortable wealth later on."
"1026","i love how ppl talk about that place like its been around forever. its younger than me as a 28 year old. nobody has been there a full careers worth of time except if you mean they got rich and left. and deffinitely no one in the last 5-10 years has been there a full careers worth of time. yet i keep reading shit like people are ok to stay at L5 for their career lol"
"1027","I thought l8 was a staff?"
"1028","L6 is staff. L7 is senior staff. L8 is principal."
"1029","https://www.levels.fyi/"
"1030","the google fellows ive seen all havd a Phd. im not sure its even possible to get there with just a bachelors, no matter what you do"
"1031","Lots of *people* at Google have PhDs so this probably skews things. Chandler Carruth is extremely publicly visible and has a MS. I know several directors with bachelors (or even non-cs degrees). 

But yeah, planning on making L8 at Google is a recipe for unhappiness. Most engineers never make L6."
"1032","yeah they cant make L6 because they don't have a masters probably. that was my point, at a certain level i don't think you can go any higher without an MS or even a Phd. a quick linkedin search shows there are people who worked there like 15 years and are at fellow level or distinguished engineer or principle and they don't have less than a masters. with most of them having a Phd."
"1033","&gt; yeah they cant make L6 because they don't have a masters probably

This is absolutely 100% completely wrong. I know L6s at Google who don't even have a BS. Education comes up literally not at all in promotion reviews. 

Googlers are disproportionately highly educated. That's what you are seeing here. People who are smart and driven enough to stand out among Google engineers tend to be the sort of people who were smart and driven enough to get lots of degrees.  But loads of L4 engineers have PhDs and have been sitting at L4 for 5+ years. There are plenty of jokes about how many PhDs are just pushing protos at Google. Education background is completely independent of career trajectory.

And yeah I'd expect L8s to have been at Google for a long time. Its enormously difficult to develop the sort of wide influence you need to achieve that level in a short time frame."
"1034","no it isn't lol. jeff dean wouldn't be the head of google brain with just a BA. link me to high level google engineers who only have a BA. I wanna see the linkedin profiles. because I all I can seem to find is Phd and MA"
"1035","You aren't listening to me. Yes, a large portion of L8s have lots of degrees. That's because *a large portion of Googlers have lots of degrees*. I don't see how somebody could think that a masters degree from a decade or more ago has anything to do with advancing to major leadership roles. Feel free to just not believe me I guess.

Listing the specific L7-L8s and directors I've worked with reveals my personal identity too well but you can just look for directors of engineering at Google and find plenty with just bachelors degrees. 

And literally none of Jeff's work today relates to his PhD."
"1036","Can you explain what is an F and G? Never heard of these."
"1037","Facebook and google.  Starting fresh outta school kids get TC of 150-170k.  4-5y in youre getting above 250-300k.  By the time youre in your 40s not unheard of to clear 500k+"
"1038","I would have to stand 50/50 on your stance. 

You are right, some people live to get into the big jobs. 

I also agree that not everyone (and honestly, most) enjoy the work and turn it off when they clock out. I completely respect that.

However, some of us grind at work and on our free time because we truly enjoy it. It would drive me nuts to not work on my homelab 3-4 times a week after work.

For example,

I spent my last weekend building an AWX tower for my NAS (for Plex) and server rack so I could automate 99% of it.  

The weekend before that, I spent 12 hours trying to get Zabbix to run in a certain way. Getting it work is the rush of dopamine I really enjoy. 

For a few of us, it's not the job, money, or title. It's just our passion."
"1039","&gt; It would drive me nuts to not work on my homelab 3-4 times a week after work.

That is very different from what the OP was referring to I feel. I too have a homelab, and I would go insane if I didn't get to dabble with personal projects. But, OP is going for, I think, people who's ""hobby"" is grinding away on leetcode. I am very confident that the people who dabble in homelabs doing it pretty much solely for working a better job compared to doing it for fun, is much less than the people on leet code doing the same."
"1040","Oh, I see what you mean. That's fair. 

&amp;#x200B;

Then, agreed."
"1041","Side projects are always fun and are an easy resume ticket item. Leetcode questions are just about acing the technical interview, which is 5% of the real interview. The majority of the interview is about seeing if you can fit into the company's culture."
"1042","90% of my interviews are coding questions"
"1043","I think you are giving way too much credit to this sub!"
"1044","I don't think that grinding leetcode is necessarily true for everyone because for some it might true but for other its a hobby. I started coding not because I want to get a job in some big name companies but I just enjoy coding, leet code and other competitive programming websites are just places where I can practice and improve my problem solving skills. If someone doesn't enjoy problem solving I don't think they should work as a software engineer or any types of technical job. I don't know much about what they do in industry so I might also be wrong about my assumptions."
"1045","I think youre getting downvoted because you imply that not wanting to do challenges like Leetcode equates to not enjoying problem solving. When working as a professional software engineer, chances are you solve problems all day long that often have a real weight to them, at least for your career or your company. It can be rather hard to want to code more after already coding 50 hours a week, and especially so if its something isolated and random like a problem assigned by a website. Personally, I would never do Leetcode etc for fun, but I have worked on a passion project."
"1046","downvoting doesn't really mean much to me because I knew I was going to get downvote anyway. Doing something fun is subjective but you might be right about not wanted to do anything with after having to code for 50 hours a week. Also I don't think they just code all the time especially when you collaborate with other team members and designed your solution before implementing it."
"1047","&gt; Also I don't think they just code all the time especially when you collaborate with other team members and designed your solution before implementing it.

That's the most important part of coding. This is the difference in thinking between a senior engineer with years of experience and someone who hasn't entered the industry yet but grinds problem sets."
"1048","Yes, of course we dont write code all day long, but were still thinking about it! Sometimes I have so many other things going on at work that when I do get the chance to just program its a joy. But that doesnt mean I want to put my mind back into that mental space when I leave work most of the time, even if most of the day has been eaten up writing a design doc or discussing customer needs with project managers or whatever."
"1049","Well stated. I am on Job #4, almost 10 years into the industry. That's about a 2 year tenure average. I only ever ""leetcoded"" for about 4 weeks total in the past decade, closer to the start of my career than recently, but still not like 300+ problems a month or anything like that. That's completely unecessary, rote memory will help you memorize those keyboard shortcuts a bit better, but that's about it. If I worried the way this sub does then I would have been dead by age 30. Everyone's gotta chill out! We're all in this life thing together."
"1050","Username checks out"
"1051","This is really good advice"
"1052","Ive been going on 2 years minus my first 30 days looking for another offer. Seems like some jobs are so bad the mere presence of them on ones resume precludes them from escaping."
"1053","NOT TRUE MUST DO LEETCODE NOW GOOGLE CEO JUST OFFERED ME TO BE HIS POOL BOY FOR 300K TC"
"1054","Living life IS the goal. But, you DO need money to do that comfortably, particularly as you progress in life. Mortage, wife, kids, health care, savings, retirement/401k, getting a high salary earlier will make the later years of your life easier with the magic of compound interest.

Leetcode hell is real, unless you're in non-tech hubs, or working in non-tech products (where you'll get nearly half TC of a tech product, I know because I get this in an expensive tech hub). 

There's definitely a balance to it all, but the sub is pretty accurate in terms of finding work in target cities/companies, you're not going to skate around technical round interviews where the goal is literally to fail you unless you can do DS&amp;A."
"1055","Sturgeon's law applies as usual."
"1056","How do I buy gold? Although really ive been at this for years and haven't gotten to that entry level job yet :/"
"1057","Thanks so much, I need this right now."
"1058","Honestly after you have some years of experience and a couple side projects to show. You won't have to grind leetcode. 

This sub has gotten to the point that its FAANG/Big N or bust."
"1059","But grinding LeetCode, that should be done daily, regardless of who you are, or what you want."
"1060","/s"
"1061","This sub though you were serious, hilarious"
"1062","You think there arent people around here who say the same thing unironically, unamusing"
"1063","I think 90% of this sub doesn't know their arse from their elbow and are so engrossed in believing everything they read that they'd take obvious sarcasm and think the person was serious."
"1064","They dont know their elbow from their ass, so they come here looking for real answers, and somehow thats their fault? Thats not how that works...."
"1065"," &gt; How do you guys handle the pressure that you get here?

Why are you allowing a bunch of FAANG-obsessed Internet randos, especially those who've done little to prove that what they say should be given any credence at all,* to dictate how your life is run?



*Apply that to what I'm saying, too.  My flair says 30+YoE, but I could just as easily be some script kiddie with a high school diploma."
"1066","hehe dude my thought exactly? OP was specifically referring to the 'pressure' from this subreddit? Exactly my thought my vibe is most popular posts are from teenagers or early 20s. There is no pressure from this community man. there are plenty of posters who dont give a shit about grinding l33tcode or making big bucks working at a sleezy ad agency whose sole purpose is to collect all our data and sell it. Before someone says 'hey not everyone at google is an ad salesmen' .. well guess what bug, that cool novel prototype you are writing. nobody cares unless it makes money . what makes money? selling personal data and shitty ads. makes the world go 'round friendo!"
"1067","Helping a trillion dollar company make more money gives my life purpose!"
"1068","Believe me son they really care about you too. Together you can change the world and make the world a better place for everyone."
"1069","I love making stuff the executives think looks cool and then use to add zeroes to their bonus!"
"1070","You laugh now, but in the office the true believers run the show and have a hand in determining your fate regarding raises, promotions, bonuses. I am not saying it doesnt suck for self-aware people, but we deal."
"1071","How dare you?! Any less than 300k TC for a html/css email coding job is slave labor!"
"1072","FAAAAAAAAANG!  I hate internet-created acronyms."
"1073","Script kiddie confirmed. I can tell because I'm a 40 year dev with 1.2 billion coding hours logged"
"1074","It only feels like 1.2 billion."
"1075","&gt;Why are you allowing a bunch of FAANG-obsessed Internet randos...

Once upon a time, the brightest minds launched startups. They had radical ideas and wanted to explore their potential. It takes guts striking out on your own with nothing to validate yourself but the confidence in your very own idea.

Maybe it's navigating healthcare in America, maybe it's that housing prices have skyrocketed with respect to inflation and wage growth. Whatever the reason is - people are afraid to strike out on their own and want some universally accepted indicator of success; getting into a FAANG seems to scratch that itch.

Personally, I want to end up at a startup - the sorta place where I can get hundreds of stock options, knowing if the company makes it, so do I. But this mentality isn't widely shared on this sub."
"1076","Im still in the job search but man was I close to an opportunity like this, in the end the startup decided to go with the other guy. Amazing product, great vision and the CEO already had a prior successful exit."
"1077","While I agree with your sentiments, do you actually think 30 years ago people were more entrepreneurial? People still wanted to work at the big companies at the time, from IBM to GE to banking to consulting or whatever. Startups were more unknown in 1990s than now. The only difference is that the general public now knows more about lucrative tech jobs so people who previously went to banking for the money are now attracted to FAANG."
"1078","You're kidding, right?  The history of the 1990s, 1980s and 1970s is _littered_ with startups."
"1079","I didn't say there were no startups, I said they were more unknown in 1990 than now."
"1080","&gt; Personally, I want to end up at a startup - the sorta place where I can get hundreds of stock options, knowing if the company makes it, so do I.

The problem here is that compensation at the major tech companies has grown so much that it is *unbelievably* difficult to match it even if your startup makes it. Exiting at 100M with 0.5% ownership is 500k. You'd make up that difference in a few years working at a major company. 

If you want ""if we make it I will end up with more money"" to work you need to be a founder."
"1081","&gt;I never opened Leetcode in my browser, never went to a meetup and I only code at work

Been doing this for about 8 years. I've also never done leet code, went to a meetup or code outside work.

It's called having a life. I'm married, have a newborn, house to take care of, gym five times a week and play sports three times a week. On top of all that, see friends a couple times a month and bust out the PS4..

Don't be scared of what you see here. It's mostly fresh grads that aspire to work at these massively popular companies and want $400k a year. If only they all realized at a young age, to make enough money to pay the bills and save a bit, and then make a life for themselves outside of work."
"1082","[tfw: All the certified ballers in this field are busy spending money/time with family rather than social media.](https://imgur.com/8BMa6ll)"
"1083","that is the most high quality version of this image i've seen used LUL"
"1084","[this one's even higher](https://youtu.be/dQw4w9WgXcQ)"
"1085","FUCK"
"1086","can't even remember the last time this happened, ty :')"
"1087","GODDAMMIT"
"1088","Obfuscate that!"
"1089","Oh, you cheeky bastard!"
"1090","Apollo user so I saw the thumbnail. Yall should really switch lol."
"1091","If the URL ends in XcQ, you know you're about to get got."
"1092","you son of a rick roll!"
"1093","I called it."
"1094","This is genuinely a good song."
"1095","Lmao you almost got me, but the Youtube ad gave me enough time to see the title and close it."
"1096","Tf is a certified baller"
"1097","This sub is mostly trash, with a few gems here and there. I love talking to other experienced people in the industry, but they are few and far in between. Most of this sub is 20-22 year olds just concerned with Big N."
"1098","Try /r/experienceddevs. The discussion over there seems a lot more normal and not just a bigN circlejerk. Actually some good content and conversations."
"1099","thank you for introducing that sub"
"1100","Thanks for the recommendation, Ill check it out!"
"1101","Oh wow, this is great, thank you!"
"1102","Just FYI, I ran some stats on experienceddevs, and while it appears at one point the forum was not too saturated with youngins, it's increasingly becoming dominated by CSCQ posters.

See [this post](https://www.reddit.com/r/cscareerquestions/comments/eu3wt8/how_many_senior_developers_are_there_that_give/fflj6qo?utm_source=share&amp;utm_medium=web2x) and my related response to my post, which indicates that about 40% of commentators in EXPDEV are also CSCQ commentators.  Across all viewable reddit time (posts up to 1000) the stats are better, but more recent ones are seeing an influx of CSCQ posters."
"1103","While interesting, I'll argue that the reason for your stats are that most people learn about that sub from a reference in this sub."
"1104","That's the most likely cause, but the cause doesn't mitigate the effect.  40% of comments are from CSCQ commentators.  There's a case to be made that, in fact, this is a \*bad\* thing.    


What is the best case scenario here for people seeking advice?  The best case is that 40% of people in EXPDEV who have solid advice are also commenting in this sub forum.  The worst case is that 40% of people in EXPDEV are \*exactly\* the kind of people you don't want commenting in EXPDEV (inexperienced people).  


If people are going to EXPDEV because people are diverting CSCQ user attention to that forum, then that means EXPDEV is picking up lots of inexperienced people who are now giving advice there.  


The ideal scenario, if you're hoping to find quality advice here and in EXPDEV, would be people are directing EXPDEV users here, but instead the opposite is happening.  


There is a scenario I haven't cleaned the data up on, which would really clarify the issue if someone wants to do it, which is to not include users if they \*only\* made comments within their own posts to EXPDEV.  This way you could really understand whose giving advice."
"1105","Does that subreddit verify peoples actual experience or roles. If not it's as useless as this sub in confirming if the advice is from an experienced source."
"1106","Nope."
"1107","nobody wnats to post somewhere where you have to give your birth certificate and social security number"
"1108","It's usually just paystubs or work email nothing that indepth. People do that in other subs like the science subreddit, so it's not an insane requirement for credibility. It's also already done on Blind where literally thousands voluntarily do it so why not have it done here."
"1109","One possible way to measure that is to chart the subscriber growth of this sub and that sub and see if theyre proportional."
"1110","Like the other poster said, I dont think that means much since most people are directed there from here.   Its a much harder analysis to make but it probably makes more sense to evaluate how posters evaluate their experience on the sub over time and if it goes up or down."
