"","matrix.0..nrow...numComments..ncol...1."
"242","I actually am finishing up soon both a BME AND Biostats MS and I still dont feel qualified enough.

My statistical analysis skills are strong but my programming/CS skills are pretty week despite having been in engineering too (BE undergrad didnt teach us that well and neither did grad in both fields)I am able to do classical and semi classical statistics like GLMs/Mixed models (probably what I am best at), ridge/lasso, PCA, discriminant analysis. I am most comfortable with R and only know very little Python. I have no experience with genomics and high dim data analysis. 

Also know absolute 0 about know classes/structs, databases, APIs, RShiny, or production. No knowledge about making code faster or algorithms. 

But I sure as hell can come up with p values (that rhe data sci real world doesnt care about). My next assignment is using 300+ variables as predictors to try to predict Alzheimers diagnoses on around 700 patients. Still p&lt;n. Probably will be making use of glmnet() or PCA. 

My program also doesnt teach modern things like NNs/deep learning etc. Its a heavily classical oriented thing. How can a classically trained biostatistician get into data sci if CS skills are weak?"
"243","Hmm. What kind of data science roles are you interested in?"
"244","Stuff like Biomedical Data Scientist.

I dont mind statistician jobs too but I am trying to broaden my search"
"245","My guess is that you have a lot of valuable skills.

If you're interested in becoming a Biomedical Data Scientist, the key thing I'd suggest is getting experience working on a project with a researcher in biomedicine -- have you considered that?"
"246","Yes I have done research in BME. Even recently published a paper. However, it has been entirely classical statistics with some semi classical stuff here and there. 

I help labmates analyze their wet lab datasets, which are generally small datasets. That is where I got experience with the typical classical models like GLMs, GLMMs as well as tools such as Bootstrap. Some ggplot2 plotting as well and Monte Carlo simulations. 

Then in Biostats I am working with someone on looking at MRI data *however* all the preprocessing and so on is done and I dont even see the image. We dont deal with the actual image and we just deal with measures derived from it. Its entirely mostly classical longitudinal analysis. 

That stuff isnt exactly sexy in todays data science climate. Many data scientists dont even know this stuff at all but it doesnt matter. 

My next part though I requested that PI to give me something more modern, but it is essentially going to still be semi-classical prediction using basic ML with a large number of predictors (already derived from the image) to predict AD risk. 

For data science I often see things like web scraping, knowing APIs, cloud computing, interfacing models with medical devices (production), big data, databases and so on. I know none of that, only the statistical aspects and in R. 

Its unfortunate but I dont think recruiters appreciate classically trained statisticians. We arent exactly known for being good programmers. 

I still struggle a lot with basic Python. It doesnt make sense to me as I am not good with OOP but R I am fine"
"247","In data science no-one is going to know everything, so I wouldn't worry about not knowing about web scraping, APIs, etc. too much. Data science roles are diverse, and in any role you'll need to learn new skills, and many of your existing skills will be very useful for you.

There's a difference as well between more ""science""-oriented roles vs. more ""engineering""-oriented roles in data science. Your skills are more aligned towards the first category than the second, but you could invest some time into learning software engineering practices.

If you want to go into biomedical data science, the key thing will be finding positions -- e.g. in biomedical companies or (possibly) academic contexts. The earlier you can seek out those positions and speak to people at those companies / institutions to get their advice, and to get a sense of what positions are available, the better."
"248","Yea its funny, I actuallt have the BME engineering degree but I was always better at the science (as in chem/physics etc) and data analysis stats type things. I was never good with building things or in this case production level code stuff.

I think I really need industry experience. Never had an internship unfortunately and first job is notoriously difficult to get. I have had phone interviews but nothing more yet. Some positions also seem like phantom positions and dont actuallt exist but the recruiters are seeing what is out there...The job world equivalent of Tinder girls seeking validation etc"
"249","I feel like 1 and 2 aren't mutually exclusive. I am currently a masters in business analytics student and landed a full time data science type role. My background when I interviewed and accepted the offer was 1 year of experience in my masters, and some simple excel stuff in my previous role. What I did during my studies helped prepare me for the job though. For example, one of the projects I worked on for a machine learning course happened to use a very messy dataset from kaggle, involving something I was interested in from a personal perspective. Judging by your segmentation, I would fall into the ill-prepared category, however every performance review I've had since starting at my new role has been stellar. I also have not had an internship and have not worked as a research assistant during my degree.

So, my advice to you would be to loosen the reigns a bit and don't enter into interviews with these candidates with such a shrewd eye. You may be surprised."
"250","Interesting. Can you talk more about the dataset you were interested in from a personal perspective? (No need to go into details if you are not comfortable doing that here)

Also -- did you have previous work experience?"
"251","Sure, np. The dataset is from open powerlifting. It contains meet results for various powerlifting competitions dating back to 1970. Some of the competitions were for bench, squat and deadlift, while others were only bench, or squat and deadlift.  There was data for men and women, and age groups for kids through seniors. Country, lifting federation, drug testing results. Essentially all of the stats you would expect for a powerlifting competition. There is significant missing data, and in general it's what would be considered a narrow dataset and required a lot of feature engineering before any kind of analysis could be performed. There was ample opportunity to flex my skills in EDA and build some visualizations, looking at some of the time series elements as well how the data is clustered and distributed. Overall, it was really fun and my main takeaway was that the one thing I enjoy more than anything in the world of data is building compelling visualizations.

I had about 10 years of work experience prior to starting the program, but ina field completely unrelated to data and analytics."
"252","Fascinating. Glad it's going well!"
"253","Id also add any engineering background is a massive tick. If you know how to do something useful with data and can sensibly engineer something so it is actually usable, Id hire you in a heart beat.

Typically these people have experience using a language on the JVM (or a lower level language)"
"254","Software engineering skills are definitely valuable, if combined with experience working with data."
"255","A little off-topic here, but having hired for DS roles, and considering  your points above, I'm curious to know what you'd make of my situation.  I've been applying for (non-senior) DS jobs for 3-4 months now.  I have have detailed on my resume experience with both of your points (the things that I think make me good, and the things that actually do make me good), and yet, after 140+ applications, I've only had one interview (no other contact from potential employers).  I have an MS in econometrics and worked quite a bit with real-world data.  Additionally, I completed a highly competitive and intense post-graduate data science fellowship (top 5% of applicants accepted, required 65 hr. work weeks for the 3 months of the fellowship).  Any advice on better marketing myself (given the limited information you have, of course)?"
"256","It's tricky to give advice without knowing, e.g., where you live; where you are applying for roles; whether you are applying for advertised roles or not; what your cover letters / emails are like; and what your CV is like (in presentation as well as content).

It sounds like you have a strong background. Marketing yourself does matter. While I don't really like Ramit Sethi's tone, his ""How to Write a Winning Resume"" [https://www.youtube.com/watch?v=_0fjkKCsM1w] is very helpful for thinking about this.

The key thing is to work out your own narrative to explain: ""I studied xyz, I found it fascinating, I decided to do a PhD in AbC. I found working with data was really interesting but I wanted to pursue this in industry rather than academia because it had more hands-on immediate results"" or whatever is true in your case. Also check out https://80000hours.org/career-reviews/data-science/ which might be helpful, and https://mode.com/blog/data-scientists-making-the-leap-academia-to-industry.

Also, if you have submitted 140+ applications, and only had one interview, you need to re-assess how you are approaching the application process. It sounds like you have a strong skillset. Finding data science roles calls for a combination of (1) time invested, (2) the right technique/approach, and (3) showing you have the necessary experience and skills.

I was able to get a lot of meetings with people from different data companies by sending emails like this:

----
Hi &lt;First name&gt;,

My name is ... 
I'm ... (a sentence about my experience).

Are you looking to hire a data scientist in the next couple of months?
If so, can we meet up and talk about it?

Thanks,

...

My background:

* point 1 ...

* point 2 ... 

* point 3...

----

I didn't attach my CV unless I was asked for it. I emailed dozens of companies and got many interviews."
"257","Are these emails sent to people in DS roles at the company or HR people? And, how would one go about finding emails of specific people? Ive tried using LinkedIn InMail to recruiters at companies of interest, but not much luck. Email is definitely more direct but Im not sure how one would get that info."
"258","Id like to hear /u/tl_throws view on this question too. Im guessing we may have more luck going to hiring managers rather than HR people."
"259","It depends on the size of the company.

My approach here is likely to work better for smaller companies (&lt; 150 employees).

I'd suggest directly emailing the lead data scientist / head of the data team / head of the product team, or even the CTO / CEO of smaller tech companies -- usually you can find emails for these people on the company websites."
"260","If you are not getting interviews after that many applications and you're applying to posted jobs, you are probably getting frequently screened by HR automated systems. DS is very trendy and gets lots of people will apply for every opening, so places are either using automated screening, or their manual screening is so fast as to be as dumb as an automated system.

You need to make sure your resume contains all the keywords someone might screen for, and you need to make sure it's text searchable."
"261","Thats helpful. Been doing my best to match terminology in my resume (so far as to, at times, copy &amp; paste the exact phrases from the job posting). Guess Ill have to become even more particular in how I write my resume?"
"262","Love this post, because I forgot about point 2 as advice for people. Went to an analyst meetup  a couple years ago and announced I was learning python for data science. A retail research company immediately hit me up for a small project.

I got to learn the important things about working on real data projects:

* MESSY survey data from multiple PDFs
* Splotchy responsiveness and communication with stakeholders
* Learning their language, culture, &amp; 'truths' to figure out how to present results
* How to pronounce Paducah, Kentucky

Bottom line is get your hands on some real data if possible. Best case scenario is you can do this within your company and prove out some results. Other cases are that you either have to network locally or reach out to people to get on some projects."
"263","Amazing!"
"264","really well said. as a data scientist who has managed teams of ds's and interviewed/trained new hires, this is 100% what i look for as well"
"265","I briefly studied data science at the graduate level. Most people didn't like coding. Even those who said they liked coding weren't coding. Personally I like coding and that's why I was the first to get poached and got hired in one of the world's largest banks after 3 courses.

I have ***one*** advice: fire up that IDE and code"
"266","Coding is so important!"
"267","Thanks - good to hear an Australian perspective.

Im doing a combo, studying through edX for UCSanDiego and working through accessing and analysing open data available through state government open data portals 

I get little bits and pieces in the BI team at work, but I have to stay on top of my day job in QA."
"268","That's interesting. How do you find the experience of doing both? Do they complement each other well? It sounds like you're doing both at once."
"269","Im using what Im learning in the course to work on the data, jumping around a bit since we havent covered APIs yet. They do complement each other, and the variety means I dont get bored.

Im also doing it to build a portfolio, and hitting datasets for government departments Id like to work for.  The aim is to make up for a lack of workplace experience, with some decent demos of my ability. Plus to demonstrate interest."
"270","That sounds good - although I imagine it can be a bit exhausting!

Many public APIs are quite well-documented so you could probably dive into them right away."
"271","Having just spent the last 3 years transitioning from Session Musician into Data Scientist and taking a decent number of interviews, in the end this advice is close enough to the reality that got me over the line.

The thing that I think may be overlooked is how trivial the real world examples even need to be to do their part, when supported by a couple of more recent achievements (in my case for this I took HDip in Data Science when I decided to make the switch, as well as creating a domain specific open source project:
https://github.com/OscarSouth/theHarmonicAlgorithm).

Real world examples included:

1. Managing a paper database for a hospital as a summer job at 18y. This example also made for some good moments of humour!

2. Querying an Oracle database with ready made SQL queries as part of a temp role as an assistant at a QC lab.

3. Conversations and poking around with toy datasets from friends/family who are professionals in other fields that would like to know what more they can do with their companies data.

Most importantly though (I feel) was how I used these examples in the language of the interviews domain area in response to questions and scenarios thrown at me by the interviewers. Hand in hand with being able to deliver this performance was finding a good fit with people/business  it took a dozen or so interviews to find the right match.

I start on Monday! Im looking forward to it!"
"272","&gt; The thing that I think may be overlooked is how trivial the real world examples even need to be to do their part

Absolutely."
"273","OPs point: what makes you good at a job is real experience at the job.

No shit. This is a terrible take though. If you dont have a job in DS or any actual classroom experience then youre saying all that other shit is irrelevant.

I have a Masters degree, Kaggle work, and taken online courses and I have a Data Engineer job offer on the table right now. You know what makes good experience? Experience."
"274","I broke into data science mostly through hobby projects, and by following this career path:

Chemistry PhD &gt; Bioinformatician &gt; Data Engineer &gt; Data Scientist 

It took 2.5 years after my PhD, but I've finally made it."
"275","Good job! 

It's hard out there, especially for chemists."
"276","So,

to uneducated swines trying to get a job: you have to have this job to get a job!!!

to superior intellectuals who already have a job in the same field in the same exact industry and want to break into industry(??): you're doing fine!

sincerely,

every company and hr in this world

(btw, if you worked with data at your job they'll tell ""but well your data was different type of data, and their data at their specific industry is different so gtfo"").

Thanks for useless advice!"
"277","Has this happened to you?"
"278","yes it did.

I don't understand how this advice makes sense, honestly. I mean yes, it sounds logical, you have more chances to get a job if you have experience. Hiring though isn't even close to anything logical neither it's some kind of exact sceince. All this advice alike ""find problems, then find solutions, then work for free for someone"" just fucks up whole industry and sets further this already absolutely retarded process.

But what does that imply, is that you have to waste more time and energy when you already have qualifications(that's literally what you get diploma for), knowledge and skills, just to get a **chance** at being considered. Then it won't matter 95% of time anyway, because of random BS  most won't even look at your github, will skim through your resume for 3 seconds and throw it in the trash.

Then we get further and further down ""oh no diploma won't cut it, then no, personal projects won't cut it, then no, actually getting paid for work won't cut it'. Fuck this bullshit. You know what ""finding problems and developing solutions"" means? It's called making own business.

Best chance at getting hired is pesonally knowing people in the industry who can get you hired, to skip you through the bullshit of ""you're from wrong industry/have wrong type of diploma/live too far away/don't work with this exact stack we have at company/ don't have experience with real life business problems/ wear wrong pants/ have wrong age"".

If doing all that actually made any difference that would be great, but in actuality it increases your chance by like 1/10 while setting you up for miserable grind and burn out. For every one problem your business is trying to solve there's 100 different businesses who will scoff at your projects because they have different kind of problems, and yours are 'not real world enough' for them. 

Personal projects are cool, trying to sew your whole life around someone's stupid business to maybe get a chance to get hired is stupid, and that's what we're moving too with those posts."
"279","It sounds like you've had a really hard time trying to break in to this industry. If it's any consolation, data science isn't the only industry where this is happening. I have friends who graduated with degrees from BAs to Ph.Ds, in fields from humanities to biochemistry, and they all hit the same ""gotta have experience to get experience"" wall.

Have you thought about being a consultant? A number of consultancies hire based on cultural fit and potential, and provide direct mentoring."
"280","I thankfully didn't get all my energy to get into that field, partly because I noticed that in data science advice like this thread is the norm and competition is insane. I just switched to searching different kind of jobs in IT.

I'm mostly speaking from my experience trying to switch fields before and from all people I know. I don't know a single successful person who went balls deep into some field before actually getting paid for it. And all most successful people I know have general skills and rely on just being liked as a person and can learn stuff quickly when someone's ready to pay for it, and don't sell themselves short.

Last interview I went for I actually didn't apply for myself, I was contacted by their HR and it was business analytics position(my resume just says python programmer). They needed python, finance &amp; statistics knowledge, economic background, UX skills and bunch of other random shit I somehow know. So I, having economics degree and work experience, several UX projects on behance, programing projects on github, some experience with working with data in python on my current job, went there.

And most of the interview guy was rambling about how their sector HoReCa is very different to everything else, and especially having no background in sales company(mine is healthcare) I'm probably not a good fit to work there. They had shitton of very diverse qualification requirements and yet even fitting 90% of them they still thought I'm not good fit because I'm not working in some ultra specialized industry lol. And it's the interview I was invited too by them.

It's just waste of energy and time, shotgun approach and networking all yield much better results in finding any kind of job."
"281","While I don't really like Ramit Sethi's tone, his ""How to Write a Winning Resume"" [https://www.youtube.com/watch?v=_0fjkKCsM1w] is very helpful for thinking about how you brand yourself. The key thing is to work out your own narrative to explain: ""I studied xyz, I found it fascinating, I decided to do a PhD in AbC. I found working with data was really interesting but I wanted to pursue this in industry rather than academia because it had more hands-on immediate results"" or whatever is true in your case. Also check out https://80000hours.org/career-reviews/data-science/ which might be helpful, and https://mode.com/blog/data-scientists-making-the-leap-academia-to-industry.

&gt; when you already have qualifications(that's literally what you get diploma for)

""Real-world"" experience is easier and less expensive and more likely to help someone get a role in data science compared to a qualification e.g. an online course or master's degree in data science."
