"","matrix.0..nrow...numComments..ncol...1."
"895","Many things. I was unemployed for 4 months, but 3 months ago I landed a role as a junior full-stack developer. I think the problem is more that technology changes so fast that it can be difficult to develop curricula that meets the needs of the software industry.

As a front-end/fullstack developer, the main things I missed were the following - **JavaScript** (it's everywhere in software, I graduated without writing any vanilla, plain JavaScript), **distributed systems** and **database architecture**, and cloud computing (**AWS** and **Google Cloud/Firestore**). I use these technologies on a daily basis. Thank God I knew React and iOS/Android by the time I graduated because I now have a better sense of frontend principles. I then learned more front-endy things on the job like Sass and wireframing.

Here's a project oriented indicator of your skillset - you should be able to build a performant system that solves a real world business problem. Make something you're interested in. 

For example, make a gradebook application for teachers. Write the frontend in JavaScript, and the API in Firestore or AWS. Create a login system that takes a username and password and logs a user into a restricted area only logged in users can see. Then create a frontend application that allows people to type in grades. Log changes to the gradebook in a message queue which then batch writes to the database. Then, have the database write to another frontend application targeted for administrators, parents and students that displays individual student calculated grades. There's a ton of data movement in this for a relatively straightforward system of managing student grades."
"896","What do you use firestore for?"
"897","When I was writing a game in React Native, I had to make simple API calls to a database in Firestore. If a person got a high score I would record it along with their username. This required me to know how to set up the tables and do data validation."
"898","GIT"
"899","Technical:

Design patterns

Unit tests/ how to test correctly

Navigating large code bases/ reading someone elses  (poorly written) code

GIT

Linux 

Docker

Work:

How to get promoted fast

Asking the right questions to leads"
"900","People skills get you further than programing skills.  When you enter the workforce, youll realize 4/5 programmers are glorified script kiddies that knew somebody and have no concept of best practices and documentation.

My advice is to make friends in your field and make it a lifestyle. 

Source: 22 year professional programmer"
"901","Learn how to read code and figure out what it does, and then modify it. Chances are you're not going to be working on something from the ground up as a junior right away. If you can't read code, figure out how it works, and start playing around with it, you'll be behind."
"902","The most helpful thing for me in having practical experience in actual software development is simply to get more experience in actual software development. It sounds obvious, but it's true. Do an internship before you graduate. Work on personal projects. You can try and learn specific technologies, but odds are that when you get your job you'll have to learn something completely different. (The extent of that being true depends on your own experiences. I'm currently working at a company that's infamous for having an almost entirely proprietary tech stack, but YMMV.) The skills that are useful anywhere include working on a team and getting big, complicated projects done. Everything else is more or less details that you will often be learning as you go."
"903","&gt; it all seems very theoretical and I'm dubious that any of this is practical in the real world. 

You should investigate your schools CS education reputation before entering it.  My schools CS program is extremely practical and minimally theoretical, and I knew that going in because it was what I was looking for.  My CS program had me make mobile apps, web apps, data structures fundamentals, etc.  A program which has you write and endlessly analyze the efficiency of sorting algorithms is not practical or enjoyable."
"904","I know you are specifically asking about hard skills, but what I really think is ignored in education is soft skills. I'd argue there are more necessary soft skills than hard ones and having an encyclopedic knowledge of hard skills is not important to anyone.

Soft skills are absolutely the most important part of the interview process. If you want to find a job, that is where you would start."
"905","How would you develop soft skills"
"906","Study them, then practice them. It helps to first know what they are. If you can actually list the skills upon which you need to improve, you can create action items and identify opportunities to improve your behavior. Where you previously would shrug someone off, you can now mentor them. Where you previously would see something as not your problem, you can now take ownership. Where you previously would keep your head down and be input-in-code-out, you can now communicate better with management and your team. After doing them a few times, not only will you see the opportunities to do them more in the future and the benefits they had on your team and project, but you'll have answers to your inevitable behavioral interview questions."
"907","git, linux environment and the phases of the SDLC was something I was not prepared for"
"908","In the vast majority of positions, you won't use most of the theory you acquire unless you're in a heavy math related field. You mostly just need that knowledge to pass the interviews."
"909","I work at a small company and many of my coworkers do not have a traditional CS background.

Every now and then a problem will come up that they get me to come over and look at. It has been things like pass by reference/by value, not correctly instantiating an object before putting values into it, or problems with static objects. Sometimes data structures come up.

Those are all really basic things, but if you do not have a traditional CS background then you will have no idea how they work."
"910","I don't think you need a cs background for basics like that...."
"911","Youre right, but there are a lot of things people do not pick up on if they are self taught."
"912","Zero knowledge about microservices and how they must interact.
Zero knowledge in RDBS, now I can create weird procedures with multiple input parameters."
"913","I've had two junior dev jobs, one where I was part of a larger team. Getting to grips with a massive codebase was definitely the hard part there.

My current graduate job (though I haven't graduated yet) I'm the sole developer, my manager and other it person both did Computer Science degrees at my university and the realisation from that job is all those fancy things you want to out in place, yeah they'll be ignored and you'll have to do stuff that's wrong, but works because budgets."
"914","While you won't use everything, I actually felt pretty prepared for my first job. Besides just picking up some new languages/technologies and the company-specific knowledge, which you have to do pretty much anywhere, the biggest gap for me was writing production quality code.

College code is overwhelmingly very hacky. You're working on projects, usually largely from scratch, at most in a small group, and usually over a relatively short period (eg a couple months) and then throwing it all away. Colleges rarely test for (or are able to test for) things like maintainability and scalability. There was definitely an adjustment going from ""let me write some hacky shit that works"" and ""I have to write a maintainable, scalable solution"".

As for things from college that were super useful in the workplace, I felt that databases and distributed systems and/or parallel computing were super, super useful. Topics like writing efficient queries, determining database query patterns and choosing appropriate indices, choosing appropriate database technologies, handling concurrent reads/writes, parallel data structures, data consistency, and parallelisation come up *all the time*."
"915","I got a BS in MIS back in the DotCom era and started a software company where I specialized in custom business software.  What I found was that most of what I learned about programming didn't help nearly as much as I needed.

What really helped was doing real world projects.  After I did a few large projects, I realized the true value of the degree.

The same thing happens when you learn business from a book vs the real world.

In the real world, most everyone tries to screw you over, most everyone doesn't give a damn about your life and most everyone thinks they know everything about whatever they are talking about.  Most people will put in just enough effort to get a reward and nothing more.

This is usually reflected by how they treat their health, they put just enough work into their health to stay alive and nothing more.

If you really, really want real world skills, build a real world product that DOESN'T come from a tutorial.  Many ""programmers"" will search for a ready made solutions that they can download and compile and claim they built it.  It's a gray area because we all learn from some book or tutorial somewhere, but it's the difference of having to solve complex problems when the answer isn't in the back of the book."
"916","Things I've noted as _helpful to know_ while in the first year of my job and internship:

* Linux terminal usage + bash
* Using docker and building efficient images
* Some familiarity with AWS and/or GCP services and technologies
* Considerations for API design
* Database systems and SQL"
"917","Ive been working for a company for 8 months now. I dont actually work for the IT department  it a department that has 2 Dev positions for managing the teams macros. 

In college we had required compiler, data structures and algorithms, computer architecture, and operating systems. I was going for computer science so I dont know how that lines up with your college path. The majority of the classes I listed dont have direct application to my day to day.

That being said understanding the things I learned in those courses help in the way I think about enhancing what I do in my day to day. Compiler has helped me in knowing I could set up a script that can auto write code that would follow a laid out template instead of having to write the code my self each time. DS and algorithms helps me in my thinking of how to setup my class structures and helped challenge my critical thinking.

The point being, tho the classes may seem more theoretical than practical, its helping your critical thinking and helps you to know what you are able to do and lead you to find more things. Knowledge is always power.

To answer your question, I would have appreciated a web dev and front end/GUI courses. All the projects we did were in terminal so the GUI was of no real concern. Im having to teach myself web dev concepts for a project Im pitching at work."
"918","Git"
"919","Networking stuff mostly. I didn't know php, so there was a lot of learning there. Knowing how to use jira/git effectively and managing merge conflicts, debugging api's."
"920","The hardest part of the transition was getting used to figuring out how to focus tasks when you have such a large code base. When you don't know the entirety of an 300,000+ line application,  you need to have the skills to pin down where the code lies that you need to fix. This approach seems to be the biggest divide between junior and senior developers from what I've seen, personally."
"921","CICD, lambdas."
"922","I would say, if I had to maybe boil it down to two things that I do daily, git and testing code. Those two things are things I do/use on a daily basis that the CS degree does not focus on at all because that's not the purpose of a CS degree."
"923","At no point in my degree did we ever learn how to code for simplicity and readability. We also never learned version/source control. These are more or less the bread and butter (of technical skills) for basically any professional dev role. Glad I did internships."
"924","I am a senior computer engineer. Working part-time in a holding company, developing mobile applications. In the beginning it was too easy. I was just doing front-end and stuff but then they wanted to  show me backend and it was huge the MVC structure was huge, the database was so huge its still very difficult to adapt."
"925","Do leetcode if you are a college student. Some of the the theory may come handy when you join the workforce."
"926","Everyone knows the technical stuff or can easily learn that. I think what junior (and many senior) devs lack are the soft skills. If your university offers courses on project management, team work, communication skills, conflict resolution, etc, I recommend taking all of those."
"927","I did not major in computer science, but I took 3 programming classes and a few non-programming CS classes. The things that I wish I learned (or had time to take the class for) was the internet. I learned on Java and my first job was Java web development and that was the most confusing stuff ever because I only knew the internet as a user, I did not understand it as a programmer at all. I only created simple Java applications like Chess or practicing algorithms, so it was a huge shock. I did not fully understand promises or callbacks until a while into my second job. 

The other thing that I never got was the practical knowledge that every engineering job needs. Why in the world were we not taught git or some kind of version control? Why were we not given pair programming assignments? Why not give us an assignment in an existing repo that has a lot of code we should read and understand before starting? My first job has extensive training so I was ok with actual programming, but I knew nothing about how to work with people or write code as part of a team or anything. I felt like such an idiot at my first job.

Oh I will also add testing and writing tests. I did not really understand it until my second job."
"928","&gt;As I dive deeper into CS coursework, it all seems very theoretical and I'm dubious that any of this is practical in the real world. 

Except in a few cases, it's not. However you will be asked about this stuff a _lot_ in interviews (especially for junior positions), because a lot of companies haven't yet moved their hiring process beyond Computer Science Trivia Bingo.

Unless you end up doing library development at Google or similar, chances are you will not ever be asked to write code to balance a binary search tree - except on a whiteboard, in an interview."
"929","\&gt;   it all seems very theoretical and I'm dubious that any of this is practical in the real world.   


Actually, If you want to succeed in Computer Science, you need to learn the theory.  


TL;DR of it is that theoretical knowledge becomes useful when you are asked to develop whole modules and subsystems, and paves the way for your technical growth.. possibly till Architect. By that point your experience will weigh more in your decisions and designs.  


When you start your career, you will have a lot of questions amounting to ""why are they doing it this way? why can't they accept this simpler solution?"", or maybe ""I wish I knew an elegant way to implement this solution which doesn't require tons of ""if"" checks to cover the many edge cases"". Theory allows you to identify what tools and techniques apply to a problem:  


1. Theory helps you understand the problem: Is there a preexisting solution that's optimal? Is there an okay solution that takes a lot of CPU time? Are there only few good approximations that might yield bad results from time to time and with certain inputs? Or even more fundamentally, is it a problem that needs to be tackled  at all? (Does this problem a special case of a more general problem.. only worded differently? Does this problem even possible to solve?)
2. Based on what problem you are facing, Theoretical foundations help you decide what to do. You can save a lot of time that would have otherwise been wasted trying solutions that don't work... Or worse! that work most of the time but fail when deployed to production environment due to certain inputs.
3. Theoretical knowledge helps you communicate problems and technical details in a more clear, concise fashion, since you understand the big picture."
"930","Being able to read other people's code, ask good questions, and not be a complete noob at github"
"931","I didn't realize how important my CS education was until like 2 years into industry.  It became very clear that that knowledge is required to be able to effectively make use of the endless abstraction layers we use to implement features these days"
"932","Understanding and learning how to create your own architecture heads Ben one of the hardest things for me. School does not prepare you for architecture (I would often only write code in main.cpp)"
"933","Learn how to minimize impact, in uni you'll have been working with code that you wrote over a maximum of a few months, in industry it's common to work with code which has been written by many first party and third party Devs, some of whom no longer work at the company over a number of decades. A lot of this code won't have any documentation or comments so you need to learn how to work with it without breaking anything."
"934","It's kind of like the difference between studying civil engineering and then actually working on building or maintaining a building (or set of buildings -- aka systems).

In CS coursework there's lots of different concepts, most of them abstract, and they kind of come and go; you read a chapter, do some problems/implement a project, get tested on it, then move on to the next one.

&amp;#x200B;

When working in the real world though, there's a set of patterns that emerge for most software projects.  How's logging done?  How is test data generated?  How do the unit and integration tests work?  What are the networking components?  What are the persistence components?  What are the messaging components?  How are builds done and artifacts captured?  What are the specs/use cases?  For the most part, you can break down any project into different discrete questions, and as long as the software/system is well built, you can dive into any specific area and get started pretty easily.

&amp;#x200B;

I'd say the most important technical skill in the workplace is to be able to figure out how something works (ie without any documentation, or with just straight up incorrect documentation); a big difference between a ""10xer"" and a mediocre engineer is that when the latter will throw his/her hands up when something doesn't make sense, the former will keep asking and answering questions until he/she figures out the root cause -- usually by going below the application and figuring out how to log/debug an application's dependencies (said at 11:20pm on a Tuesday:  ""Oh! The http library tries to send a TLS1.3 request even though it only supports up to TLSv1.2.  It silently fails during the handshake.  How dumb; I should let the maintainers know"").  If you can do this, you'll be valuable anywhere.

&amp;#x200B;

I'm curious about what material you are dubious about.  It's true, most of the material you'll learn in college won't be useful all the time on the job, but if (more like when) something comes up and you bs'ed your curriculum, at best you'll look inexperienced and at worst you'll look underqualified (he/she has a college degree and doesn't know what a digital signature is?).  If you do it right, you'll already be experienced by the time you graduate.  Then, when a senior engineer says something like:

""yeah, we use a custom transport protocol for internal service calls to XYZ; yeah it's kinda dumb but it saves network bandwidth bc the link is spotty on the intranet.  Anyway, it's UDP with a custom retry handler, the code is in the 'com.arvent.internal.app.net.client.retry'.  Why don't you take a look and let me know if you have questions""

you'll be like ""okay, it's kinda weird but makes sense.  Maybe we should refactor that in the future"" instead of ""what??  What is UDP?? Que es transport layer?? Dang, I didn't study anything in college because I didn't think it would be useful!?!?  Maybe it actually \*is\* better that the university gatekeeps  curriculum instead of me, since the university knows almost everything about the relevant areas of research in Computer Science and I -- some random schmuck that was born 20-something years ago -- know nothing!  Now I have to spend the next week and weekend reading up on computer networking and writing some ditzy, hacky solution that will get torn apart during code review instead of making love to my gf and playing fortnite.  NOOOOOOO""

&amp;#x200B;

I was being kind of a dick but yeah, if you study hard it'll pay off bc the best/senior engineers all know the stuff you're studying, and have applied it so that the software/apps they write are better than naive implementations of solutions in their respective technical domain.  That's if you're working for a company with proficient engineers.  If not, you'll have to BE the best/senior engineer and implement it all yourself, as well as create a POC, schedule a meeting (on lync or some equivalently shitty corp app) with the team leads, manager, and some business people, and show how much the new implementation kicks ass when compared to the current shitty naive implementation.  It's more work, but if/when you do this, everyone will look at you like you're god.  Pretty cool, esp if you're young.  Anyway, those are my souped-up-on-coffee-saturday-morning thoughts/ramble.

&amp;#x200B;

Cheers and good luck"
"935","For me it was process and paperwork, everything aside from coding that goes into a project with hundreds of devs on it."
"936","I remember back when I was a senior and I did an internship, I started stressing over just how important being able to learn specific technologies was. I didn't understand how to approach learning a framework, or a new devops tech or... well, really anything at a high level of abstraction because I had gotten so used to staring at everything as low-down as possible.   


That and best practices. But, those come with experience..  


My advice would be to make an ACTUAL product using a modern stack in your chosen technologies. It doesn't have to be big or complicated, just something you can show and say ""I learn this myself"". It shows that you're capable of picking things up and also gives you a head start on technology.  


As CS people, we come out of school with a really great foundational understanding, but very little applied knowledge.  So, showing you're ready to pick up tech used in the real world is pretty important.   


So if you're a Java guy for instance, maybe make a simple project using Spring Boot for an API, with a detached UI written in a Javascript framework. Honestly, if you can figure just that part out, that's huge. Separating a backend from a frontend is the common practice for new web-based software. That immediately puts you in the lead of junior devs.   


If you're lower down, do an embedded project with some arduinos or something to automate a real-world process (even if it's pretty contrived).   


If you're a data guy, make an NLP or CV model or something. Or do an ETL project with Spark or something like that.  


There's a lot of other tech you can get your hands on and play with, like Docker &amp; Kubernetes and CICD tools and such. But, honestly, that's reaching pretty far as you won't even understand why those tools exist until you see software development in the wild.  


  
If you don't want to work alone on a project built from scratch, look into some open-source stuff. There's tons and tons of projects that need contributors, so even if you can just fix bugs and write tests, you could get your hands dirty on a real project that's used by the industry."
"937","Go study oop, data structures, loops, databases. Ull encounter them a lot


- dev of 5 years."
"938","One thing Ive learned in CS that I apply at the start of every task is the concept of completeness. In CS 170 you do proofs and you have to logically assert that 100% of edge cases must be covered. All that practice really does prepare you for creating new features and data schemes because youve been trained to catch all the angles and think big enough to make a tech plan to cover everything. It also helps with thinking about edge cases to test your code. Operating systems has also come in handy a few times, permissions and all that."
"939","I think the theoretical stuff is where you gain the most understanding of how to write good code honestly. I understand that a front end dev probably does not need to know the intricacies of  how things like an operating system work, but a lot of people shipping code dont just write stuff for the web.
I dont think it is ever a bad thing to learn more about computers if you are going to be shipping code. My education, seemed to have prepare me relatively well for a job as an engineer and it was really theoretical."
"940","Get as many"" useful"" certifacations as you can."
"941","When I first entered a real job, testing was my biggest weakness.  My degree was extremely theoretical, but even we touched on some business principals and software development lifecycle stuff.  But testing? Nada.

I found it easy enough to learn new frameworks, languages, software development methodologies, etc, but it took me a while to get to grips on how and where to write good tests.  Tests are a big part of what separate maintainable code from spaghetti hell!"
