"","matrix.0..nrow...numComments..ncol...1."
"522","membership to the church of emacs"
"523","I use vim personally."
"524","You are literally hitler"
"525","Srs talk, it's high time emacs and vim users unite to look down upon the IDE users."
"526","deus vult"
"527","I use VSCode. What does that make me?"
"528","Vulnerable"
"529","&gt; vim 

\*Laughs in Visual Studio\*"
"530","&gt;\*Laughs in Visual Studio\*

\*Laughs in Rider\*"
"531","&gt; *Laughs in Rider*

Laughs in Visual Studio Code"
"532","&gt; Rider

Written java? FAIL
Cross-platform? Fail

Not even close"
"533","\&gt; visual studio

\&gt; cross-platform

pick one lmao

and visual studio for mac is not visual studio so that dont count."
"534","&gt;  mac

we are talking about computers, not toys"
"535","I use IntelliJ IDEA at work :D"
"536","everyone makes mistake

except vimmers

they are the mistake"
"537","WHY?!  VIM is so much better"
"538","I always thought emacs was the text editor used by like, the ""special"" programmers. You know the ones that are a little slow and couldn't learn vim?                      



**This message brought to you by vim gang**"
"539","[deleted]"
"540","I don't have time for those things when I'm maxing my efficiency, maybe ask someone who isn't a good worker?"
"541","I have met very few engineers who use emacs..."
"542","well those engineers need to ask father stallman for forgiveness"
"543","[deleted]"
"544","[deleted]"
"545","And the reason why so many senior engineers can't mentor or teach. They were self taught how to work in industry with the help of stack overflow."
"546","oh and you should bring donuts"
"547","the company doesnt expect much, but the interviewer does"
"548","When it crashes, read the logs instead of making random changes."
"549","underestimated comment here. learning how to diagnose problems by looking at stack traces and logs can set you apart when it comes to debugging problems."
"550","Problem solving ability.

Communication skills.

Some coding skill.

Learning ability.

Enthusiasm.

Curiosity.

No ego.

Pants.

(Some qualifications optional)"
"551","Pants are always optional at my office!"
"552","unicorn had mandatory"
"553","Tips for improving communication skills and enthusiasm?"
"554","Attentive persistence. Keep trying to get things done you are assigned. Know when to ask for help, too often you become an annoying burden to some people, not often enough, you waste time trying things that are never going to succeed.

Be mindful of others' time. Don't have meetings when an email could suffice.  Don't ask people questions every 15 minutes, ask them twice a day, bundle up your questions to only interrupt them once.

The most difficult thing for software pros is trying to find multiple hours of uninterrupted time to get into deep focus into what you are doing. Every interruption pulls them out of that focus and have to start over their thought process. Set up 15-30 minute meetings on their calendar immediately AFTER other meetings. If you set it up before, you may be making it difficult for them to prepare for the meeting, but that still may be okay, use your judgement.  If they have a block of time from 2pm - 5pm open, do it at 2pm, not at 3:30pm which would trash their focus in the middle of a 3 hour stretch.

Good communication skills, that you can share ideas clearly, both to other technical people and the business-type people who don't speak Python, C#, or JavaScript.

No ego. People early in their careers especially feel they have to prove themselves. Do it with your actions, not your words."
"555","Social skills. 

Seriously. You will be more likely to get the job if you seem like a good person to work with.

Obviously your technical skills will need to be up to scratch, but showing the interviewers that they're not going to hate you after spending 8 hours a day, 5 days a week working with you will go a long way. 

Full disclosure: based on my experience in Europe"
"556","I got leetcode mediums from Google (failed onsite), and leetcode hard from Amazon (failed web screening).

The offer I got had basic Java/OO questions (e.g. interface vs abstract class, name 3 design patterns..) and generic behavioural questions. Also talked about projects on my github."
"557","Oof they never taught us any of this stuff in college.."
"558","You didn't lean OOP in college?"
"559","Learned OOP but never even heard of design patterns... we did like 1 week on interface classes so that I know a little bit of."
"560","read the gang of 4 book"
"561","Most of the real answers are covered: Object Oriented Design, Data Structures and Algorithms, and basic time/space complexity. Some places will also expect you to know how to implement api's and frameworks, maybe IDE's, git or other version control is common, sometimes databases, etc.

So I'll just give you what my boss told me: ""I expect bare minimum technical knowledge. After that all I'm looking for is: the ability to learn and if you can think laterally. You meet that bar and I think I can work with you, that's good enough for me.""

He also said: ""You can teach anyone with at least some technical ability to write code, but you can't teach them how to learn or how to think outside the box, and if they can't do that they will only be able to go so far."""
"562","Many software developers don't have good communication skills. If you are in that camp, consider joining the likes of Toastmasters or anything to help with your communication skills. 

&gt; Also, when do graduates usually start looking for post-grad entry-level jobs?? Is now too soon?

Never. As you expect to graduate, you can apply early. There are hot months and cold months when it comes to when companies search for candidates. The top tier companies do not adhere to the recruiting schedules, but the reality is that you might have to gain experience at other places. 

Even if you are graduating a year from now, you can go to job fairs and ask the recruiter what they are looking for. They might not know, but at least you might be able to get a job description

Try to pace yourself. Also, some consulting companies are absolute shit. If they miss a phone call by more than 10 minutes, start wondering if you should keep talking to them. Make an Excel sheet of places you applied to both via contracting and full-time. 

ESPECIALLY keep track of which contracting companies got you any interviews and which ones have been a pain in the ass. Feel free to ask the recruiter if there's a homework assignment. I even ended up being asked to solve a mess that THEY created, and luckily I realized that I should nope out of ever talking to them ever again

The job hunting process can be stressful as hell. If a consultancy is causing you a lot of stress (example: continually missed phone calls/too many cold calls/they call you an hour late), dump them. 

I found myself having to micromanage recruiters, and realized that the ones I have to really micromanage usually end up not being worth it. Companies need to realize that recruiters are a face of your company. 

If you ever have worked with the likes of a Google recruiter, holy shit. It feels like they rolled out the red carpet. They are easy to get a hold of. They talk you every step of the way, and they are incredibly considerate.

For skills, a lot of the times, it'll be in job descriptions. There's also many hints about the company in the descriptions"
"563","This is why, as a returning student who finished his CS degree in his mid-30's, I found it incredibly easy to get an offer once I was able to get myself in front of interviewers face to face. I had built a really good toolkit of communication skills learned from jobs in other industries (primarily customer service and banking) and with my technical acumen, was able to stand out from the crowd because I could carry on both technical and soft skill conversations with ease. It cannot be understated enough how much gaining a really good understanding of how to communicate effectively can make the interview process much easier. Doing things like mock interviews and public speaking practice can help sharpen this skill."
"564","anywhere from nothing to multiple phds worth"
"565","definitely start applying asap"
"566","Be driven"
"567","Show the ability to learn. 

Work hard. 

Learn from your mistakes. Dont make the same mistake twice. 

Work hard. 

Actively seek out ways to improve yourself.

Show me all the above and Ill pay you well and put you in a position to thrive."
"568","Depends a lot on the company you're applying to. I've had some really simple interviews with LC easy, basic OOP, and problem solving. 

I felt that some of the interviews in the Bay we're honestly a little insane. LC Mediums / Hard + MapReduce system design questions + distributed system questions around concurrency, edge case handling, system failure handling through data and application redundancy. This was definitely material not taught in class and definitely required serious outside study to answer to a decent degree. I had interviews were I answered everything optimally (albeit a little slower than I would've liked) but didn't get the job.

The answer is that it varies."
"569","In an interview:

* mostly basic LC medium level type questions.

* communicate about what your overall approach is and what you're doing. If you ace the entire question but refuse to speak, you will probably get a weak yes. If you do not ace the question and refuse to speak, you will probably get a no. If you do acceptably on the question but communicate extremely well in a way that leads me to believe you know what you're doing and are on the right track, you will probably salvage at minimum a weak yes. 

* comments and unit tests in an interview are not necessary to me, but if you do them and still have time to finish I will be impressed

* OTOH, I *do* expect code to be well-factored, variables to be appropriately named, use functions as necessary, etc. Non-native English speakers in particular, this may be a place to improve. I beg of you, do not write your variable names in pinyin and then comment the Chinese characters.

On the job:

* basic terminal usage. It always amazes me when I hear about somebody in an interview or on the job who doesn't even know how to open the terminal. I'm not asking for anything fancy, just the basics.

* git or other version control. Again, nothing fancy, just the basics.

* ability to complete basic tasks with minimal assistance. Obviously there is ramping up on a code base, but you shouldn't need spoonfeeding of every minor step.

* communication skills. Communicate project status to the team and boss. Communicate blockers to whoever they're relevant to. Coordinate features with other teams that may own the part of the code base you need to change.

* ability to attempt to proactively problem solve. Did you Google it, search stack overflow, search the internal knowledge base, look at the code, talk to owning team, etc or do you have to run to your boss/tech lead any time anything goes slightly wrong?

* a database technology of some type, generally SQL. Nothing insane, but ability to write basic queries, some concept of database design.

* a statically typed language like java/c

* a dynamically typed language like Javascript, python, or ruby.

* ""Coachable"". Ability to take criticism positively and improve.

* motivation to learn and expand their role."
"570","Someone who asks a lot of questions, quick at learn and investigating problems, passion for CS"
"571","Things I needed to know that I didn't have 100% when I started were GitHub/git especially conflict resolution, jira, docker, postman, better debugging habbits, full stack debugging skills, and how to reach out for help after investigating thoroughly but not spending too much time on one issue."
"572","Be able to code, knowledge of fundamentals, especially data structures, and interest in learning. That's it, nothing else. Especially not knowledge/experience with specific languages or tools.

If your prospective manager, during an interview, places an undue emphasis on you knowing specifically version X.Y of a framework Z, or uses wording similar to ""we're a ${LANGUAGE} shop here"", run (provided you have the ability to do so)."
"573","Are you a good friend? Can you project that to a group of random people in an hour? This may depend on what type of team you are looking to join, but it was really important that we like the people we interview. Like a comedian working a room, you should be able to banter with your interviewer(s) without coming across as judgmental or abrasive.  Take an interest in them, they may appreciate it more than your leetcode efficiency."
"574","I want you to know how to solve problems, and know when to ask for help. I can teach you a language. I can't and don't have time to teach you problem solving and critical thinking. 

Don't put on your resume that you basically breathe air, trying to mask the fact you're a new engineer. I will know the second we start speaking.

Articulate to me why you like a specific language and at least show some excitement for trying new things. Embrace change.

These are the things all engineers I have managed or worked with have not been very good at in the past."
"575","I'm also graduating in May and I started looking at jobs around October, although I haven't started to actively apply until mid-January. I've been invited to the final onsite interview for a couple of companies so I think I have some advice I can give.

What I found is that showing genuine interest in a company and just being an overall nice person goes a long way. Asking questions specific to the company and/or your role shows interest. Also, admitting when you don't know something (but can reasonably logic it out) is much better than flailing around pretending you know it. Knowing how to think out loud is always a plus. Repeat the question and ask clarifying details if necessary. I think it also helps to have a trail of personal projects so companies know that you like learning new things and are a 'self-starter' (ugh, I hate that word)

In terms of technical skills, I've been asked about SQL queries, OOP fundamentals, some leetcode problems (easy/medium? I don't do leetcode), memory management, and also some case studies. They also ask about any internship experiences or anything else you've done (quantify your successes if possible). Behavioral questions I've been asked include 'Tell me about yourself', 'Why do you want to work here', 'What's your greatest strength/weakness', and 'Where do you see yourself in 5 years'."
"576","learn a version control, learn how to write a unit test, be able to pass a basic programming logic test like fizzbuzz level but won't necessarily be that. The first two are really me being a picky bitch, mildly sickened by having to explain those to people with years or experience. If the job title I was interviewing for said junior that's what I would ask. I used to fish for more knowledge basically for fun, but that backfires on the candidate when the manager who in the room who doesn't know things hears they don't know things.

You're going to want to apply at a larger company, not necessarily google(I mean give it a shot for lols why not) but something like accenture or generagl dynamics size/level; big but not a meme. Small companies with like a handful of devs don't have spare train junior spots/money. One of the things that keeps junior spots existing is seniors wanting them as almost a job perk/benefit, if you get a competent one just right and actually train them some you can totes pass what's annoying boring shit to you off onto them and they'll love it."
"577","Have 10 years of experience as a React developer /s  

But seriously, entry level implies that you have a sound understanding of basic design patterns and software engineering best practices, and perhaps have a basic understanding of things like SQL or NoSQL, testing, that you are curious and willing to learn, that you are willing to fail gracefully and learn from mistakes, that you can take direction from senior devs and not spin your wheels too long when you encounter a blocker, and that you have good work ethic."
"578","Really try and master OOP, DS, Algorithms.

Be comfortable in plain SQL. Select, Insert, joins, upserts, subqueries... 

Know a language fairly well.
Have projects demonstrating good fundamentals of OOP, DS, Algos.


Bonus points, learn a framework complementing the language you're good in and demonstrate comfort in that framework. Build a demonstration showing off that you know it.

How to interview: keep going back to your small projects when answring questions. Lean on it, as it's the only real experience you have.

Once you've got all the above, I would prep for interviews. Grind leetcode so you can pass OOP, DS, Algos. Yeah people hate it, but only morons would deny it's the primary filter for hiring. Don't waste the few opportunities you have to get an in person interview by blowing a coding assessment. Be smart and maximize your on-sites where you can lean on your projects."
"579","Why didnt anybody mention the typical 150 leetcode mediums? Without those its impossible to measure how qualified for the job you are."
"580","Did you do on campus interviews, did you do any internships?"
"581","Algorithms and data structures. The rest can be taught."
"582","Different employers expect different things.

Me, I just want someone who's friendly, ready to learn, not horrified by mistakes, and reasonably humble."
"583","I hope I find someone like you when the time comes for me to start job hunting. Honestly, some of the stuff people have listed in this thread as requirements for entry level (excluding the people that are obviously joking/exaggerating) is still too much for me. Seriously, if these are the minimum requirements for entry level I'm likely fucked.

Then again, I'm not locating near silicon valley (I'm in Michigan) and I don't hope to work at a big N. Not that I wouldn't like to, I just don't think I'll ever be that good. And if I am ever that good, it would be after years of experience at another job which I'd have to land first.

Things of concern in this thread:

* Design Patterns (vague statement, what does it even mean to know design patterns? There's 20+ of them in the Gang of Four book and hundreds of other ones like MVVM, MVC, JavaDAO, etc. Unreasonable request for entry level devs imo)
* Mastery of DS &amp; A (vague statement to begin with as there's hundreds or even thousands of well-known ones. Also, to me mastery implies being able to implement them yourself. Seems unreasonable unless you're trying for Google or something) To be clear, I think it's reasonable to expect a basic understanding of the fundamental data structures and algorithms such as binary search, stacks, queues, trees, arrays, lists, hash maps / hash tables, etc. But not mastery, just the basics of when to use them and SOME of the advantages / disadvantages of each.
* Git/GitHub basics being listed to include things like rebase and merge. I think it's reasonable to require a basic understanding of Version Control, but I don't think basic includes things like rebasing and merging. Basic to me is init, commit, push, pull, add, remove, commit messages, create a repository, clone a repository and configure your username / password.
* I think it's reasonable to expect a basic knowledge of SQL and databases, but asking for things like upserts (which I've never even heard of after obtaining an AAS in CS, using SQL in Java, C#, and taking an SQL CLEP class for BSCS) is unreasonable and some joins is even pushing the boundary between intermediate and basic imo. Basic to me is SELECT, INSERT, UPDATE, DELETE, CREATE TABLE, CREATE DATABASE, DROP TABLE, PRIMARY KEY, basic conditions such as WHERE statement and basic concepts like subqueries.

I think it's reasonable to expect entry level devs to have a GitHub account with some very basic personal projects on it, for code samples if nothing else.

It's also worth mentioning that I was definitely one of the best and most knowledgeable people in every class I took throughout my CS program at my local CC, so I think companies are going to be hard-pressed to find people to meet most of the requirements in this thread if they're truly entry level. Obviously you're getting this from the perspective of an unemployed CS student from a non-ivy league college, but I have been programming for about four years and most of what I'm reading in this thread scares the shit out of me."
"584","&gt; Honestly, some of the stuff people have listed in this thread as requirements for entry level 

Are nonsense.  Don't worry.  Almost nobody can meet these requirements.

.

&gt; Design Patterns (vague statement, what does it even mean to know design patterns? 

[You read the book](https://en.wikipedia.org/wiki/Design_Patterns).

.

&gt; the book ... Unreasonable request for entry level devs imo)

`Design Patterns` just isn't that big of a deal.  It's super OO oriented and, in most real world cases, companies aren't very OO.

.

&gt; Mastery of DS &amp; A

Most senior devs I know can't do basic datastructure shit.

This is largely a shibboleth, and you mostly won't need it after interviews.  People do this because they think they're supposed to.

.

&gt; Git/GitHub basics being listed to include things like rebase and merge. 

This actually matters.

.

&gt; I think it's reasonable to expect a basic knowledge of SQL and databases

I don't.  Most of the devs at work couldn't write a `select` to save their lives.

.

&gt; It's also worth mentioning that I was definitely one of the best and most knowledgeable people in every class I took

Sorry, bitter pill time

1. Nobody cares
1. If you say this nobody believes you
1. This sounds like bragging.  Don't sound like you're bragging

.

&gt; I have been programming for about four years and most of what I'm reading in this thread scares the shit out of me.

Literally none of the principals or department leads where I work (100+m company) would pass this subreddit's idea of a junior

This is where juniors come to insist the one thing they're good at is the thing you must be good at too

Go make a webpage, life's fine"
"585","Personally I would not be able to just read that design patterns book and be able to say in good faith that I know those patterns. Knowing the patterns to me means being able to implement them, not just knowing that they exist. That would take a lot of time and practice in addition to reading the book, at least for me.

Also it was not my intention to brag. I attended a no-name community college so it's not like doing well there means anything. I said that to illustrate the point that, if I'm among the top of my class and, by this sub's standards I'm not even fit for entry level, where are employers going to find these magical ""entry level"" candidates that are experts in everything?"
"586","&gt; Personally I would not be able to just read that design patterns book and be able to say in good faith that I know those patterns.

It's not actually the patterns that you're supposed to learn.  It's what a pattern is and how it's used.

Again, though, this is a false flag.  Of the ~90 developers in my office, best guess five of them could even identify half of the design patterns verbally by title

.

&gt; Also it was not my intention to brag

I know `:)`

.

&gt; where are employers going to find these magical ""entry level"" candidates 

They aren't.  The people described in this sub are fictional

It's like that meme that goes around that a man has to be 7'1"", have a 15"" dick, a seven figure job, 25 hours a day at home for the family, et cetera.

Stop taking it seriously.  It's not real

."
"587","&gt; Also, when do graduates usually start looking for post-grad entry-level jobs?? Is now too soon?

Now is the perfect time actually

&gt; Do employers expect entry-level SWEs to be great at DS and A, design patterns, OOP, etc?

Most don't, unless it's Cali"
"588","They look for enthusiasm.

They look for the willingness to learn new things and the ability to learn fast. 

And finally they expect you to be able to solve well-defined problems, e.g: translate this mock into front-end code, write some code to implement a certain feature that's already well defined with certain tickets. This is opposed to more senior roles where they expect you to take more ownership and also solve more ambiguous problems like ""make the app perform better""."
"589","You should definitely be looking now, it's never too early. I started applications the fall before I graduated and landed my offer a whole 7 months prior to graduation. I know my company as well as others dish out its offers early, so it's best to be on top of it"
"590","Classical CS education from a good university. Good grades, and/or enthusiasm for the studies. Decent grasp of theoretical cs concepts.

Ideally some mastery of ""missing semester"" skills. Can actually take an off-the-shelf PC and use it to make software.

Not a dick, can bear to be in the same room as them

Turns up on time

Any hobbies, activities or achievements that demonstrate hard work, intelligence, leadership or social conciousness.



You can start applying whenever you want. Now would be fine for a May/June start"
"591","* That you put effort into learning the ins and outs of your job. 

* That you will work towards a proficiency where take pride in your work. 

* listen to and ask questions about advice, but dont ignore it, good colleagues will help you help yourself."
