"","matrix.0..nrow...numComments..ncol...1."
"1","[I like to view DS as a venn diagram](https://1.bp.blogspot.com/-ju4m6PBOrgo/V-E5qz99SaI/AAAAAAAAMF0/gle0zsZz_nIBEMVg0EdZHoGJhjlnBzv1gCLcB/s1600/moz-screenshot-3-729576.png)  
  
To really be a great data scientist, you need expertise in these 3 areas. If you have domain experience and programming/database but lack the math/statistics, then theres not any useful analysis you can do. This would be a software engineer/developer. If you have domain experience and math/statistics but lack the programming/databases experience, then youre more of a traditional statistician or data analyst. Finally, if you have the math/statistics and programming/database experience without the domain knowledge, then you know enough to be dangerous, but youll have a hard time knowing what questions to ask and how to go about answering questions in certain domains.   
  
Now most of the things you listed out fall into the stats/math. One thing I want to point out is you're typing out different machine learning algorithms which isn't necessarily a ""skill"". It would be more accurate if you listed out the category of machine learning algorithms instead and what they're accomplishing. Example -  
  
Machine learning - supervised learning  
Machine learning - unsupervised learning  
Machine learning - NLP 
Machine learning - Deep Learning/NN  
  
You would be better off becoming an ""expert"" in one of these areas instead of trying to be an expert in them all. For example, I would say I'm an expert in supervised learning. I haven't really done too much unsupervised learning, NLP or deep learning/NN and the main reason is because I haven't really had the need too. Now keep in mind that I still know what each of these categories are doing and I stay up to date on the relevant algorithms/techniques.  
  
Then circling back to the venn diagram, you'll have a hard time implementing these algorithms if you don't know programming and you'll have a hard time coming up with Hypothesis or A/B testing without the domain experience. 
  
I would recommend that most noobies/beginners start with supervised learning as its the easiest to get started with and easiest to validate. Once you understand how machine learning works, the goal and the basics then it's easier to start moving into the other categories."
"2","Great. I lack domain knowledge and I'm not sure how to gain it without actualy working in the industry. Then there are requirements given in job ads or interviews. For example time series keeps coming up and it's a topic I personally like as well.

Still ""supervised learning"" is a huge subject. For example I heard about Gaussian process regression just a few days ago from an employer.

&amp;#x200B;

Ironically my scientific research uses mostly unsupervised learning (clustering) but SL methods come up much more in job ads."
"3","The amount of domain knowledge needed is dependent on the domain. For example, if you're doing data science at an e-commerce company, it shouldn't be too hard to learn that domain knowledge compared to something like biology/healthcare. IMO the important part here is getting a job in a domain that you actually enjoy.  
  
&gt; Still ""supervised learning"" is a huge subject. For example I heard about Gaussian process regression just a few days ago from an employer.  
  
Agreed. When I started, my mentor told me to pick an algorithm and become an expert in it. I went with gradient boosting because it was the most popular and one of the best algorithms for handling tabular data (which it still is). Starting with a complex model like gradient boosting made it easier for me to learn other less complex models. I use gradient boosting (LightGBM package to be exact) for almost every model I build. It works great and there is good packages for determining things like feature importance so you can gain insight into how the model is making decisions compared to a black box model.  
  
I've done unsupervised a couple times and that was really more for exploratory analysis purposes where were trying to see if there is certain segments in the data. I also used this for an RFM analysis once and it worked well.  
  
For me, in the beginning I mainly stuck to topics that I could apply at my job which helped because I could implement them on real data. I'm actually working on a book idea that will give a learning path for beginners and then another book for going from junior developer to mid/senior level. I'll keep you posted on that."
"4","Great advice. In terms of topic I like time series most, and they are very useful too. But in terms of an algorithm, I'm not sure yet. (ARIMA is becoming old school!)  GB is very interesting for sure...and so are RNNs. And sure, please keep me posted on your books."
"5","The problem with an unranked list is that it makes each item seem equally important, and/or that the effort to learn (or ""master"") them is equivalent. They are not. 

Any new-grad stats PhD out of school probably has exposure to every single item on that list, and probably has ""mastered"" 70% of those, if by mastery you mean know it better than say 80% of data scientists/analysts. The only things they probably don't have much exposure in that list might be SQL and productionization. Beyond a certain point, there are common threads. 

However, that doesn't necessarily make them the perfect data scientists. You don't really need mastery of everything to be effective. You need to know how to drive business value to be effective, you need to know how to work effectively in an organization, etc. 

So stop worrying about how everything here relates, or if there's an ""optimal"" subset that you should learn. Learn what you want or need for what you're doing right now. Get an entry-level role/internship in the field, or otherwise get exposure to what data analysts/scientists do their job, and over time you'll figure out what's important, and figure out what level of ""mastery"" you actually need for each. These vary a lot by industry, role, and region."
"6","Yeah that must be why corporates want candidates with industry experience. I feel I'm too old for an internship but I just applied for a postdoc position that involves using ML for an engineering project."
"7","So knowledge of data frames, linear/logistic regression, and hypothesis testing are essential.  All the other things?  Who cares?  Write decent code.  Know applied statistics."
"8","I would have to do a factor analysis to figure that out. =D"
"9","/r/DataScience"
"10","Your IB skills with Excel will translate well for most analytics roles. You've already been working in analytics and simply have to upgrade your toolkit. My recommendation is to focus on the pandas library of Python to replicate work you would do in Excel. (Vlookup to pd.merge, selecting columns and rows, pivot table to groupby and pivot_table).

A large amount of not majority of data scientist roles are analytics type roles."
"11","Alternate title: The 7- in-demand Data Science Skills Companies Need"
"12","Do you want to end up in business -&gt;Excel

Classic research / IO PhD -&gt; R

Methods / more complicated Research / big data / ... -&gt; Python

But a bit of everything might be a great start. Don't forget to enjoy your life though :)"
"13","I think a little more of a dive into excel would be valuable (vlookups, if statements). Whether you like it or not youre almost always going to have to work with excel even though your data cleaning should almost always be in R/Python. As you mentioned basic SQL is valuable.

Some kind of viz tool (tableau, google data studio,etc.). Most schools offer a free version of at least one of the major visualizations tools. 

Also regarding R/Python - most shops Ive spoken to use R  but Id say getting a sample survey data set and running some of the different analyses (regression,t-tests, cluster analysis) you learn in school will be valuable. Have to be careful about you how you about learning it because a lot of the online classes dont use HR datasets so Id recommend practicing on one of those from the jump. 

Also, these are all company/industry specific. I know some people in finance that have never used SQL but its definitely a good tool to have. 

Feel free to message me if you have any other questions Ive trained multiple interns, workforce analysts on developing these skills."
"14","Learning to write functions for data cleaning and quick exploratory analysis in Python using pandas has saved me tons of time I would have wasted in Excel. Though you can probably do that in R as well. But I dont use R.

Also, learning how to utilize APIs and web scraping might be useful depending on your job."
"15","Thank you! Are there any specific functions on data cleaning youd recommend?"
"16","Its hard to name anything specific because there are so many and it rlly depends on your needs. I usually write my own functions with the built in methods pandas offers so I would just recommend a tutorial on pandas.

But heres a cheat sheet from data camp I find myself referring to a lot: 

http://datacamp-community-prod.s3.amazonaws.com/dbed353d-2757-4617-8206-8767ab379ab3"
"17","In R, you should learn basic data structures, data types, indexing, filtering, vectorization, control structures, and the apply family."
"18","In addition to what everyone has mentioned here I want to mention the little known but super powerful data tool of a good word processor. I prefer Sublime Text but many will use Notepad++. There are so many uses for programs like these when analyzing data. 

1. You can use them as a code check (you tell it what kind of code you are writing and it does highlighting).

2. You can do powerful find/replace commands. I have taken rows of Excel strings that I want to convert into a comma list for use in R that take seconds to format in Sublime. Find and replace ""\n"" "", "" to turn every new line entry into a comma separated list that can be copied and pasted into R/Python.

3. Ctrl+Shift+K otherwise known as multiple selections. You can edit in more than one place at once. It works as a quick substitute for find and replace, or to apply the same sequence of changes to multiple lines simultaneously. Basically, let's say you want to add the same text to 40 lines of code but in different places. You can multiple select all the places you want something then type it out and it appears in every selection space.

4. It doesn't use those damn fake quotation makes like Word does. So you can copy and paste into terminals, programs, etc. without worry that it will give you an error since Word uses non-utf-8 quotation marks.

5. Tabs. 

6. Save on exit. 

7. Looks cool. 

8. You can brag to the other nerds around the water cooler about some new hotkey you learned."
"19","Good advice. I write pretty much everything in np++. I love how it saves my stuff even if my battery dies. I never charge my laptop at home, so I often sit down, dock my machine, and realize it died."
"20","Got laughed the other day by a ""data scientist"" consultant... he was trying to tell me that the more people paid for a service, they were more loyal to it because they saw more value in it.. they measured it by churn. I asked how we didn't know it wasn't the other way around, that consumers who were less likely to churn also were willing to pay more, and that as you raised price you scared away more churn-likely consumers.. a few blanks stares later and it devolved into me explaining to the fellow the whole causation vs correlation fallacy in statistics."
"21","You had me at consultant"
"22","[deleted]"
"23","There tends to be an inverse relationship between the size of a consultant's paycheck and the value they generate... so yes, they're probably making good money."
"24","This has to be why I failed as a consultant. I just could not sell people on our data that would never do what they wanted it to."
"25","Honesty is often times at odds with profit.

Hell, having known a lot of hustlers making a good living through questionable channels and activities, I almost wanted to say honesty is actively forbidding people from becoming wealthy."
"26","For ""profit"" defined broadly enough to include political power-building of mid-level managers looking to make a name for themselves."
"27","Yeah, any sort of personal gain, really."
"28","Generally no, but its consulting company for sure."
"29","I laughed out loud at this comment. I would give you gold if I had money. Lmao."
"30","Yea, it annoys the hell out of me because I am a consultant and I actually have a mathematics and STEM background (chemistry and biology), and these jokesters come along with their few coursera classes claiming to be knowledgeable.

Or my wife who is a data scientist and has a masters in statistics and operations research. The team's she is on is really good, but when she has to work with contractors, they encounter some like that. It's just like... How did you manage to get here?"
"31","I've decided the only people who put actual value on coursera (or website of choice) certs are people who have never done them. You can basically turn your brain off, half-ass it, then get the cert.

I'm of the opinion it's better to ask to see a few projects they've done. Even if they're just personal side projects, it's still better than some online certificate from courses of varying rigor and use."
"32","It's true that many days scientists aren't particularly knowledgeable about statistics. However, I've started to see more and more job postings for statistically literate people, especially people with knowledge of causal inference (what I believe to be the next hot thing in data science/analytics)."
"33","Then I hope that I am still on the right track with my MA in Economics and Data Science, as the topic of causal inference / stats plays a decisive role here. I always thought I would have to add a second Master in CS to be employable in DS at all. :)"
"34","Econometrics (well Econ as a whole as well) and Data Science are so well-poised to come together... Look up Susan Athey. CS is a great skill of course, Python and maybe some R development knowledge (not just DS) will make life a lot easier. :)"
"35","In addition to Susan Athey (who is an absolute rockstar)

\- Judea Pearl

\- Guido Imbens

\- Andrew Gelman

\- Technomists out of Netflix/Google/Ebay/Microsoft/Amazon/(Legacy) Yahoo Research Labs [Preston McAfee, Randall Lewis, Justin Rao, Chris Nosko]"
"36","Thank you very much for your recommendation! This is precisely the research that I think will establish itself in the field of economics over the next few years."
"37","Judea Pearl would agree with your opinion. He wrote a whole book on that issue."
"38","Yes, Pearl and his do-calculus is one of the theoretical frameworks related to causal inference. The NeymanRubinHolland model with potential outcomes is another. Moreover, at my old university they were studying some sort of hybrid framework that would combine graphs and potential outcomes via so-called ""node splitting""."
"39","I got very interested on this, do you know the name of the researchers or could you at least give me the name of the university so I can look into it? (For the node splitting part)"
"40","Sorry, I graduated years ago and that work was done by my professors in recently started research projects, so I don't know if anything has been published yet. However, it seems like others are trying to combine causal graphs with potential outcomessee for instance: https://www.researchgate.net/publication/331670633_A_Potential_Outcomes_Calculus_for_Identifying_Conditional_Path-Specific_Effects.

More specifically, node splitting is at least discussed here, but I can't say if their approach is similar: https://youtu.be/NpNTfvbE1gY."
"41","Thomas Richardson and Jamie Robins, Single World Intervention Graphs. Theres probably some YouTube videos on it."
"42","Have worked with a guy who got in the top 5% in multiple Kaggle competitions. He was self-taught, haven't heard about t-test, and had very vague ideas about causation. Still helped us to develop a complex data pipeline, designed a couple of models still used in production, and finally got poached by a competitor.

In my experience, having a good statistical foundation helps, but it is not mandatory, especially if your task is to provide predictions, not inferences."
"43","Honestly I think this entire discussion is about prediction vs inference. As you said, statistical background isnt a total necessity when tasks only consist of prediction. Who cares about q-q plots when all thats being built is black box models?"
"44","I guess the issue arises when management/outsiders start to conflate prediction with inference. I recently helped out with a clinical research project where the the lab interpreted lasso selection as an oracle for finding the true ""important"" predictors. It was difficult to explain to them the lack of any statistical guarantees of the variable selection, especially given that we had *p &gt; n*.

I've heard many data scientists say that communicating the results is a huge part of the job, and I think it's at least important to be able to address the inferential limitations of predictive black box models."
"45","Check out some papers by Chernozhukov and Belloni on Lasso. They show that in a p&gt;n setting you can get causal inference by doing something called double-selection in Lasso."
"46","And isn't anything above linear/logistic regression essential a black box? 
It's my opinion that if you need a complex model be it tree based or deep learning, then your data simply is very complex and you can't make any simple conclusions from it that you can directly implement in real-world."
"47","And this is why in bioinformatics (and biology in general), we always have to go validate our results in the lab. The discussion is always, ""Yeah, cool, so you found 10 major driver genes... Did any of them actually work though?""

It's a pretty interesting debate we have, because sometimes good statistics just doesn't work in the lab, whereas some, not *bad*, but, less than ideal, statistics finds ""real"" hits."
"48","Forgive my ignorance but isn't inference important when doing predictions? I'd love to hear where this breaks down as I'm not knowledgable enough about statistics."
"49","To my understanding... The difference is the *focus*.

Inference is more concerned with the ""why"" and digging into the relationships between things.

Like finding the extent to which age affects the probability of someone not defaulting on a loan.

Inference is useful for decision support. Like... ""Variable A is the main reason why we lose customers. So let's target that to reduce churn"".

Whereas prediction is a ""proof is in the pudding"" focus. Even though prediction is built upon inferential statistics.

So the focus would be in accurately predicting who will default on loans rather than the ""why"" behind each particular variable.

However... with the credibility and explainability crisis I expect that a greater focus will be on the why questions in the near future. More and more regulation will be in place forcing data scientists to explain how and why their algorithm made its decision. 

So I think in the future, the simple and models with explainable outcomes will tend to triumph for most business use cases. Those algorithms will stand up to audits and would facilitate things like a customers right to know why they were denied a loan.

This may not be a 100% accurate explanation, but according to Cunninghams Law... if its not then we will know soon."
"50","As you said, often times the two are intertwined, interpretibility is huge area of research for a reason. You need to explain why you made a prediction, and inherent to that is some implicit causality.

I don't think it means that nn and tree models are going away, but understanding how to interpret models correctly is part of the prediction skill set imo."
"51","I suppose this is exactly why DS folks shouldn't de-emphasize inferential statistics."
"52","Hear here!"
"53","Aye aye!"
"54","On a completely un-related note.....

Your flair says that your a DS in Healthcare.

Can I ask what your background is and how you got into Healthcare as a Data Scientist?"
"55","I'll dm you."
"56","I'm a PhD in the biosciences trying to learn data science as well; so I'm curious too :)"
"57","It can matter if you want to know the best levers you need to pull to improve the prediction (in context of the model).

E.g. -- deciding compensation for hiring one more sales persons with background knowledge X results in Y sales."
"58","The thing is, data science is a broad field. Those who have all the skills are extremely rare. The best thing is to get a team that has all the skills and have them work together."
"59","I agree. We also have someone like that and he developed end to end solutions and delivered it to the customers beautifully. A large tech company in SFO area poached him. This person had a very basic stats understanding."
"60","I think it's about the right domain.

Prediction is *wonderful* if fundamental things about the world don't change. Marketing response prediction works great until bad press hits (e.g. Wells Fargo). It's enormously difficult to pivot from reduced form models (typical builds for prediction) to structural models needed to disentangle deep parameters -- and even those aren't fool proof!"
"61","This discussion is as old as data science and it's very close to discussions in CS about 'real programmers'. I will tell you something as someone, who worked in data science for several years: statistical theory in data science is pretty overrated. It's not that you don't need it, but what you describe is not a lack of understanding math, it's a lack of common sense and domain understanding. 

Data Science at the university is research oriented and in the industry it's pretty rare, that you are able to dive deep into methodologies. Usually understanding your domain is much more important. Furthermore, visualization and storytelling are the most important skills as a data scientist in advanced analytics. The truth is, that data science is not different to other roles. In the end it does not matter if much if your findings are 100% correct as long, they look impressive to your stakeholders and just work. 

When we look at predictive analytics, it gets even more interesting. People build models, which predict the cause of a feature or include data leakage and promote the huge accuracy model as breakthrough, without being skeptical. You dont need a deep understanding of stats, to understand that it does not give you much benefit to use these predictions. In the end the model will just not work.

The good thing is, all these wrong assuptions and results are usually discovered later on (A/B tests, KPIs, whatever) and you learn from it. I doubt that statistical theory helps you to avoid all these mistakes in a **time-efficient** way."
"62","&gt;but what you describe is not a lack of understanding math, it's a lack of common sense and domain understanding.

The OLS example in the OP is a clear example of not understanding ""the math"""
"63","I guess you are right in with this example, but the general message, should be clear."
"64","I feel like this discussion blows up monthly in our sub and the consensus never changes:

Yes, most data science training is woefully inadequate. Yes, exceptions do exist. Yes, data science is poorly defined. etc. etc. etc. 

Unless someone can bring something new to the table, I dont understand why this discussion keeps getting upvotes. Genuinely, can someone answer why? Am I missing something?

OP, to be clear, Im not complaining about your post specifically. Im complaining about the meta in our sub."
"65","[deleted]"
"66","Why is this subreddit so concerned with ""gatekeeping""? I've literally never heard of that term until I started reading this sub"
"67","[deleted]"
"68","I love data science, but I don't have a strong enough background in statistics to actually be a True Data Scientist "", this sub's only acceptable definition. In a way, this sub was the reason I put my plan of a masters data science in the back burner because I wanted to focus on stats more. But when you put it this way, I guess I'm being foolish to wait until I'm completely ready to be data scientist.

I guess, eventually, all niche skills will evolve enough that you won't need in-depth understanding to be in that profession. You don't have to know formal languages to be an IT Admin, or you don't have to have a masters in finance to use an accounting software."
"69","You need to get out more into more diverse groups if this is the only place you've heard of gatekeeping"
"70","Really? r/gatekeeping is several times larger than this sub, so that's suprising."
"71","It's a common term -- just means setting up standards (usually arbitrary and unachievable). A reverse ""no true scotsman"" as it were."
"72","Oh you haven't heard of gatekeeping? Welcome to data science. It's filled with gatekeepers."
"73","[deleted]"
"74","I don't really see complaining about people who call themselves Data Scientists having little or no knowledge of basic statistics as ""gatekeeping""."
"75","""If you haven't seen it, it's new to you."" ~NBC"
